,id,text,author_title,stemmed_text
1587,1587,matce pieśń pieśń łzy pieśń słów świat dziecinnych wskrzeszonych matko sny jesteś blisko wówczas klęczałaś kołyską serce twe świętość warg dobroć rąk śpiewać pieśń twoich nóg bym cicho kląkł wybrałbym najświętsze słów rzekłbym „matko” znikłbym pieśń pieśń słów przychodzą życiu dni powodzi zdradza zawodzi pociąg szczęścia dal odchodzi wraca zło wiary twierdz grunt usuwa kładka trwa ostatka umie zdradzić matka serce najczystsze serc matce pieśń pieśń łzy pieśń słów świat dziecinnych wskrzeszonych matko sny jesteś blisko wówczas klęczałaś kołyską serce twe świętość warg dobroć rąk śpiewać pieśń twoich nóg bym cicho kląkł wybrałbym najświętsze słów rzekłbym „matko” znikłbym pieśń pieśń słów,krzysztof_krawczyk-piesn_o_matce,matka pieśń pieśń łza pieśń słowo świat dziecinny wskrzesić matka sen:s1 być blisko:d wówczas klęczeć kołyska serce twój:a świętość warga dobroć ręka śpiewać pieśń twój:a noga by:q cicho klęknąć wybrać święty:a słowo rzec:v1 „ zniknąć pieśń pieśń słowo przychodzić życie dzień:s1 powódź zdradzać zawodzić pociąg szczęście dal odchodzić wracać:v1 zło wiara twierdza grunt usuwać kładka trwać ostatek um zdradzić matka serce czysty serce matka pieśń pieśń łza pieśń słowo świat dziecinny wskrzesić matka sen:s1 być blisko:d wówczas klęczeć kołyska serce twój:a świętość warga dobroć ręka śpiewać pieśń twój:a noga by:q cicho klęknąć wybrać święty:a słowo rzec:v1 „ zniknąć pieśń pieśń słowo
1588,1588,widzi uśmiech zna myśli przerywa pół zdania choć wie chcesz powiedzieć przeżył czym marzysz każdą chwil oddałby wspomnienia byś zrozumiał końcu życiu ważne czuje życiu ważne masz oczach tyle radości twych niepokoju wciąż peszy szczerość wie kim naprawdę jesteś gdybyś przeżył trwonił byś słów miałbyś czasu naprawdę żyć życiu ważne czuje życiu ważne masz świat ciągle zmienia dogonisz wiem możesz szczęśliwy powietrze ciepłe tuli snu zobacz przyszła wiosna lepiej chodźmy wysłuchaj życiu ważne czuje życiu ważne masz świat ciągle zmienia dogonisz wiem możesz szczęśliwy bądź szczęśliwy,krzysztof_krawczyk-to_co_w_zyciu_wazne,widzieć uśmiech znać:v myślić przerywać:v1 póła zdanie choć:c wiedzieć chcieć powiedzieć przeżyć czy:q marzyć każdy chwila oddać wspomnienie by:q zrozumieć koniec życie ważny czuć:v życie ważny mieć oko:s2 tyli radość twój:a niepokój wciąż peszyć szczerość wiedzieć ki naprawdę:i być gdyby:c przeżyć trwonić by:q słowo mieć czas:s naprawdę:i życie życie ważny czuć:v życie ważny mieć świat ciągle zmieniać dogonić wiedzieć móc szczęśliwy powietrze ciepły tul sen:s1 zobaczyć przyszły wiosna dobrze chodzić wysłuchać życie ważny czuć:v życie ważny mieć świat ciągle zmieniać dogonić wiedzieć móc szczęśliwy bądź:j szczęśliwy
1589,1589,krótki dzień słów litości czas oszczędza każdym krokiem większy smak życie umiem załamywać rąk żałować przeszło tyle czeka odkrycie przytul życie szczęście wielkie przytul ukryciu widzę odbicie oczach twych nikt powie lepiej mogło krótki dzień słów pewnie zostanie mówię godzin liczę x przytul życie szczęście wielkie przytul ukryciu widzę odbicie oczach twych nikt powie lepiej mogło x nikt powie lepiej mogło,krzysztof_krawczyk-przytul_mnie_zycie,krótki dzień:s1 słowo litość czas:v oszczędzać każdy krok wielki:a smak życie umieć załamywać ręka żałować przeszło tyli czekać odkrycie:d przytulić życie szczęście wielki:a przytulić ukrycie widzieć odbicie oko:s2 twój:a nikt powiedzieć dobrze móc krótki dzień:s1 słowo pewnie:d1 zostać mówić godzina liczyć X przytulić życie szczęście wielki:a przytulić ukrycie widzieć odbicie oko:s2 twój:a nikt powiedzieć dobrze móc X nikt powiedzieć dobrze móc
1590,1590,kiedyś stanął brzegiem szukał ludzi gotowych pójść łowić serca słów bożych prawdą panie spojrzałeś usta wyrzekły me imię swoją barkę pozostawiam brzegu razem nowy zacznę łów ubogim człowiekiem skarbem ręce gotowe pracy pójść czyste serce potrzebujesz mych dłoni mego serca młodego zapałem mych kropli potu samotności wypłyniemy razem łowić serca morzach dusz ludzkich twej prawdy siecią słowem życia,krzysztof_krawczyk-barka,kiedy:c stanąć brzeg szukać człowiek gotowy pójście łowić serce słowo boży prawda:s pani spojrzeć usta wyrzec mój:a imię swój barka pozostawiać:v1 brzeg razem nowy:a zacząć łów ubogi:a człowiek skarb ręka gotowy praca pójście czysty serce potrzebować mój:a dłoń mój:a serce młody:a zapał mój:a kropla pot samotność wypłynąć razem łowić serce morze dusz ludzki twój:a prawda:s sieć słowo życie
1591,1591,gdybym miał gitarę bym grał opowiedziałbym swej miłości którą przeżyłem opowiedziałbym swej miłości którą przeżyłem czarne oczy gdybym miał czarne cudne oczęta serce dusze bym dał czarne cudne oczęta serce dusze bym dał fajki palę wódki piję żalu żalu wielkiego ledwie żyję żalu żalu wielkiego ledwo żyję czarne oczy ludzie mówią głupi brał dziewczę czarne figlarne mocno pokochał dziewczę czarne figlarne mocno pokochał czarne oczy,krzysztof_krawczyk-a_wszystko_te_czarne_oczy,gdyby:c mieć gitara by:q grać opowiedzieć swój miłość który przeżyć opowiedzieć swój miłość który przeżyć czarny:a oczyć gdyby:c mieć czarny:a cudny oczęta serce dusz by:q dać czarny:a cudny oczęta serce dusz by:q dać fajka pala wódka pić żal:s żal:s wielki:a ledwie:d żyć żal:s żal:s wielki:a ledwo:d żyć czarny:a oczyć lud:s1 mówić głupi:a brać:v dziewczę czarny:a figlarny mocno pokochać dziewczę czarny:a figlarny mocno pokochać czarny:a oczyć
1592,1592,sięgasz kieliszek wina uciec codziennych trosk radością wspiera dziewczyna uśmiecha los miałeś życiu szczęścia spadł cios powroty odejścia życie krótkie pić marne wino życie krótkie miłości dać zginąć życie krótkie spieszyć życie krótkie cieszyć taniec życia porywa idziesz wcale zwykły tan wypijasz kieliszek wina duszy gra życie krótkie pić marne wino życie krótkie miłości dać zginąć życie krótkie spieszyć życie krótkie cieszyć życie krótkie pić marne wino życie krótkie miłości dać zginąć życie krótkie spieszyć życie krótkie cieszyć życie krótkie pić marne wino,krzysztof_krawczyk-zycie_jak_wino,sięgać kieliszek wina uciec codzienny troska radość wspierać dziewczyna uśmiechać los mieć życie szczęście spaść:v1 cios powrót odejście życie krótki picie marny wino życie krótki miłość dać zginąć życie krótki spieszyć:v1 życie krótki cieszyć taniec życie porywać iść wcale zwykły:a1 tan wypijać kieliszek wina dusza gra życie krótki picie marny wino życie krótki miłość dać zginąć życie krótki spieszyć:v1 życie krótki cieszyć życie krótki picie marny wino życie krótki miłość dać zginąć życie krótki spieszyć:v1 życie krótki cieszyć życie krótki picie marny wino
1593,1593,mówisz uparcie milczysz – długo chcesz deszczu moknąć zmarzłem kość chodź czeka domu rumu łyk chodź czeka kąt chodź czeka tyle wspomnień – chodźmy stąd chodźmy stąd przemokły drzewa ptaki latarniach światło ledwie tli – pada ciągle pada tkwisz okna puka świt bramie zazgrzytał klucz – chodźmy chodźmy deszcz pada zmarzłem kość chodź czeka domu rumu łyk chodź czeka kąt chodź czeka tyle wspomnień – chodźmy stąd chodźmy stąd przemokły drzewa ptaki latarniach światło ledwie tli – pada ciągle pada tkwisz okna puka świt bramie zazgrzytał klucz – chodźmy chodźmy deszcz pada deszcz pada,krzysztof_krawczyk-deszczowe_spotkanie,mówić uparcie:d milczeć – długo chcieć deszcz moknąć zmarznąć kość chodzić czekać dom rum:s łyk:s1 chodzić czekać kąt chodzić czekać tyli wspomnienie – chodzić stąd chodzić stąd przemokły drzewo ptak latarnia światło:d ledwie:d tlić – padać:v1 ciągle padać:v1 tkwieć okno pukać świt bram zazgrzytać klucz – chodzić chodzić deszcz padać:v1 zmarznąć kość chodzić czekać dom rum:s łyk:s1 chodzić czekać kąt chodzić czekać tyli wspomnienie – chodzić stąd chodzić stąd przemokły drzewo ptak latarnia światło:d ledwie:d tlić – padać:v1 ciągle padać:v1 tkwieć okno pukać świt bram zazgrzytać klucz – chodzić chodzić deszcz padać:v1 deszcz padać:v1
1594,1594,cisza wokół wciąż próżno chcę swój los okłamać raz przymykam oczy ukryć twarz ramionach nocy próżno czekam świt rękę poda obetrze oczu łzy bliski midnight lady mego snu czekam dzień dniu wiem kiedyś wróci choć daleka bliska midnight lady mego snu czekam dzień dniu wiem kiedyś wróci wiem wróci choć zapomnieć chcę pamięci chowam pogubione najprostsze słowa czas uniósł dal cienie zostawił żal wspomnienie choć przyjdą nowe dni choć przyśnią sny zastąpi nikt będziesz midnight lady mego snu czekam dzień dniu wiem kiedyś wróci choć daleka bliska midnight lady mego snu czekam dzień dniu wiem kiedyś wróci wiem wróci,krzysztof_krawczyk-midnight_lady,cisza wokół:d wciąż próżno chcieć swój los okłamać raz:s1 przymykać oczyć ukrycie twarz ramię noc próżno czekać świt ręka podać obetrzeć oko:s2 łza bliski midnight lady mój:a sen:s1 czekać dzień:s1 dzień:s1 wiedzieć kiedy:c wrócić:v1 choć:c daleki bliski midnight lady mój:a sen:s1 czekać dzień:s1 dzień:s1 wiedzieć kiedy:c wrócić:v1 wiedzieć wrócić:v1 choć:c zapomnieć chcieć pamięć chować pogubić prosty:a słowo czas:v unieść dal cień zostawić żal:v wspomnienie choć:c przyjść nowy:a dzień:s1 choć:c przyśnić:v1 sen:s1 zastąpić nikt być midnight lady mój:a sen:s1 czekać dzień:s1 dzień:s1 wiedzieć kiedy:c wrócić:v1 choć:c daleki bliski midnight lady mój:a sen:s1 czekać dzień:s1 dzień:s1 wiedzieć kiedy:c wrócić:v1 wiedzieć wrócić:v1
1595,1595,marsz weselny mendelsona powróci echem podążymy szlakiem wspólnych spraw drogi spotkały stworzyć trakt wiedzie nieznany dotąd świat dzień zbudzi noc codzienność zajrzy próg chwil nieraz powrócimy pięknych snów szczęśliwym finałem razem zaledwie preludium długiego dnia blask obrączek twe oczy słońce skoro świt pochodnia pośród nocy okruch szczęścia pył dzień zbudzi noc codzienność zajrzy próg chwil nieraz powrócimy pięknych snów marsz weselny mendelsona przypomni kawał drogi,krzysztof_krawczyk-weselne_preludium,marsz:s1 weselny mendelsona powrócić echo podążyć szlak wspólny sprawa drogi:a spotkać stworzyć trakt wieść:v nieznany dotąd świat dzień:s1 zbudzić noc codzienność zajrzeć próg chwila nieraz powrócić piękny sen:s1 szczęśliwy finał razem zaledwie:q preludium długi dzień:s1 blask obrączka twój:a oczyć słońce skoro:d świt pochodnia pośród:d noc okruch szczęście pył dzień:s1 zbudzić noc codzienność zajrzeć próg chwila nieraz powrócić piękny sen:s1 marsz:s1 weselny mendelsona przypomnieć kawał:s1 drogi:a
1596,1596,świat pół czas światło podzielimy ślepy los błąd opłaty prąd całe niebo ląd rzeczy świat pół nagły blask podzielimy pożar krwi mokre łzy stukanie deszczu drzwi nutkę fa nutkę czarną kropkę dat łat leśny skrót lewy but słodki krem gorzki żal chmury drapacze chmur mały kąt metraż serca świat pół,krzysztof_krawczyk-swiat_na_pol,świat póła czas:v światło:d podzielić ślepy:a los błąd opłata prąd cały niebo ląd rzecz świat póła nagły blask podzielić pożar krew mokry łza stukanie deszcz drzwi nutka fa nutka czarny:a kropka data łat leśny:a skrót lewy:a but słodki krem gorzki żal:v chmura drapacz chmura mały:a kąt metraż serce świat póła
1597,1597,superman super super super super staje słabszego stronie mig zjawia brak szansy tacy chcą zmierzyć superman superman superman superman nudzi światu wciąż potrzebna kryształowa postać superman życiu jasny cel spróbuj potrafisz takim supermanem zostać super super super super urodził zwalczać zło słusznej sprawie wiernie służy żyje niebezpieczną grą dziewczyny czekają brał ramiona superman superman superman superman nudzi światu wciąż potrzebna kryształowa postać superman życiu jasny cel spróbuj potrafisz takim supermanem zostać superman superman superman superman proszę czekać przyjęcie zamówienia x superman nudzi superman życiu jasny cel spróbuj potrafisz takim supermanem zostać x superman nudzi światu wciąż potrzebna kryształowa postać superman życiu jasny cel spróbuj potrafisz takim supermanem zostać,krzysztof_krawczyk-on_jest_super_superman,superman super:a super:a super:a super:a staje słaby strona mig:s1 zjawiać:v1 brak:v szansa taki:a chcieć zmierzyć superman superman superman superman nudzić świat wciąż potrzebny:a kryształowy postać:s superman życie jasny cel spróbować potrafić:v1 taki:a superman zostać super:a super:a super:a super:a urodzić zwalczać zło słuszny sprawa wiernie służyć żyć niebezpieczny gra dziewczyna czekać brać:v ramię superman superman superman superman nudzić świat wciąż potrzebny:a kryształowy postać:s superman życie jasny cel spróbować potrafić:v1 taki:a superman zostać superman superman superman superman prosić czekać przyjęcie zamówienie X superman nudzić superman życie jasny cel spróbować potrafić:v1 taki:a superman zostać X superman nudzić świat wciąż potrzebny:a kryształowy postać:s superman życie jasny cel spróbować potrafić:v1 taki:a superman zostać
1598,1598,вечером синим вечером лунным был я когда то красивым и юным неудержимо неповторимо все пролетело далече мимо сердце остыло и выцвели очи синее счастье лунные ночи неудержимо неповторимо все пролетело далече мимо ммммм ммммм ммм ммммм неудержимо неповторимо все пролетело далече мимо,krzysztof_krawczyk-w_nocy_blekitnej,вечером синим вечером лунным был я когда то красивым и юным неудержимо неповторимо все пролетело далече мимо сердце остыло и выцвели очи синее счастье лунные ночи неудержимо неповторимо все пролетело далече мимо ммммм ммммм ммм ммммм неудержимо неповторимо все пролетело далече мимо
1599,1599,zakochani tacy sami spojrzeć tłumie chodnikach żółtych słonecznikach spojrzeć wśród tylu zdarzeń tylu spraw miejscom znamy nowych przydamy barw nowych przydamy barw zakochani tacy sami spojrzeć jasnych oknach lata piątych stronach świata spojrzeć wśród tylu zdarzeń tylu spraw miejscom znamy nowych przydamy barw nowych przydamy barw otwartym niebem siebie spojrzeć zakochani tacy sami zakochani tacy sami zakochani x,krzysztof_krawczyk-jeszcze_zakochani,zakochany:a taki:a sam:a spojrzeć tłum chodnik żółty słonecznik spojrzeć wśród tyle:n1 zdarzenie tyle:n1 sprawa miejsce znać:v nowy:a przydać barwa nowy:a przydać barwa zakochany:a taki:a sam:a spojrzeć jasny okno latać piąty:a strona świat spojrzeć wśród tyle:n1 zdarzenie tyle:n1 sprawa miejsce znać:v nowy:a przydać barwa nowy:a przydać barwa otwarty niebo siebie spojrzeć zakochany:a taki:a sam:a zakochany:a taki:a sam:a zakochany:a X
