,id,text,author_title,stemmed_text
1550,1550,wiem swoją drogę jedną musisz iść możesz zboczyć wiem ból dokuczy trudniej żyć wiem mogę pokochać łatwe wciąż mówisz cóż tyle dróg świecie wiesz serca puste coraz dalej ląd możemy stanąć czas dróg skierować wprost dusz naprawdę liczy świat ciemną noc rozjaśni jaśniej płaczesz ludzi biegnę czwarty rok dłużej chcesz poznać lepiej całej prawdy uwierz jesteś świat czas dróg skierować wprost dusz naprawdę liczy świat ciemną noc rozjaśni jaśniej jaśniej jaśniej,krzysztof_krawczyk-moja_droga,wiedzieć swój droga jeden:a musieć iścić móc zboczyć wiedzieć ból dokuczyć trudnie życie wiedzieć móc pokochać łatwy wciąż mówić cóż tyli droga świat wiedzieć serce pusty coraz daleko ląd móc stanąć czas:v droga skierować wprost:d dusz naprawdę:i liczyć świat ciemny noc rozjaśnić jaśnie płakać człowiek biec czwarty:a rok:s1 długo chcieć poznać dobrze cały prawda:s uwierzyć być świat czas:v droga skierować wprost:d dusz naprawdę:i liczyć świat ciemny noc rozjaśnić jaśnie jaśnie jaśnie
1551,1551,niewiele mniej pejzażu dni inaczej widzę świat domysłach złych wciąż gubię coraz mniej pewności szczęście wciąż jesteś blisko masz nadziei cieszę dzień dał los wybacz tamte gorzkie dni dni lepiej pamiętać wybacz łzy słowa potrafi cofnąć nikt kolejny raz wyciągasz dłoń uśmiechasz marzeń tamtych słyszę spokojny głos wiem wybacz tamte gorzkie dni dni lepiej pamietać wybacz łzy słowa potrafi cofnąć nikt dziewczyno wybacz,krzysztof_krawczyk-tylko_wybacz_mi,niewiele:d mało:d pejzaż dzień:s1 inaczej:d widzieć świat domysł zły:a wciąż gubić coraz mało:d pewność szczęście wciąż być blisko:d mieć nadzieja cieszyć dzień:s1 dać los wybaczyć tamten gorzki dzień:s1 dzień:s1 dobrze pamiętać wybaczyć łza słowo potrafić:v1 cofnąć nikt kolejny raz:s1 wyciągać dłoń uśmiechać marzenia tamten słyszeć spokojny głos wiedzieć wybaczyć tamten gorzki dzień:s1 dzień:s1 dobrze pamietać wybaczyć łza słowo potrafić:v1 cofnąć nikt dziewczyna wybaczyć
1552,1552,chrystus rodzi świat przychodzi ciemna noc jasnościach promienistych brodzi aniołowie radują niebiosa wyśpiewują gloria gloria gloria in excelsis de x mówią pasterzy trzód swych strzegli betlejem czym prędzej pobiegli narodził zbawiciel wszego świata odkupiciel gloria gloria gloria in excelsis deo x niebieskie duchy posłowie nieba powiedzcież wyraźniej czynić pojmujemy ledwo strachu żyjemy gloria gloria gloria in excelsis deo x idźcie betlejem dziecię zrodzone pieluszki powite żłobie położone oddajcie pokłon boski osłodzi troski gloria gloria gloria in excelsis deo x,krzysztof_krawczyk-gdy_sie_chrystus_rodzi,Chrystus rodzić świat przychodzić ciemny noc jasność promienisty:a brodzić anioł radować niebiosa wyśpiewywać gloria gloria gloria in excelsis de:s X mówić pasterzyć trzoda swój strzec Betlejem czy:q prędko pobiec narodzić zbawiciel wszystek świat odkupiciel gloria gloria gloria in excelsis deo X niebieski duch posłowie niebo powiedzieć wyraźnie czynić pojmować ledwo:d strach:s1 żyć gloria gloria gloria in excelsis deo X iść Betlejem dziecię zrodzić pieluszka powić żłób:s1 położony oddać pokłon boski osłodzić troska gloria gloria gloria in excelsis deo X
1553,1553,poranne słońce zapach letnich dni poranne słońce mewy śpiewny krzyk oknem morza groźny szum łagodnie brzmi najbezpieczniej poranne słońce przebudzone sny poranne słońce boku promieni składasz nowy dzień nową melodię nowy wiersz piosence chcesz odnaleźć sens poranna dziewczyna dzień nocą spina poranna dziewczyna potrafi przepędzić najgorszy sen poranna dziewczyna dzień przypomina poranna dziewczyna samotność grozi poranne słońce uśmiechnięta twarz poranne słońce radio wita wysyła sygnały dnia życzy snach ułożył zwariowany świat poranne słońce ciepłych słów poranne słońce zapach kawy którą uśmiechem dnia podajesz bezskutecznie chcę przegonić resztki snu x poranna dziewczyna dzień nocą spina poranna dziewczyna potrafi przepędzić najgorszy sen poranna dziewczyna dzień przypomina poranna dziewczyna samotność grozi minęła godzina szósta poranne sygnały,krzysztof_krawczyk-poranna_dziewczyna,poranny słońce zapach letni dzień:s1 poranny słońce mewa śpiewny krzyk okno morze groźny szum łagodnie brzmieć:v1 bezpiecznie poranny słońce przebudzić sen:s1 poranny słońce bok promienić składać nowy:a dzień:s1 nowy:a melodia nowy:a wiersz piosenka chcieć odnaleźć sens poranny dziewczyna dzień:s1 noc spina poranny dziewczyna potrafić:v1 przepędzić zły:a sen:s1 poranny dziewczyna dzień:s1 przypominać poranny dziewczyna samotność grozić poranny słońce uśmiechnięty twarz poranny słońce radio witać wysyłać sygnał dzień:s1 życzyć sen:s1 ułożyć zwariowany świat poranny słońce ciepły słowo poranny słońce zapach kawa który uśmiech dzień:s1 podawać:v2 bezskutecznie chcieć przegonić resztka sen:s1 X poranny dziewczyna dzień:s1 noc spina poranny dziewczyna potrafić:v1 przepędzić zły:a sen:s1 poranny dziewczyna dzień:s1 przypominać poranny dziewczyna samotność grozić minąć godzina szósty:a poranny sygnał
1554,1554,dni siebie siebie dalej żyć serca rytm bije sukienki twojej biel chcę odnaleźć życia mgle miłość umiera nieba płyną łzy serce otwiera ostatniej szansy drzwi pamiętam dzień chciałaś biec marzenia gonić swe spełnił sen masz chcesz miłość ginie zanim powiesz szans uratujmy miłość umiera nieba płyną łzy serce otwiera ostatniej szansy drzwi miłość umiera nieba płyną łzy serce otwiera ostatniej szansy drzwi miłość umiera nieba płyną łzy serce otwiera ostatniej szansy drzwi miłość umiera nieba płyną łzy serce otwiera ostatniej szansy drzwi,krzysztof_krawczyk-kiedy_milosc_umiera,dzień:s1 siebie siebie daleko życie serce rytm bić sukienka twój:a biel:s1 chcieć odnaleźć życie mgła miłość umierać niebo płynąć łza serce otwierać ostatni:a szansa drzwi pamiętać dzień:s1 chcieć biec marzenia gonić swój spełnić sen:s1 mieć chcieć miłość ginąć zanim powiedzieć szansa uratować miłość umierać niebo płynąć łza serce otwierać ostatni:a szansa drzwi miłość umierać niebo płynąć łza serce otwierać ostatni:a szansa drzwi miłość umierać niebo płynąć łza serce otwierać ostatni:a szansa drzwi miłość umierać niebo płynąć łza serce otwierać ostatni:a szansa drzwi
1555,1555,kluczy pęk ciepła bram dzień nowa twarzą twarz deszczu garść własny kąt jedną szalę rzucę los dzieje chce przekór opak źle końcu swój odnajdę brzeg brzeg wiem zdarzeń splot rozwikła grę przesądzi pech szczęścia łut dobry traf postawić warto jedną kart dzieje chce przekór opak źle końcu swój odnajdę brzeg brzeg wiem choć ciemno gram kuszę zło wygranej krok los spłacić dług podzielić przyjdzie pół pół dzieje chce przekór opak źle końcu swój odnajdę brzeg brzeg wiem,krzysztof_krawczyk-na_szczescia_lut,klucz pęk:s ciepły bram dzień:s1 nowy:a twarz twarz deszcz garść własny kąt jeden:a szala rzucić los dziać chcieć przekór opak:d źle koniec swój odnaleźć brzeg brzeg wiedzieć zdarzenie splot rozwikłać gra przesądzić pech szczęście łut dobry:a traf:s postawić warto jeden:a kart dziać chcieć przekór opak:d źle koniec swój odnaleźć brzeg brzeg wiedzieć choć:c ciemno:d grać kusza zło wygrany krok los spłacić dług podzielić przyjść póła póła dziać chcieć przekór opak:d źle koniec swój odnaleźć brzeg brzeg wiedzieć
1556,1556,naszej ziemi obiecanej splecione losy codzienności niby sami sami wciąż odkrywamy smak wolności naszej łodzi płyniemy oceanie samotności pośród mroku busoli czując boli chcemy znaleźć lepsze życie twarzy życia ślad widać pragnie przetrwać czas życie wciąż rysuje twarzy twarzy życia ślad nadziei uśmiech zostawmy tamten czas popatrzmy przyszłość twarzy widać życie magii naszym mieście odkrycia kurzem zwyczajne kryje dusza pełna życia zdarzyć miłość kuli imię przyjaźń kłóci przyjaźnią piotrkowskiej trwa zwykłe życie twarzy życia ślad widać pragnie przetrwać czas życie wciąż rysuje twarzy twarzy życia ślad nadziei uśmiech zostawmy tamten czas popatrzmy przyszłość twarzy widać życie twarzy widać życie,krzysztof_krawczyk-jak_na_twarzy,nasz ziemia obiecać spleść los codzienność niby:j sam:a sam:a wciąż odkrywać smak wolność nasz łódź płynąć ocean samotność pośród:d mrok busola czuć:v boleć:v2 chcieć znaleźć dobry:a życie twarz życie ślad widać:v pragnąć przetrwać czas:v życie wciąż rysować twarz twarz życie ślad nadzieja uśmiech zostawić tamten czas:v popatrzeć przyszłość twarz widać:v życie magia nasz miesić odkrycie:s kurz zwyczajny kryć dusza pełny życie zdarzyć:v1 miłość kuć imię przyjaźń kłócić przyjaźnić piotrkowski trwać zwykły:a1 życie twarz życie ślad widać:v pragnąć przetrwać czas:v życie wciąż rysować twarz twarz życie ślad nadzieja uśmiech zostawić tamten czas:v popatrzeć przyszłość twarz widać:v życie twarz widać:v życie
1557,1557,świat piłka kręci pora zacząć grę czas zagrać losem wielki mecz komu wembley marzy mecze tamtych dni potrafi uwierzyć wielki zryw wygrajmy mecz kibiców słychać śpiew nadziei iskra tli dopóki piłka grze wygrajmy mecz kibiców słychać śpiew nadziei iskra tli dopóki piłka grze pożyjemy powalczymy uda los uśmiechnie któż wie przyjdzie poznać porażki smak powiemy trudno gra wygrajmy mecz kibiców słychać śpiew nadziei iskra tli dopóki piłka grze wygrajmy mecz kibiców słychać śpiew nadziei iskra tli dopóki piłka grze,krzysztof_krawczyk-wygrajmy_jeszcze_jeden_mecz,świat piłka kręty pora:v zacząć gra czas:v zagracić los wielki:a mecz kto Wembley marzyć mecz tamten dzień:s1 potrafić:v1 uwierzyć wielki:a zryw wygrać mecz kibic słychać:v śpiew nadzieja iskra tlić dopóki piłka gra wygrać mecz kibic słychać:v śpiew nadzieja iskra tlić dopóki piłka gra pożyć powalczyć udać los uśmiechnąć któż wiedzieć przyjść poznać porażka smak powiedzieć trudno gra wygrać mecz kibic słychać:v śpiew nadzieja iskra tlić dopóki piłka gra wygrać mecz kibic słychać:v śpiew nadzieja iskra tlić dopóki piłka gra
1558,1558,progiem czeka noc oknami gwiżdże wiatr tę melodię znasz usypiała raz muzyką dźwięczy świat chce ukoić snu dać nowych pięknych snów twarz twarzy taką noc oczach gaśnie szarość dnia nadziei podmuch śni przytul pora spać zobacz gwiazda spadła znak otuleni ciszą snu wierzymy dobry czas chcesz spać noc niepodobna żadnej rok układały snu kolejny minął rok kalendarz nowy spójrz wypełnić treścią pięknych snów zobacz gwiazda spadła znak otuleni ciszą snu wierzymy dobry czas chcesz spać noc niepodobna żadnej rok układały snu,krzysztof_krawczyk-zobacz__gwiazda_spadla_juz,próg czekać noc okno gwizdać wiatr ten melodia znać:v usypiać raz:s1 muzyka dźwięczeć świat chcieć ukoić sen:s1 dać nowy:a piękny sen:s1 twarz twarz taki:a noc oko:s2 gasnąć szarość dzień:s1 nadzieja podmuch śnić przytulić pora:v spać zobaczyć gwiazda spadły:a1 znak otulić ciszyć sen:s1 wierzyć dobry:a czas:v chcieć spać noc niepodobny żaden rok:s1 układać sen:s1 kolejny minąć rok:s1 kalendarz nowy:a spojrzeć wypełnić treść piękny sen:s1 zobaczyć gwiazda spadły:a1 znak otulić ciszyć sen:s1 wierzyć dobry:a czas:v chcieć spać noc niepodobny żaden rok:s1 układać sen:s1
1559,1559,oparach nocy przepadł sen choć jesteś widze cień przepaść czarna mgła chęc życia trwa trwa twojej wiary przegrany byłby świat twej nadziei ziemi wyrósł kwiat twojej wiary nieznany szczęścia byłby ślad marzeń twarzy uśmiechu dnia zakwitłby kwiat człowiek cierpieniu gubi bólem zmęczony chce wciąż życ boi nocy patrzy dnia czeka jasności trwać trwać x,krzysztof_krawczyk-bez_twojej_wiary,opar noc przepaść:v1 sen:s1 choć:c być widz cień przepaść:s czarny:a mgły chęc życie trwać trwać twój:a wiara przegrany:a być świat twój:a nadzieja ziemia wyrosnąć kwiat twój:a wiara nieznany szczęście być ślad marzenia twarz uśmiech dzień:s1 zakwitnąć kwiat człowiek cierpienie gubić ból zmęczony chcieć wciąż życ bać noc patrzyć dzień:s1 czekać jasność trwać trwać X
1560,1560,życie bal chciałby końca trwać choć oknem świat kryje mgła orkiestra gra wiecznie titanic płynie tyle pośród zagubionych fal zepchnie dno płynie siłą serc tańczę noc dzień tańcu wiodę życia grę tańcu pragnę znaleźć ślad zagubionych dawno tańczę noc dzień odnajduję życia sens twych ramionach świat wciąż nabiera barw wokół kręci świat taniec końca trwa sercach nadziei ślad uśmiech twarzy śmiejmy dobry znak złe odchodzi dal płyniemy lepszy świat daje tyle szans tańczę noc dzień tańcu wiodę życia grę tańcu pragnę znaleźć ślad zagubionych dawno tańczę noc dzień odnajduję życia sens twych ramionach świat wciąż nabiera barw tańczę noc dzień tańcu wiodę życia grę tańcu pragnę znaleźć ślad zagubionych dawno tańczę noc dzień odnajduję życia sens twych ramionach świat wciąż nabiera barw tańczę noc dzień odnajduję życia sens twych ramionach świat wciąż nabiera barw,krzysztof_krawczyk-tancze_z_toba_noc_i_dzien,życie bal:s1 chcieć koniec trwać choć:c okno świat kryć mgły orkiestra gra wiecznie Titanic płynąć tyli pośród:d zagubiony fala zepchnąć dno płynąć siła:s serce tańczyć noc dzień:s1 taniec wieść:v życie gra taniec pragnąć znaleźć ślad zagubiony dawno tańczyć noc dzień:s1 odnajdować życie sens twój:a ramię świat wciąż nabierać barwa wokół:d kręty świat taniec koniec trwać serce nadzieja ślad uśmiech twarz śmieć:v dobry:a znak zły:a odchodzić dal płynąć dobry:a świat dawać tyli szansa tańczyć noc dzień:s1 taniec wieść:v życie gra taniec pragnąć znaleźć ślad zagubiony dawno tańczyć noc dzień:s1 odnajdować życie sens twój:a ramię świat wciąż nabierać barwa tańczyć noc dzień:s1 taniec wieść:v życie gra taniec pragnąć znaleźć ślad zagubiony dawno tańczyć noc dzień:s1 odnajdować życie sens twój:a ramię świat wciąż nabierać barwa tańczyć noc dzień:s1 odnajdować życie sens twój:a ramię świat wciąż nabierać barwa
1561,1561,syn otrzymał list ojca zdrowie samotność pośród czterech ścian odpowiedzi syn napisał sprzedaj start dom przyjeżdżaj domu miejsca minęło ledwie dni nadszedł list chcę podziękować synu gest powinieneś wiedzieć starą prawdą podobny trochę człowiek drzew przesadza starych drzew choćby lepszy wiatr choć konarach wiatr melodię grał korzenie rodzinny sad zapomniałem słowach ruszyłem świat pewny swego chciałem zdobyć pukałem drzwi otwierał nikt końcu stary farmer rzekł przesadza starych drzew choćby lepszy wiatr choć konarach wiatr melodię grał korzenie rodzinny sad ludzie uczą błędach swoich błąd przyjaciel ruszył świat pomny słów raczył pewny swego zza późno zrozumie błąd przesadza starych drzew choćby lepszy wiatr choć konarach wiatr melodię grał korzenie rodzinny sad tekst umieszczony stronie własnością wytwórni wykonawców osób mających prawa,krzysztof_krawczyk-nie_przesadza_sie_starych_drzew,syn otrzymać list ojciec zdrowie samotność pośród:d cztery ściana odpowiedź syn napisać sprzedaj start dom przyjeżdżać dom miejsce minąć ledwie:d dzień:s1 nadejść list chcieć podziękować syn gest powinien wiedzieć stary:a prawda:s podobny trochę:d człowiek drzewo przesadzać stary:a drzewo choćby:q dobry:a wiatr choć:c konar wiatr melodia grać korzenie rodzinny sad zapomnieć słowo ruszyć świat pewny:a1 swój chcieć zdobycie pukać drzwi otwierać nikt koniec stary:a farmer rzec:v1 przesadzać stary:a drzewo choćby:q dobry:a wiatr choć:c konar wiatr melodia grać korzenie rodzinny sad lud:s1 uczyć błąd swój błąd przyjaciel ruszyć świat pomny słowo raczyć:v1 pewny:a1 swój zza późno zrozumieć błąd przesadzać stary:a drzewo choćby:q dobry:a wiatr choć:c konar wiatr melodia grać korzenie rodzinny sad tekst umieścić strona własność wytwórnia wykonawca osoba maić prawy:a1
1562,1562,świat wyglądał jaśniej kiedyś dawnych dni wierzyło baśnie wierzyło sny jakieś niezwykłe dreszcze bajki budziły wróćmy tę przeszłość raz powróćmy dawnych zaczarowany bajek świat miłością swoją piękną baśń me życie zmień siódmym morzem dala stąd znajdziemy czarodziejski ląd szczęście da każda noc dzień bajce cud książę los kopciuszkiem splótł spełnienia tęsknot dwóch specjalnie przybył dobry duch powróćmy dawnych zaczarowany bajek świat życiu zdarzyć cudowna baśń bajce cud książę los kopciuszkiem splótł spełnienia tęsknot dwóch specjalnie przybył dobry duch powróćmy dawnych zaczarowany bajek świat życiu zdarzyć cudowna baśń,krzysztof_krawczyk-powrocmy_jak_za_dawnych_lat,świat wyglądać:v1 jaśnie kiedy:c dawny dzień:s1 wierzyć baśń wierzyć sen:s1 jakiś niezwykły:a1 dreszcz bajka budzić wrócić:v1 ten przeszłość raz:s1 powrócić dawny zaczarowany bajka świat miłość swój piękny baśń mój:a życie zmienić siódmy:a morze dala stąd znajść czarodziejski ląd szczęście dać każdy noc dzień:s1 bajca cud książę los kopciuszek:s1 spleść spełnienie tęsknota dwa specjalnie przybyć dobry:a duch powrócić dawny zaczarowany bajka świat życie zdarzyć:v1 cudowny baśń bajca cud książę los kopciuszek:s1 spleść spełnienie tęsknota dwa specjalnie przybyć dobry:a duch powrócić dawny zaczarowany bajka świat życie zdarzyć:v1 cudowny baśń
1563,1563,zamknij oczy zamknij drzwi grozi wieczorem zamknij okno światło zgaś pora bać wieczorem oknem umilkł drozd odlatuje księżyc świeci srebrny trzos toruje pożałujesz zdejmij buty zdejmij płaszcz butelki nalej wieczorem oknem umilkł drozd odlatuje księżyc świeci srebrny trzos toruje pożałujesz zdejmij buty zdejmij płaszcz butelki nalej wieczorem,krzysztof_krawczyk-bede_twoj_dzisiaj_wieczorem,zamknąć oczyć zamknąć drzwi grozić wieczor zamknąć okno światło:d zgasić pora:v bać wieczor okno umilknąć drozd odlatywać księżyc świecić srebrny trzos torować pożałować zdjąć but zdjąć płaszcz butelka nalać wieczor okno umilknąć drozd odlatywać księżyc świecić srebrny trzos torować pożałować zdjąć but zdjąć płaszcz butelka nalać wieczor
1564,1564,spisz znam miłości łzy los chciał słuchałaś ludzi złych wróć pragnę miało kim chciałem pytasz marzeń moich treść czego chcieć prócz cienia twoich rzęs miłość boli życie miłość przetrwa uwierz wciąż piąty bieg pamięci swej znam hedonizm błędy strach mieć miłość boli życie miłość przetrwa uwierz wierzę darze głos śpiewam serce mówi jesteś jesteś świat,krzysztof_krawczyk-wszystko_mam,spisać znać:v miłość łza los chcieć słuchać człowiek zły:a wrócić:v1 pragnąć mieć ki chcieć pytać marzenia mój:a treść czego chcieć prócz cień twój:a rzęsa miłość boleć:v2 życie miłość przetrwać uwierzyć wciąż piąty:a bieg pamięć swój znać:v hedonizm błąd strach:v mieć miłość boleć:v2 życie miłość przetrwać uwierzyć wierzyć dar głos śpiewać serce mówić być być świat
1565,1565,zwyczajny dzień płynął czas pustką czterech ścian bawił los wten promyk słońca wpadł prog dach zagrzał miejsce dal dać chcial kolorze oczu twych tamten świat nabrał barw byłaś blisko czas raz bałem sen sen przyszłaś znikniesz wnet razem byłaś uśmiech głos ptaków śpiew budził bylaś oddech cieplo rąk byłaś przekór myslom zlym brałem dał los radość wspólnych chwil wciąż dzien noc szczęście blisko krok spelnił zly sen porwał cien letni wiatr znałem marzeń twych skrytych pośród łez wyruszyłaś świat szukać szans nowych szans bylaś dumna pewna zdobędziesz świat wart byłaś zły sen znana twarz mijaniu trudnych dni żylem wciąż myślą tą powrócisz staniesz drzwiach powiem wejdż byłaś uśmiech głos ptaków śpiew zbudził byłaś próg dach promyk słońca wpadl wrócił dobry znak,krzysztof_krawczyk-to_bylas_ty,zwyczajny dzień:s1 płynąć czas:v pustka cztery ściana bawić los wten promyk słońce wpaść:v1 Proga:s2 dach zagrzać miejsce dal dać chcial kolor oko:s2 twój:a tamten świat nabrać barwa być blisko:d czas:v raz:s1 bać sen:s1 sen:s1 przyjść zniknąć wnet razem być uśmiech głos ptak śpiew budzić bylaś oddech cieplo ręka być przekór myslom zlym brać:v dać los radość wspólny chwila wciąż dzien noc szczęście blisko:d krok spelnił zly sen:s1 porwać cien letni wiatr znać:v marzenia twój:a skryty pośród:d łza wyruszyć:v1 świat szukać szansa nowy:a szansa bylaś dumny pewny:a1 zdobyć świat wart:a być zły:a sen:s1 znany:a twarz mijanie trudny dzień:s1 żylem wciąż myśl ten powrócić stanąć drzwi powiedzieć wejdż być uśmiech głos ptak śpiew zbudzić być próg dach promyk słońce wpadl wrócić:v1 dobry:a znak
1566,1566,zwykle poprawnie czas schodził dnia dzień zwykłym bywało rzecz prosta zwykle zanim tle jednej obcych bram wzrok miłość wdał odtąd niechcący zofii odbywam straż odtąd miarkuję choć czasu brak myliłby uznał zdarzeń zbieg chciał widzieć przypadku grę stąd zowąd los padł przyszło grać pewnie bym trafił nowa szczęścia trop bezpieczny trop odtąd niechcący bym objął zofii straż czasu tracąc najbłahszym fragmencie dnia myliłby uznał zdarzeń zbieg chciał widzieć przypadku grę,krzysztof_krawczyk-u_zofii,zwykle poprawnie czas:v schodzić:v1 dzień:s1 dzień:s1 zwykły:a1 bywać rzecz prosty:a zwykle zanim tło jeden:a obcy:a bram wzrok miłość wdać odtąd chcieć Zofia:s2 odbywać straż odtąd miarkować choć:c czas:s brak:v mylić uznać zdarzenie zbieg:s1 chcieć widzieć przypadek:s1 gra stąd zowąd los paść:v1 przyjść grać pewnie:d1 by:q trafić nowy:a szczęście trop bezpieczny trop odtąd chcieć by:q objąć Zofia:s2 straż czas:s tracić błahy fragment dzień:s1 mylić uznać zdarzenie zbieg:s1 chcieć widzieć przypadek:s1 gra
1567,1567,żyjemy wśród zamętu braku sentymentu sztuczny śmiech sztuczne łzy obłuda fałsz życia gry miłości szczerej epoka kłamstw krzywd mąk nikt czas rządzi okrutna obojętność krąg jedynie serce matki uczuciem tchnie jedynie serce matki wie dać trochę ciepła umie ból zrozumie przestaje bić ciężko ciężko żyć miłości szczerej epoka kłamstw krzywd mąk nikt czas rządzi okrutna obojętność krąg jedynie serce matki uczuciem tchnie jedynie serce matki wie dać trochę ciepła umie ból zrozumie przestaje bić ciężko ciężko żyć,krzysztof_krawczyk-serce_matki,żyć wśród zamęt brak:s sentyment sztuczny śmiech:v sztuczny łza obłuda fałsz życie gra miłość szczery epoka kłamstwo krzywda mąka nikt czas:v rządzić okrutny obojętność krąg jedynie serce matka uczucie tchnąć jedynie serce matka wiedzieć dać trochę:d ciepły um ból zrozumieć przestawać bicie ciężko ciężko życie miłość szczery epoka kłamstwo krzywda mąka nikt czas:v rządzić okrutny obojętność krąg jedynie serce matka uczucie tchnąć jedynie serce matka wiedzieć dać trochę:d ciepły um ból zrozumieć przestawać bicie ciężko ciężko życie
1568,1568,szły niepamięć piękne czasy złych piratów fregaty zasypiały stuleci dnie mórz szkunerze zwanym norma jean tytoń herbatę chin dostarczaliśmy raz raz włóczęgi dosyć złe wiatry burze niosły szkwał duszy zmył powszedni grzech hawaje kurs kapitan brał bezdomnych dom stał tańczyła śpiewała lola honolulu lola honolulu piękna damy kier lola honolulu lola honolulu biło każde męskich serc lola honolulu lola honolulu uderzała rum głów lola honolulu lola honolulu siódmy ósmy świata cud portu statki wchodzą marynarze ląd schodzą dyskotek biegną bawić pamięta casino tłok lola wodziła rej x lola honolulu lola honolulu piękna damy kier lola honolulu lola honolulu biło każde męskich serc lola honolulu lola honolulu uderzała rum głów lola honolulu lola honolulu siódmy ósmy świata cud,krzysztof_krawczyk-lola_z_honolulu,iść niepamięć piękny czas:s zły:a pirat:s1 fregata zasypiać:v1 stulecie dna morze szkuner zwać norma Jean tytoń herbata china dostarczać raz:s1 raz:s1 włóczęga:s1 dosyć:v zły:a wiatry burza nieść szkwał dusza zmyć powszedni grzech Hawaje kurs kapitan:s1 brać:v bezdomny:a dom stać:v3 tańczyć śpiewać Lolo:s2 Honolulu Lolo:s2 Honolulu piękny dać kier Lolo:s2 Honolulu Lolo:s2 Honolulu bić każdy męski serce Lolo:s2 Honolulu Lolo:s2 Honolulu uderzać rum:s głowa Lolo:s2 Honolulu Lolo:s2 Honolulu siódmy:a ósmy:a świat cud port statki wchodzić marynarz ląd schodzić:v2 dyskoteka biec bawić pamiętać casino tłok:s1 Lolo:s2 wodzić rej X Lolo:s2 Honolulu Lolo:s2 Honolulu piękny dać kier Lolo:s2 Honolulu Lolo:s2 Honolulu bić każdy męski serce Lolo:s2 Honolulu Lolo:s2 Honolulu uderzać rum:s głowa Lolo:s2 Honolulu Lolo:s2 Honolulu siódmy:a ósmy:a świat cud
