,id,text,author_title,stemmed_text
1995,1995,powiedział byśmy kiedyś powiedział zróbmy nikt widział parku lasem torach garażach ciemno nikt chodzi będziemy wybierać powiedział pierwszy niczym ostrze losu pierwszy trafi pamiętaj hałasu zbędnych emocji poczuj siłę rób zabić urodzeni mordercy kalifornia siedem harry angel pulp fiction hellraiser freddy codziennie filmy biblia same sceny snach widzę widzę snach wciąż samo ciągle boję zasnąć tamten leży krwi robi słabo powiedział patrz pięknie filmach zapamiętaj pamiętam filmach film film pamiętam mówił chciałbym postrzelać wiesz dziewczyn ulicy biały dzień zwykłych dziewczyn najpiękniejszych chciałbym patrzeć oczy marnieją więdną mówił ciekawe naprawdę zabić rękach trzymać przeznaczenie panem wiesz chciałbym byśmy kiedyś ulicy jakimś ciemnym miejscu nikt widział pamiętam mówił zapamiętaj potrafię zapomnieć wyrazu oczu strachu potem krwi dłoniach krew wszędzie wokół pamiętam płynęła niczym rzeka potrzaskanej głowy krew pulsowała skroniach rozsadzała czaszkę ręce drżały wiem podniecenia strachu pamiętam śmiał mówił filmach zapamiętaj pamiętam filmach film film film film,myslovitz-to_nie_byl_film,powiedzieć by:q kiedy:c powiedzieć zrobić nikt widzieć park las tor garaż ciemno:d nikt chodzić być wybierać powiedzieć pierwszy:a nic ostrze los pierwszy:a trafić pamiętać hałas zbędny emocja poczuć siła:s robić zabicie urodzony:a morderca Kalifornia siedem Harry Angel:s2 pulpa fiction hellraiser freddy codziennie film biblia sam:a scena sen:s1 widzieć widzieć sen:s1 wciąż sam:a ciągle bać zasnąć tamten leżeć krew robić słabo powiedzieć patrzeć pięknie film zapamiętać pamiętać film film film pamiętać mówić chcieć postrzelać wiedzieć dziewczyna ulica biały:a dzień:s1 zwykły:a1 dziewczyna piękny chcieć patrzeć oczyć marnieć więdnąć mówić ciekawy naprawdę:i zabicie ręka trzymać przeznaczenie pan wiedzieć chcieć by:q kiedy:c ulica jakiś ciemny miejsce nikt widzieć pamiętać mówić zapamiętać potrafić:v1 zapomnieć wyraz oko:s2 strach:s1 potem krew dłoń krew wszędzie wokół:d pamiętać płynąć nic rzeka potrzaskać głowa krew pulsować skroń rozsadzać czaszka ręka drżeć wiedzieć podniecenie strach:s1 pamiętać śmiać mówić film zapamiętać pamiętać film film film film film
1996,1996,kawiarniach tłok gwar zza szyb znajome drzwi stoisz przemykam wśród wejść wyjść neonów szept pulsuje choć tyle miejsc zgiełk mieście pusto wysiadam nieważne żadnej map znajdę wiem miejsc wspólnych chwil neonów krzyk pulsuje choć tyle miejsc zgiełk mieście pusto choć tyle miejsc zgiełk mieście pusto choć tyle miejsc zgiełk mieście pusto,myslovitz-ukryte,kawiarnia tłok:s1 gwar zza szyb znajomy:a drzwi stać:v3 przemykać wśród wejście wyjście neon:s1 szept pulsować choć:c tyli miejsce zgiełk miesić pusto wysiadać nieważny żaden mapa znajść wiedzieć miejsce wspólny chwila neon:s1 krzyk pulsować choć:c tyli miejsce zgiełk miesić pusto choć:c tyli miejsce zgiełk miesić pusto choć:c tyli miejsce zgiełk miesić pusto
1997,1997,świat wypadł moich rąk żal wiesz chciałbyś żyć chyba chciałem czas muszę wybrać mógł odejść wiem chciałbym umrzeć wieje wiatr pachnie wiosną wiem łatwo zgodziłaś muszę wybrać mógł odejść wiem chciałbym umrzeć kiedyś wybrać mógł zrobić wiem chciałbym umrzeć miłości krześle śnie spokoju dzień chcę łatwo sto chciałbym umrzeć miłości bólu domu chcę szybko chcę młodo szczęśliwie wśród bliskich chciałbym umrzeć miłości,myslovitz-chcialbym_umrzec_z_milosci,świat wypaść:v1 mój:a ręka żal:v wiedzieć chcieć życie chybać chcieć czas:v musza wybrać móc odejście wiedzieć chcieć umrzeć wiać wiatr pachnieć wiosna wiedzieć łatwo zgodzić:v1 musza wybrać móc odejście wiedzieć chcieć umrzeć kiedy:c wybrać móc zrobić wiedzieć chcieć umrzeć miłość krzesło snąć spokój dzień:s1 chcieć łatwo sto chcieć umrzeć miłość ból dom chcieć szybko chcieć młodo szczęśliwie wśród bliski chcieć umrzeć miłość
1998,1998,nicości morza trwam wzruszenia ciągły brak szare niebo pełne ludzkich dusz chyba chciałbym rozkołysany dzień opuścił ziemski brzeg głowa pełna myśli nabrzmiały ptaków krzew podobny chmurom zbieg prowadzi wszędzie zmysły gubią sens czarny pada śnieg powoli tracę wzrok mogę zrobić żyć utraty tchu zawrócić zdążę wiem zaskoczę światłem zmierzch końcu świata odnajdę chyba chciałbym podobny chmurom zbieg prowadzi wszędzie zmysły gubią sens czarny pada śnieg powoli tracę wzrok mogę zrobić żyć utraty tchu,myslovitz-do_utraty_tchu,nicość morze trwać wzruszenie ciągły brak:v szary niebo pełny ludzki dusz chybać chcieć rozkołysać dzień:s1 opuścić ziemski brzeg głowa pełny myślić nabrzmiały ptak krzew podobny chmura zbieg:s1 prowadzić wszędzie zmysł gubić sens czarny:a padać:v1 śnieg powoli tracić wzrok móc zrobić życie utrata dech zawrócić zdążyć wiedzieć zaskoczyć światło:s zmierzch koniec świat odnaleźć chybać chcieć podobny chmura zbieg:s1 prowadzić wszędzie zmysł gubić sens czarny:a padać:v1 śnieg powoli tracić wzrok móc zrobić życie utrata dech
1999,1999,all the world has slipped out of grasp and as yet can feel regret tell me how you d like live m alive and think want live life but if had and could ever make death wish it s not secret and know it well d like die your side breezes blow smell springtime and know that you easily accepted what d said and if had and could ever make death wish it s not secret and know it well d like die your side and if ever could really choose how that it s not secret and know it well d like die of love in armchair in dream not in peace and not day not too easy not in long years d like die of love not so painless not in home not too quickly not too young and not too happy not with dears d like die of love,myslovitz-i_d_like_to_die_of_love,all the world Has:s1 slipped out of grasp Anda as:s1 yet can feel regret tell mój:a how you D like live metr alive Anda think wanta live life but if Hada:s2 Anda could ever make death wish Ita sekunda nota secret Anda know Ita well D like die your side breezes blow smell springtime Anda know that you easily accepted what D said Anda if Hada:s2 Anda could ever make death wish Ita sekunda nota secret Anda know Ita well D like die your side Anda if ever could really choose how that Ita sekunda nota secret Anda know Ita well D like die of love in armchair in dream nota in peace Anda nota day nota too easy nota in Longa:s2 years D like die of love nota Księga_Sofoniasza painless nota in home nota too quickly nota too Young:s1 Anda nota too happy nota with dears D like die of love
