,id,text,author_title,stemmed_text
2950,2950,in the dark of the night you feel that something ain t right don t be afraid afraid afraid something has shone in the ground and it s hanging around don t be afraid afraid afraid mental cat yes it s me mental cat fur is blue and bright love fly everynight mental cat mental cat mental cat don t be surprised your eyes remember ve got lies mental cat mental cat mental cat mental cat yes it s me mental cat laugh the tears hey boy hey boy hold look the left now look the right now look around yourself mental cat yes it s me mental cat in the dark of the night you feel that something is not right don t be afraid afraid afraid look the left now look the right now look around yourself mental cat yes it s me mental cat,maanam-mental_cat,in the dark of the night you feel that something ain tona right don:b1 tona be:a afraid afraid afraid something Has:s1 shone in the ground Anda Ita sekunda hanging around don:b1 tona be:a afraid afraid afraid mental cat yes Ita sekunda mój:a mental cat fura IS blue Anda bright love fly everynight mental cat mental cat mental cat don:b1 tona be:a surprised your eyes remember ve got lies mental cat mental cat mental cat mental cat yes Ita sekunda mój:a mental cat laugh the tears hey boy hey boy hold look the left now look the right now look around yourself mental cat yes Ita sekunda mój:a mental cat in the dark of the night you feel that something IS nota right don:b1 tona be:a afraid afraid afraid look the left now look the right now look around yourself mental cat yes Ita sekunda mój:a mental cat
2951,2951,miłość prawdziwa pali pożoga trafia prosto serce zabija wroga miłość wyśniona zazdrości kochanka tęsknoty kona wywołuje wojny tęsknoty kona miłość wyśniona słodka miłość odurza łudzi gorzka zimna snu budzi miłość wyśniona zazdrości kochanka tęsknoty kona wywołuje wojny tęsknoty kona miłość wyśniona kocham prostu kocham nieskończenie kocham najpiękniej zapatrzenie miłość wyśniona zazdrości kochanka tęsknoty kona wywołuje wojny tęsknoty kona miłość wyśniona kocham prostu kocham nieskończenie kocham najpiękniej zapatrzenie,maanam-zapatrzenie,miłość prawdziwy pali pożoga trafiać prosto serce zabijać wrogi miłość wyśnić zazdrościć kochanka tęsknota konać wywoływać wojna tęsknota konać miłość wyśnić słodki miłość odurzać łudzić gorzki zimny sen:s1 budzić miłość wyśnić zazdrościć kochanka tęsknota konać wywoływać wojna tęsknota konać miłość wyśnić kochać prosty:a kochać skończyć kochać pięknie zapatrzyć miłość wyśnić zazdrościć kochanka tęsknota konać wywoływać wojna tęsknota konać miłość wyśnić kochać prosty:a kochać skończyć kochać pięknie zapatrzyć
2952,2952,łóżko obszar magiczny szepty krzyk śmiech miejsce szczęście miejsce grzech wyspa rozkoszy morze samotności miejsce narodzin drzwi nicości pytaj kocham kocha miłość uleczyć miłość zranić snu przychodzi miłość zabić sny śnią śnie sny jawie idę życie śnie tajemne prowadzą znaki,maanam-lozko,łóżko obszar magiczny szept krzyk śmiech:v miejsce szczęście miejsce grzech wyspa rozkosz morze samotność miejsce narodziny drzwi nicość pytać kochać kochać miłość uleczyć miłość zranić sen:s1 przychodzić miłość zabicie sen:s1 śnić snąć sen:s1 jaw iść życie snąć tajemny prowadzić znak
2953,2953,chłopiec twarzy sokoła pojawił nagle mieście bóg zabrał serce derwisza miłość zabrała sen słońce omdlewa pragnienia powietrze ciężko dyszy kamienny rynek płonie derwisz niebo krzyczy derwisz tańczy trzeci dzień derwisz tańczy trzeci dzień miłość zabrała rozum miłość zabrała sen sen sen trzeci dzień derwisz tańczy trzeci dzień tłum patrzy derwisz tańczy włosami rynek smaga piruet piruetem ekstaza ekstaza ekstaza flet syczy warczą bębny niechęć tłumu narasta derwisz ziemię pada chłopiec ucieka miasta,maanam-derwisz,chłopiec twarz sokół:s1 pojawić nagle miesić bóg zabrać serce derwisz miłość zabrać sen:s1 słońce omdlewać pragnienie powietrze ciężko dyszeć kamienny rynek płonąć derwisz niebo krzyczeć derwisz tańczyć trzeci:a dzień:s1 derwisz tańczyć trzeci:a dzień:s1 miłość zabrać rozum miłość zabrać sen:s1 sen:s1 sen:s1 trzeci:a dzień:s1 derwisz tańczyć trzeci:a dzień:s1 tłum patrzyć derwisz tańczyć włos rynek smagać piruet piruet ekstaza ekstaza ekstaza flet:s1 syczeć warczeć bęben:s1 niechęć tłum narastać derwisz ziemia padać:v1 chłopiec uciekać miasto:s
2954,2954,spóźniona biegłam spotkanie wyrosłeś spod ziemi prostu wpadłeś pierwsza dotknęłam twojej ręki głód serca ciała serce ciało dusza razem reszta reszta stała kogo biegłam pamiętam kogo chcę wiedzieć znam imię kolor oczu znam ciało x zapytał masz imię wiedziałam kolor twoich oczu znałam pierwsza dotknęłam twojej ręki głód serca ciała serce ciało dusza razem reszta reszta stała kogo biegłam pamiętam kogo chcę wiedzieć znam imię kolor oczu znam ciało x spóźniona biegłam spotkanie wyrosłeś spod ziemi prostu wpadłeś kogo biegłam pamiętam kogo chcę wiedzieć znam imię kolor oczu znam ciało x,maanam-do_kogo_bieglam,spóźniony biec spotkanie wyrosnąć spod ziemia prosty:a wpaść:v1 pierwszy:a dotknąć:v1 twój:a ręka głód serce ciało serce ciało dusza razem reszta reszta stały koga biec pamiętać koga chcieć wiedzieć znać:v imię kolor oko:s2 znać:v ciało X zapytać mieć imię wiedzieć kolor twój:a oko:s2 znać:v pierwszy:a dotknąć:v1 twój:a ręka głód serce ciało serce ciało dusza razem reszta reszta stały koga biec pamiętać koga chcieć wiedzieć znać:v imię kolor oko:s2 znać:v ciało X spóźniony biec spotkanie wyrosnąć spod ziemia prosty:a wpaść:v1 koga biec pamiętać koga chcieć wiedzieć znać:v imię kolor oko:s2 znać:v ciało X
2955,2955,sensu stoję rana wciąż pada cholerny deszcz tania tania zapłać żałuj dalej jedź wiem muszę zarobić taką grzech wybaczyć czego wciąż pada cholerny deszcz świętego spotkałam wciąż pada cholerny deszcz sensu moknę rana zapłać żałuj dalej jedź krótka chwila zapomnienia pięć dziesięć minut splunąć grzech mniej śmieć świętego spotkałam wciąż pada cholerny deszcz sensu moknę rana zapłać żałuj dalej jedź mieć znam rozterki salonowe moralnie wzbogaca stoję prac świętego spotkałam wciąż pada cholerny deszcz sensu moknę rana zapłać żałuj dalej jedź,maanam-ten_cholerny_deszcz,sens stać:v3 rany:a wciąż padać:v1 cholerny deszcz tani tani zapłacić żałować daleko jechać wiedzieć musza zarobić taki:a grzech wybaczyć czego wciąż padać:v1 cholerny deszcz święty:a spotkać wciąż padać:v1 cholerny deszcz sens moknąć rany:a zapłacić żałować daleko jechać krótki chwila zapomnienie pięć dziesięć minuta splunąć grzech mało:d śmieć:s1 święty:a spotkać wciąż padać:v1 cholerny deszcz sens moknąć rany:a zapłacić żałować daleko jechać mieć znać:v rozterk salonowy moralnie wzbogacać stać:v3 praca święty:a spotkać wciąż padać:v1 cholerny deszcz sens moknąć rany:a zapłacić żałować daleko jechać
2956,2956,ręka zamarła nagim ramieniu śmie dalej posunąć tętno tętni iskrzą skronie niepewność boi pomylić mocno zwarci choć przytuleni żyłach krew zamienia strumień błękitna lawa zalewa oczy błękitna lawa wodospad zdumień lubię ciszę burzą środku magnetyczna kula namiętności szukam spokoju szukam wody woda żywiołem złowrogim mocno zwarci choć przytuleni żyłach krew zamienia strumień błękitna lawa zalewa oczy błękitna lawa wodospad zdumień lubię samotność wyciągnięcie ręki twojej szukam spokoju szukam wody woda żywiołem złowrogim pokornie ogniem głowie kochaj kocham kochaj kocham lubię samotność wyciągnięcie ręki twojej,maanam-z_ogniem_w_glowie,ręka zamarły:a1 nagi:a ramię śmieć:v daleko posunąć tętno tętnieć iskrzeć skroń niepewność bać pomylić mocno zwarty choć:c przytulić żyła krew zamieniać strumień błękitny lawa zalewać oczyć błękitny lawa wodospad zdumienie lubić ciszyć burzyć środek magnetyczny kulać namiętność szukać spokój szukać woda woda żywioł złowrogi mocno zwarty choć:c przytulić żyła krew zamieniać strumień błękitny lawa zalewać oczyć błękitny lawa wodospad zdumienie lubić samotność wyciągnięcie ręka twój:a szukać spokój szukać woda woda żywioł złowrogi pokornie ogień głowa kochać kochać kochać kochać lubić samotność wyciągnięcie ręka twój:a
2957,2957,swoją formę liść drzewo jaszczurka woda oceanach czarach spoczywa ogień kominach spala bezpiecznie ziemia zamknięta słowem krąży elipsie eksplozja eksplozja powietrze przybiera kształt rzeczy dowolny wciąż gestach mimowolnych żyjemy siebie spokojnie chwili gniew rozsadza formy treść eksploduje eksplozja powstrzymać powietrze wodę ziemi rozkaże cofnąć rozżarzoną lawę stanie drodze mego zniechęcenia form coraz ciaśniejszych przeznaczenia eksplozja,maanam-eksplozja,swój forma liść drzewo jaszczurka woda ocean czara spoczywać ogień komin spalać bezpiecznie ziemia zamknięty słowo krążyć elipsa eksplozja eksplozja powietrze przybierać kształt rzecz dowolny wciąż gest mimowolny żyć siebie spokojnie chwila gniew rozsadzać forma treść eksplodować eksplozja powstrzymać powietrze woda ziemia rozkazać cofnąć rozżarzyć lawa stanąć droga mój:a zniechęcenie forma coraz ciasny przeznaczenie eksplozja
2958,2958,chleb masz mięso wino mamy wiśnie macie czereśnie morwy miałeś cytryny miałam orzechy mieli figi mieliśmy ciastka mieli tort mieliście lody gdybym miała cielęcinę miałbyś baraninę przyjaciel miałby wołowinę ser chcemy masło dzieci chcą mieć mleko indyka masz bażanta pulardę żebym miała kawę żebyś miał herbatę kuzyn miał śmietanę żebyśmy mieli sałatę żebyście mieli cukier mieli korzenie żebyśmy mieli sól żebyście mieli pieprz ażeby mieli ocet kochanka masz kochankę teściową kocham kochasz kochają siebie,maanam-nowy_przewodnik,chleb mieć mięso wino mama wisnąć mieć czereśnia morwa mieć cytryn mieć orzech mieć figi mieć ciastko mieć tort mieć lody gdyby:c mieć cielęcina mieć baranina przyjaciel mieć wołowina ser chcieć masło dziecko chcieć mieć mleko indyk mieć bażant pularda żeby:c mieć kawa żeby:c mieć herbata kuzyn mieć śmietana żeby:c mieć sałata żeby:c mieć cukier mieć korzenie żeby:c mieć sól żeby:c mieć pieprz ażeby mieć ocet kochanka mieć kochanka teściowy kochać kochać kochać siebie
2959,2959,rośniemy powoli wytrwale zawody szczurem zawody smrodem przepuszczamy wchłaniamy tężejemy nocy atomowo prostu procy jesteśmy silni jesteśmy śmiali jesteśmy silni jesteśmy śmiali jesteśmy silni jesteśmy prostu stali śnimy sny potężne niegroźne burze biczem ręku głową chmurze bich bucha buch bacha mówimy końcu hahaha jesteśmy silni jesteśmy prostu wspaniali jesteśmy silni jesteśmy prostu stali droczą piaskiem sypią oczy możemy zechcemy ogień skoczyć jesteśmy silni jesteśmy cudowni jesteśmy prostu stali,maanam-jestesmy_ze_stali,rosnąć powoli wytrwale zawody szczur zawody smród:s1 przepuszczać wchłaniać tężeć noc atomowo prosty:a proca być silny być śmiały być silny być śmiały być silny być prosty:a stały śnić sen:s1 potężny niegroźny burza bicz ręka głowa chmura bich buchać buch bachać mówić koniec hahaha być silny być prosty:a wspaniały być silny być prosty:a stały droczyć piasek sypać oczyć móc zechcieć ogień skoczyć być silny być cudowny być prosty:a stały
2960,2960,słowa słowa słowa słowa wyrazy cisną głowy słowa słowa słowa słowa stron zachęcający szept ha ha ha myślę myślę myślę myślę idę ulicą dziwię idę myślę myślę myślę myślę stron zachęcający szept ha ha ha myślę myślę myślę myślę chcę zatrzymać mogę myślę myślę myślę myślę stron zachęcający szept ha ha ha słowa słowa słowa słowa wyrazy cisną głowy słowa słowa słowa słowa stron zachęcający szept,maanam-hamlet,słowo słowo słowo słowo wyraz cisnąć:v1 głowa słowo słowo słowo słowo strona zachęcający szept ha:s ha:s ha:s myśleć myśleć myśleć myśleć iść ulica dziwić iść myśleć myśleć myśleć myśleć strona zachęcający szept ha:s ha:s ha:s myśleć myśleć myśleć myśleć chcieć zatrzymać móc myśleć myśleć myśleć myśleć strona zachęcający szept ha:s ha:s ha:s słowo słowo słowo słowo wyraz cisnąć:v1 głowa słowo słowo słowo słowo strona zachęcający szept
2961,2961,lato wściekły upał swój miasta wymyka upał żar wytrzymania ostatni zakręt miasto znika uciekam powoli nigdzie spieszę koło kołem czuję lepiej miejski rytuał koniec tygodnia kierunek woda totalny exodus wymija zwarta flotylla motorów pędzą logicznym ptasim szyku precyzja maszyny ciałem człowieka uciekam powoli nigdzie spieszę precyzja maszyny sercem człowieka ciałem sercem człowieka wolni wiatr wiatr kojarzy przestrzenią uciekam powoli nigdzie spieszę czuję lepiej wolni ptak ptak kojarzy przestrzenią uciekam powoli nigdzie spieszę czuję lepiej wolni wiatr wiatr kojarzy przestrzenią uciekam powoli nigdzie spieszę czuję lepiej,maanam-flotylla_motorow,lato wściekły:a1 upał swój miasto:s wymykać:v1 upał żar wytrzymanie ostatni:a zakręt miasto:s znikać uciekać powoli nigdzie spieszyć:v1 koło:s koł czuć:v dobrze miejski rytuał koniec tydzień kierunek woda totalny exodus wymijać zwarty flotylla motor pędzić logiczny ptasi szyk precyzja maszyna ciało człowiek uciekać powoli nigdzie spieszyć:v1 precyzja maszyna serce człowiek ciało serce człowiek wolny:a1 wiatr wiatr kojarzyć przestrzeń uciekać powoli nigdzie spieszyć:v1 czuć:v dobrze wolny:a1 ptak ptak kojarzyć przestrzeń uciekać powoli nigdzie spieszyć:v1 czuć:v dobrze wolny:a1 wiatr wiatr kojarzyć przestrzeń uciekać powoli nigdzie spieszyć:v1 czuć:v dobrze
2962,2962,wymyślałam trochu każdego dnia uciekniesz mojej głowy choćbyś chciał otchłanią wielkiej ciszy przepaścią dna przerzuciłam most most miłości zakamarkach cudnej duszy hula wiatr mocno kochaj nocy chcę spać zanurzeni wielkiej ciszy wędrujemy wśród gwiazd budujemy dom dom miłości kocham kocham nienawidzę złapać chcesz złapać chcesz chwilę kocham wodę wiatr ogniem pieszczę kocham ogień wiatr kocham ogień deszczem wymyślałam trochu każdego dnia mocno kochaj nocy chcę spać zagubieni wielkiej ciszy wędrujemy wśród gwiazd budujemy dom dom miłości,maanam-kocham_i_nienawidze,wymyślać trochu każdy dzień:s1 uciec mój:a głowa choćby:c chcieć otchłań wielki:a ciszyć przepaść:s dna przerzucić most most miłość zakamarek cudny dusza hulać wiatr mocno kochać noc chcieć spać zanurzyć wielki:a ciszyć wędrować wśród gwiazda budować dom dom miłość kochać kochać nienawidzieć złapać chcieć złapać chcieć chwila kochać woda wiatr ogień pieścić kochać ogień wiatr kochać ogień deszcz wymyślać trochu każdy dzień:s1 mocno kochać noc chcieć spać zagubiony wielki:a ciszyć wędrować wśród gwiazda budować dom dom miłość
2963,2963,księżyc wypłynął dachy zagląda okno lunatyczna kula echo podwaja szybkie kroki zjawiasz mroku błękitna chmura głowę opieram twej dłoni oczy ciemnieją gniewie mówisz jedyna kocham kocham cicho pochylasz nade piękny drzewo użycza cienia rodzimy siebie takim samym jedną przestrzenią,maanam-caliope,księżyc wypłynąć dach zaglądać okno lunatyczny kulać echo podwajać szybki krok zjawiać:v1 mrok błękitny chmura głowa opierać:v1 twój:a dłoń oczyć ciemnieć gniew mówić jedyny:a kochać kochać cicho pochylać nad piękny drzewo użyczać cień rodzimy siebie taki:a sam:a jeden:a przestrzeń
2964,2964,granice mury zasieki zapory granice stalowe rzeki stalowe góry ludzie twarzy ludzie serc ludzie twarzy ludzie serc nadjechał człowiek biega krzyczy zawodzi płacze włosy rwie patrzę chodzi wstydu obnaża nagle ciemno wiatr bicze podrywa słowa ust szaleńca patrzę płaczę arab krzyczy arab krzyczy ludzie twarzy ludzie serc ludzie twarzy ludzie serc granice granice mury zasieki zapory granice stalowe rzeki stalowe góry ludzie twarzy ludzie serc ludzie twarzy ludzie serc granice granice granice die grenze die grenze die niektórych wykonaniach „a człowiek krzyczy”,maanam-granice,granica mur zasieki zapor granica stalowy rzeka stalowy góry lud:s1 twarz lud:s1 serce lud:s1 twarz lud:s1 serce nadjechać człowiek biegać krzyczeć zawodzić płakać włos rwa patrzeć chodzić wstyd:s obnażać nagle ciemno:d wiatr bicz podrywać słowo usta szaleniec patrzeć płakać arab krzyczeć arab krzyczeć lud:s1 twarz lud:s1 serce lud:s1 twarz lud:s1 serce granica granica mur zasieki zapor granica stalowy rzeka stalowy góry lud:s1 twarz lud:s1 serce lud:s1 twarz lud:s1 serce granica granica granica die grenze die grenze die niektóry:a wykonanie „ człowiek krzyczeć
2965,2965,mówią serce dzikie ciało pole bitwy oprócz ciała duszę dusza śpi serce milczy patrzę chmury nisko skłębione karzą myśleć każde serce samotne szuka znajdzie siebie żyć jednym dachem samym łóżku miłości miłość łączy obcych ludzi oczy gubią łzy głęboko sercu mojego serca zamknięte imiona każdej zimie przychodzi wiosna spóźniona każdej zimie przychodzi wiosna spóźniona serce dzikie samotny myśliwy czeka każde spojrzenie czułe dotyk głęboko sercu mojego serca zamknięte imiona każdej zimie przychodzi wiosna spóźniona każdej zimie przychodzi wiosna spóźniona każdej zimie przychodzi wiosna spóźniona,maanam-gleboko_w_sercu,mówić serce dziki:a ciało pole bitwa oprócz ciało dusza dusza spać serce milczeć patrzeć chmura nisko skłębić karać myśleć każdy serce samotny szukać znajść siebie życie jeden:a dach sam:a łóżko miłość miłość łączyć obcy:a człowiek oczyć gubić łza głęboko serce mój:a serce zamknięty imienie każdy zima przychodzić wiosna spóźniony każdy zima przychodzić wiosna spóźniony serce dziki:a samotny myśliwy:a czekać każdy spojrzenie czuły dotyk głęboko serce mój:a serce zamknięty imienie każdy zima przychodzić wiosna spóźniony każdy zima przychodzić wiosna spóźniony każdy zima przychodzić wiosna spóźniony
2966,2966,nocy zobaczysz jarzące punkty bój bój bój nagle poczujesz cicho skrada bój bój bój mental cat mental cat niebieskie futerko uwielbiam wciąż latać mental cat mental cat mental cat bój dachu ogonem pomacha mental cat mental cat mental cat mental cat mental cat rogiem płacze słychać śmiech zatrzymaj zatrzymaj spojrzyj lewo potem spojrzyj prawo potem dookoła rozejrzyj mental cat mental cat nocy zobaczysz jarzące punkty bój bój bój spojrzyj lewo potem spojrzyj prawo potem dookoła rozejrzyj mental cat mental cat,maanam-mentalny_kot,noc zobaczyć jarzący punkt bój bój bój nagle poczuć cicho skradać:v1 bój bój bój mental cat mental cat niebieski futerko uwielbiać wciąż latać mental cat mental cat mental cat bój dach ogon pomachać mental cat mental cat mental cat mental cat mental cat róg płakać słychać:v śmiech:v zatrzymać zatrzymać spojrzeć lewo:d potem spojrzeć prawo:d1 potem dookoła:d rozejrzeć mental cat mental cat noc zobaczyć jarzący punkt bój bój bój spojrzeć lewo:d potem spojrzeć prawo:d1 potem dookoła:d rozejrzeć mental cat mental cat
2967,2967,wołam słowem pamięć znaczy wołam słowem serce wżera wołam myślą odważną szybką chcę widzieć zaraz zaraz znaczą słowa znaczą naszą miłość smutek tłumaczą patrzę nikogo patrzę cud patrzenia znaczę myśli znaczę usta żebym mogła tęsknić znaczy tęsknota znaczy naszą miłość smutek tłumaczy znaczą słowa znaczą miłość smutek tłumaczą,maanam-co_znacza_te_slowa,wołać słowo pamięć znaczyć wołać słowo serce wżera wołać myśl odważny szybki chcieć widzieć zaraz:d zaraz:d znaczyć słowo znaczyć nasz miłość smutek tłumaczyć patrzeć nikt patrzeć cud patrzenie znaczyć myślić znaczyć usta żeby:c móc tęsknić znaczyć tęsknota znaczyć nasz miłość smutek tłumaczyć znaczyć słowo znaczyć miłość smutek tłumaczyć
2968,2968,człowiek wszystkiego uczy nowa nowa siadać chodzić mówić najpierw buduje pocie czoła jednej chwili burzy pa pa pa pa ra pa pa pa pa pa pa ra pa pa każdą podłość wytłumaczy celu uświęca środki człowiek istota doskonała zbieranina pełna sprzeczności wyzbył strachu pełen lęku nieustannie brzęczy głowie innym obcym szuka zagrożenia swoim sercu nosi wroga pa pa pa pa ra pa pa ptaszek złotą klatkę pa pa pa pa ra pa pa ptaszek złota klatkę siebie zamknął złotej klatce klucze zmienia życie wartość żywioł ujarzmienia pa pa pa pa ra pa pa ptaszek złota klatkę pa pa pa pa ra pa pa ptaszek złotą klatkę,maanam-zlota_klatka__pa_pa_pa,człowiek wszystko:s uczyć nowy:a nowy:a siadać chodzić mówić najpierw budować pot czoło:s1 jeden:a chwila bury pa pa pa pa ra pa pa pa pa pa pa ra pa pa każdy podłość wytłumaczyć cel uświęcać środki człowiek istota doskonały zbieranina pełny sprzeczność wyzbyć strach:s1 pełny lęk nieustannie brzęczyć głowa inny:a obcy:a szukać zagrożenie swój serce nosić wrogi pa pa pa pa ra pa pa ptaszek:s1 złoty:a klatka pa pa pa pa ra pa pa ptaszek:s1 złoty:a klatka siebie zamknąć złoty:a klatka klucz zmieniać życie wartość żywioł ujarzmić pa pa pa pa ra pa pa ptaszek:s1 złoty:a klatka pa pa pa pa ra pa pa ptaszek:s1 złoty:a klatka
2969,2969,elektrospiro kontra zanzara elektrospiro kontra zanzara walka stara świat walka świat stara elektrospiro królem dnia zanzara panią nocy błyszczy światłem światłem słońca gwiazdami złoci elektrospiro pędzi wiatr zanzara mknie strzała powietrze przerażenia drży dudni ziemia słońce razem księżycem stoi zenicie patrzy walkę nocy dnia elektrospiro kontra zanzara powietrzu świszczą miecze zanzara pręży ciało zwyciężyć noc ziemi wiecznie trwała konie kopyta wzniosły wysoko zwarły dzikim rżeniem mkną coraz wyżej wyżej wyżej zaledwie cieniem spadają konie meteory ziemia rozwiera walce zwycięzcy zanzara noc rozpościera elektrospiro konrta zanzara elektrospiro konrta zanzara walka stara świat walka świat stara,maanam-elektrospiro_kontra_zanzara,elektrospiro kontra:s zanzara elektrospiro kontra:s zanzara walka stary:a świat walka świat stary:a elektrospiro król:s1 dzień:s1 zanzara pani noc błyszczeć światło:s światło:s słońce gwiazda złoty:a elektrospiro pędzić wiatr zanzara mknąć strzała powietrze przerażenie drżeć dudnieć ziemia słońce razem księżyc stoa zenit patrzyć walka noc dzień:s1 elektrospiro kontra:s zanzara powietrze świszczeć miecz zanzara prężyć ciało zwyciężyć noc ziemia wiecznie trwały koń:s kopyto wzniosły wysoko zewrzeć dziki:a rżenie mknąć coraz wysoce wysoce wysoce zaledwie:q cień spadać koń:s meteor ziemia rozwierać walc zwycięzca zanzara noc rozpościerać elektrospiro konrta zanzara elektrospiro konrta zanzara walka stary:a świat walka świat stary:a
2970,2970,nocny patrol czuwa kroczy ochoczo zagląda okien rozgląda wokół porządku początku latarnie świateł blask oddech zmęczony tupot nerwowy sypie szkło rozpaczy jęki zduszone krzyki sączy zło śpij śpij spokojnie śpij oddychaj głęboko śnij różowo śnij nocny patrol czuwa wytęża wzrok szepty krzyki cienie patrol równa krok porządku początku latarnie świateł blask,maanam-nocny_patrol,nocny patrol czuwać kroczyć ochoczo zaglądać okno rozglądać wokół:d porządek początek latarnia światła blask oddech zmęczony tupot nerwowy sypać szkło rozpacz jęk zduszony krzyk sączyć zło spać spać spokojnie spać oddychać głęboko śnić różowo śnić nocny patrol czuwać wytężać wzrok szept krzyk cień patrol równy krok porządek początek latarnia światła blask
2971,2971,dom fundamenty drżą brat bratu gardło podrzyna rola kreona heroiczna antygona tysiącleci zmienia same żądze same pragnienia stracisz lud odwróci późno życia wrócić bój kreonie zaśniesz przeze zechcę szczurem dotrę najmniejszą dziurę zechcę karaluchem szeptać przekleństwa ucha mogłam cieniem upalne południe czułą kochanką środku nocy mówisz siły chyba żartujesz twardym diamentem szlifujesz bój kreonie zaśniesz przeze zechcę szczurem dotrę najmniejszą dziurę zechcę karaluchem szeptać przekleństwa ucha mogłam cieniem upalne południe czułą kochanką środku nocy twardym diamentem szlifujesz,maanam-kreon,dom fundament drżeć brat brat gardło podrzynać rola Kreon heroiczny Antygona tysiąclecie zmieniać sam:a żądza sam:a pragnienie stracić lud:s1 odwrócić późno życie wrócić:v1 bój Kreon zasnąć przez zechcieć szczur dotrzeć mały:a dziura zechcieć karaluch szeptać przekleństwo ucha móc cień upalny południ czuły kochanka środek noc mówić siła:s chybać żartować twardy diament szlifować bój Kreon zasnąć przez zechcieć szczur dotrzeć mały:a dziura zechcieć karaluch szeptać przekleństwo ucha móc cień upalny południ czuły kochanka środek noc twardy diament szlifować
