,id,text,author_title,stemmed_text
2992,2992,znam tylu sumie choć fakt umiem stanąć zacnym tłumie posiadaczy ostatnich sumień mamy piątek jedenasta osiem widziałem dosłownie wszędzie bym poszedł tramwaju byłeś dziadkiem narzekałeś drugiemu dziadkowi laicyzację zachód robi zachód upadł nisko chce upaść niżej boga wyrzekł ściąga krzyże krzyże telewizji przykro powodu dzieci mordowanych in vitro kolei mięsnym byłeś łaskaw żalić europy liberalizm tolerancja pedali rana masz wynik spory widziałem sto twoich twarzy każdej tę samą gorycz upiory jakieś miejsc najodleglejszych upiór najbardziej tutejszy upiór daje wiarę upór krzyczy dyskutuj każe wznosić mury trupów upiór bym walczył ogół wczoraj szkoda zachodu siły pomysłów zepsuć twoją tarczę strachu zbroje kompleksów twoją pogardę zwykle wzbudza byle powód naprawdę szkoda zachodu siły tłuc truć iść tango jakieś grubsze pogo mówić kogoś dawno ogłuchł walczył upiorem szkoda zachodu x swój opór gaszę walcz obce walcz rozbijaj swój warowny obóz pasuję szkoda zachodu drugiej strony szkoda zachodu widzisz chcę narzekać szkoda paru drobnostek wolność słowa prawa człowieka klika zachodnich głupot znaczenia wolność prasy wolność zgromadzeń wolność sumienia demokracja kulawa młoda przyzwyczaiłem trochę szkoda żal odrobinę zabrać tę swobodę myśli równość mocno podupadła wiem chwilą zakopałem topór stracić rośnie opór domyślasz działania przyjmę modus szkoda zachodu niby siły tłuc truć iść tango jakieś grubsze pogo mówić kogoś dawno ogłuchł walczyć choćby upiorem szkoda zachodu x,lona_i_webber-szkoda_zachodu,znać:v tyle:n1 sum choć:c fakt umieć stanąć zacny tłum posiadacz ostatni:a sumienie mama piątek jedenasty:a osiem widzieć dosłownie wszędzie by:q pójść tramwaj być dziadek:s1 narzekać drugi:a dziadkowy laicyzacja zachód robić zachód upaść:v1 nisko chcieć upaść:v1 nisko bóg wyrzec ściąga krzyż krzyż telewizja przykro powód:s1 dziecko mordować in vitro kolej mięsny być łaskawy żalić europ liberalizm tolerancja pedali rany:a mieć wynik spory widzieć sto twój:a twarz każdy ten sam:a gorycz upiór jakiś miejsce odległy upiór bardzo tutejszy:a upiór dawać wiara upór krzyczeć dyskutować kazać wznosić mur trup upiór by:q walczyć ogół wczoraj:d szkoda:d zachód siła:s pomysł zepsucie twój:a tarcza strach:s1 zbroja kompleks twój:a pogarda zwykle wzbudzać byle:q powód:s1 naprawdę:i szkoda:d zachód siła:s tłuc truć iścić tango jakiś gruby:a pogo mówić kto dawno ogłuchnąć walczyć upiór szkoda:d zachód X swój opór gasić walczyć obcy:a walczyć rozbijać swój warowny obóz pasować szkoda:d zachód drugi:a strona szkoda:d zachód widzieć chcieć narzekać szkoda:d par:s2 drobnostka wolność słowo prawy:a1 człowiek klikać zachodni głupota znaczenie wolność prasa wolność zgromadzenie wolność sumienie demokracja kulawy:a młody:a przyzwyczaić trochę:d szkoda:d żal:v odrobina zabrać ten swoboda myślić równość mocno podupadły:a1 wiedzieć chwila zakopać topór stracić rosnąć opór domyślać działanie przyjąć modus szkoda:d zachód niby:j siła:s tłuc truć iścić tango jakiś gruby:a pogo mówić kto dawno ogłuchnąć walczyć choćby:q upiór szkoda:d zachód X
2993,2993,dzień zakrawa żart krawat kark rano potem kawa start posiada garb wrażenie sprawiam wrak prąd wyłączyli muszę śniadać unplugged źle wcześniej kręgosłup ból wszedł boleśnie tkwi dysk wypadł bliski zgon komu bije dzwon temu bije dzwon bije perspektywy blade najgorsze dopiero nadejść kompletny upadek przerwany chocholi taniec kaloryfer gorący włączyli ogrzewanie miłe źle tyle przyszła jesień przeoczyłem czas nadgryzł czas zęby nieliche kaloryfer nieoczekiwanie centralne ogrzewanie splata przemijaniem przekleństwa cedzę zęby cedzić jesień nachodzi zapowiedzi nieoczekiwanie centralne ogrzewanie splata przemijaniem przekleństwa cedzę zęby cedzić jesień nachodzi zapowiedzi trudno wstępie orzec żyłem myślą późny sierpień wczesny wrzesień lato pełni jesień gruchnęła grzejnik wyrok sądu prokuratorów następna jesień strach pomyśleć zapowiedzi jednego słowa wcześniej szczecińskie ciepłownictwo doświadczyło boleśnie tli gaśnie płomyk strasznie boli czas goni nieustannie czas włączył ogrzewanie niecnie krzyknąłem chwilo trwaj wiecznie nagle myśl błyska pewnie pogrzebie wyrwać jesieni choćby dzień chuj kaloryferem zakręcam obaw uda wiem warto spróbować nieoczekiwanie centralne ogrzewanie splata przemijaniem przekleństwa cedzę zęby cedzić jesień nachodzi zapowiedzi nieoczekiwanie centralne ogrzewanie splata przemijaniem trudno skoro splata proszę wyłączam kaloryfer wolę marznąć,lona_i_webber-kaloryfer,dzień:s1 zakrawać żart krawat kark rano:d potem kawa start posiadać:v2 garb wrażenie sprawiać wrak:s1 prąd wyłączyć musza śniadać unplugged źle wcześnie kręgosłup ból wejść boleśnie tkwieć dysk wypaść:v1 bliski zgon kto bić dzwon:s1 ten bić dzwon:s1 bić perspektywa blady zły:a dopiero nadejście kompletny upadek przerwać chocholi taniec kaloryfer:s1 gorący włączyć ogrzewanie miły:a źle tyli przyszły jesień przeoczyć czas:v nadgryźć czas:v ząb nielichy kaloryfer:s1 oczekiwać centralny ogrzewanie splatać przemijać przekleństwo cedzić ząb cedzić jesień nachodzić:v3 zapowiedzi oczekiwać centralny ogrzewanie splatać przemijać przekleństwo cedzić ząb cedzić jesień nachodzić:v3 zapowiedzi trudno wstęp orzec żyć myśl późny sierpień wczesny wrzesień lato pełny jesień gruchnąć grzejnik wyrok sąd prokurator:s1 następny:a jesień strach:v pomyśleć zapowiedzi jeden:a słowo wcześnie szczeciński ciepłownictwo doświadczyć boleśnie tlić gasnąć płomyk strasznie boleć:v2 czas:v gonić nieustannie czas:v włączyć ogrzewanie niecnie:d1 krzyknąć chwila trwać wiecznie nagle myśl błyskać pewnie:d1 pogrzebać wyrwać jesienić choćby:q dzień:s1 chuj:s1 kaloryfer:s1 zakręcać obawa udać wiedzieć warto spróbować oczekiwać centralny ogrzewanie splatać przemijać przekleństwo cedzić ząb cedzić jesień nachodzić:v3 zapowiedzi oczekiwać centralny ogrzewanie splatać przemijać trudno skoro:d splatać prosić wyłączać kaloryfer:s1 woleć marznąć
2994,2994,stoi korytarzu tuż drzwiach nieruchomo patrzy mrok mrok myśli toną wiek trudno zgadnąć trudno pominąć łeb siwizna przegrywa łysiną zabrał pół walizki widać jeździ pociągiem dawna porze trasie wsiada tyłu stanąć korytarzu takim samym stylu przyrósł pewnie wraca córki intelekt genów wyjechała domu studia temu żyje wielkim mieście wyszła mąż dumny wciąż tęskni tory pustego domu wiodą mieszka żoną gadają mrok oknem umacniał gasi szluga wysiada stacja obejrzyj parę zdjęć porwie pośpieszne połączenie skądkolwiek dokądkolwiek bądź nocny pociąg pełen ludzi duchów bliżej łapię lot łapię ruchu x szósty wagon warsem kawałek siedzi tuż drzwiach pustym przedziale drzwiach chce przesiąść wiem pięćdziesiąt wygląda pięćdziesiąt siedem niewiele życia przestrzeni patrzy pustkę nieobecnym wzrokiem nieruchomych źrenic obecna widać ślady cofnęła czasie cztery dekady razem zebrać odwrócić wybrać niewybraną drogę uciec wyobraźnią płodną wizję choćby myślach podjąć niepodjęte decyzje trwa chwilę czym wraca swoją bazę córka rzadko dzwoni mąż obcy chociaż żyją razem wracać zbiera wychodzi małą walizką obejrzyj parę zdjęć porwie pośpieszne połączenie skądkolwiek dokądkolwiek bądź nocny pociąg pełen ludzi duchów bliżej łapię lot łapię ruchu x oknem mrok gradło chwyta patrzy okno czytać miała mrok znalazł zbyt łatwo spojrzy widzi światło wygodny przedział ekspres jazda przyszłość przeszłość barwna niedorzecznie mąci jasny spokój pusty wzrok ojca raz pół matka niezgrabny taniec snuje niepotrzebna nikomu puste mieszkanie widzi rzadko zbyt rzadko zresztą czasu myśleć zaraz dworzec trzy pary torów wiodą mrok celu trzy pociągi trzy przedziały śroku troje pasażerów choćbyś wytężał tor zmieniał szynom pojadą razem najwyżej minąć obejrzyj parę zdjęć porwie pośpieszne połączenie skądkolwiek dokądkolwiek bądź nocny pociąg pełen ludzi duchów bliżej łapię lot łapię ruchu x,lona_i_webber-nocny_ekspres,stoa korytarz tuż:d drzwi nieruchomo patrzyć mrok mrok myślić tonąć wiek trudno zgadnąć trudno pominąć łeb:s1 siwizna przegrywać łysina zabrać póła walizka widać:v jeździć pociąg dawny por:s1 tras wsiadać tył stanąć korytarz taki:a sam:a styl przyrosnąć pewnie:d1 wracać:v1 córka intelekt gen wyjechać dom studia ten żyć wielki:a miesić wyjść mąż:s dumny wciąż tęskny tor pusty dom wieść:v mieszkać żona gadać mrok okno umacniać gasić szlug wysiadać stacja obejrzeć para zdjęcia porwać pośpieszny:a połączenie skądkolwiek dokądkolwiek bądź:j nocny pociąg pełny człowiek duch blisko:d łapię lot:s1 łapię ruch X szósty:a wagon wars kawałek siedzieć tuż:d drzwi pusty przedział drzwi chcieć przesiąść wiedzieć pięćdziesiąt wyglądać:v1 pięćdziesiąt siedem niewiele:d życie przestrzenić patrzyć pustka nieobecny:a wzrok nieruchomy źrenica obecny:a widać:v ślad cofnąć czas:s cztery dekada razem zebrać odwrócić wybrać niewybrany droga uciec wyobraźnia płodny wizja choćby:q myśl podjąć podjąć decyzja trwać chwila czy:q wracać:v1 swój baza córka rzadko dzwonić mąż:s obcy:a chociaż:c żyć razem wracać:v1 zbierać wychodzić:v2 mały:a walizka obejrzeć para zdjęcia porwać pośpieszny:a połączenie skądkolwiek dokądkolwiek bądź:j nocny pociąg pełny człowiek duch blisko:d łapię lot:s1 łapię ruch X okno mrok gradło chwytać patrzyć okno czytać mieć mrok znaleźć zbyt:s łatwo spojrzeć widzieć światło:d wygodny przedziać ekspres:s1 jazda przyszłość przeszłość barwny niedorzecznie:d1 mącić jasny spokój pusty wzrok ojciec raz:s1 póła matka niezgrabny:a1 taniec snuć niepotrzebny nikt pusty mieszkanie widzieć rzadko zbyt:s rzadko zresztą czas:s myśleć zaraz:d dworzec trzy par:s2 tor wieść:v mrok cel trzy pociąg trzy przedział śroku trzy pasażer choćby:c wytężać tor zmieniać szyna pojechać razem najwyżej minąć obejrzeć para zdjęcia porwać pośpieszny:a połączenie skądkolwiek dokądkolwiek bądź:j nocny pociąg pełny człowiek duch blisko:d łapię lot:s1 łapię ruch X
2995,2995,year year blad year doklej plakat year fsst year jestesmy kontakcie year kaloryfer year year pojecia year pogadasz year ostatnia prosta year patrz szerzej year szkoda zachodu year wyslij pocztowke year,lona_i_webber-metric,year year Blada:s2 year dokleić plakat year fsst year jestesmy kontakt year kaloryfer:s1 year year pojecia year pogadać year ostatni:a prosty:a year patrzeć szeroko year szkoda:d zachód year wyslij pocztowke year
2996,2996,widziałem żadnej hecy dawno pamiętam mówiłeś byłoby rzeczy dziabnąć staliśmy noc upalną odjebaną palmą widziałem czarno brnąłem brałem twoją odpowiedzialność pamiętam racji skądinąd najpierw puszczałaś uszu pijacki bełkot ust płynął parę domówek płynął dosyć wartko doprawdy dała uwieść takiemu dictum próżno szukać latarką ceniony dawniej nadmiar fantazji nagle kupiłeś kombii kurwa kombii bagażnik ostatnio piłaś chociaż kalendarz imprez spiętrzył pił odwoziłaś kombii wprost waszego m rozumiałem przyczyn spraw nietypowych ocknąłem świcie leżąc stołem malowniczym pępkowym przyszło świat szczęście niewymowne problem wiem imię wiem imię baby boom zaszedł doom wiem wiem imię wiem imię boli trochę rola mogę pogłaskać mogę zawołać wiem imię wiem imię baby boom zaszedł doom wiem wiem imię wiem imię uroczy brzdąc doprawdy imię sprząc szans widzę walczę tyłu tola maja marianka lila filip adam jaś franek bazyli alik hubert mikołaj zbylut tyle pamiętam resztę próbuję obejść poprzestając komplementach stylu och pięknie rośnie młode prę przodu tę plagę choć wiem powinienem przeć mniejsza imię żebym chociaż znał płeć moment dziecko mądre dziecko patrzy chciało upewnić widzisz wie wiesz dałoby chętnie temu wyraz nieco dobitniej póki mówi niewiele szansa sypnie boli mniejsza jakość ilość bólu tę pamięć imion osłabła odkąd przyrost urósł przyszło świat wiosną minęła jesień mogę wciąż przypomnieć nazywa owoc waszych uniesień liczę cichu problem zgaśnie nauczę imion dzieci przyjdzie zawołać własne razie wiem imię wiem imię baby boom zaszedł doom wiem wiem imię wiem imię boli trochę rola mogę pogłaskać mogę zawołać wiem imię wiem imię baby boom zaszedł doom wiem wiem imię wiem imię uroczy brzdąc doprawdy imię sprząc szans widzę,lona_i_webber-nie_mam_pojecia,widzieć żaden heca dawno pamiętać mówić być rzecz dziabnąć stać:v3 noc upalny odjebać palma widzieć czarno brnąć brać:v twój:a odpowiedzialność pamiętać racja skądinąd:d najpierw puszczać ucho:s2 pijacki bełkot:s1 usta płynąć para domówka płynąć dosyć:v wartko doprawdy:i dać uwieść taki:a dictum próżno szukać latarka cenić dawno nadmiar fantazja nagle kupić:v1 kombii kurwa:s kombii bagażnik ostatnio:d pić chociaż:c kalendarz impreza spiętrzyć pić odwozić kombii wprost:d wasz metr rozumieć przyczyna sprawa nietypowy ocknąć świt leżeć stół malowniczy pępkowy przyjść świat szczęście niewymowny problem wiedzieć imię wiedzieć imię baba:s1 boom zajść:v1 doom wiedzieć wiedzieć imię wiedzieć imię boleć:v2 trochę:d rola móc pogłaskać móc zawołać wiedzieć imię wiedzieć imię baba:s1 boom zajść:v1 doom wiedzieć wiedzieć imię wiedzieć imię uroczy brzdąc doprawdy:i imię sprzęgnąć szansa widzieć walczyć tył Tolo maja Marianka lila:a filip Adam:s2 jaś Franek:s2 Bazyli alik Hubert:s2 mikołaj Zbylut:s2 tyli pamiętać reszta próbować obejście poprzestawać:v2 komplement styl och pięknie rosnąć młody:a przeć:v1 przód ten plaga choć:c wiedzieć powinien przeć:v1 mały:a imię żeby:c chociaż:c znać:v płeć moment dziecko mądry dziecko patrzyć chcieć upewnić widzieć wiedzieć wiedzieć dać chętnie ten wyraz nieco:d dobitnie póki mówić niewiele:d szansa sypnąć boleć:v2 mały:a jakość ilość ból ten pamięć imienie osłabły:a1 odkąd przyrost urosnąć przyjść świat wiosna minąć jesień móc wciąż przypomnieć nazywać owoc wasz uniesienie liczyć cichy problem zgasnąć nauczyć imienie dziecko przyjść zawołać własny raz:s1 wiedzieć imię wiedzieć imię baba:s1 boom zajść:v1 doom wiedzieć wiedzieć imię wiedzieć imię boleć:v2 trochę:d rola móc pogłaskać móc zawołać wiedzieć imię wiedzieć imię baba:s1 boom zajść:v1 doom wiedzieć wiedzieć imię wiedzieć imię uroczy brzdąc doprawdy:i imię sprzęgnąć szansa widzieć
2997,2997,stanął słońcu wielki dom dom ponoć dawniej jaśniał płonął płonął często regularnie „lux in tenebris łac „światło ciemnościach średnik zwykle iskrę jedną dom stawał ogniu wraz wewnątrz tlen znacznie drożał mieli zwyczaju stąd wiać pożar trudno pożaru choć ślad paru dom całkiem zarósł brak żaru chętnie kiedyś braku lepszych perspektyw stawiał ogniu obiekty energii mniejszy utraty stopień poznikały kraty okien działa balsam dom zmienił problem mieszkańcach stanął słońcu wielki dom dawna grozi pożar pali x rzeczy panie jacku chcieliście stąd wiać chcemy trwać brak spójności temu staremu bractwu mamy ogień dać mógł ognioodporność prawdziwą każe patrzeć krzywo przyrodzona genów zapalczywość ogień pozostał rusztach łóżek rozgadana beztroska smutno mieni trud polemik trudno zmienić produktywnego głód płomieni krótko trening trwał ustalić domu pożar raczej wypali uciekamy stąd struci rzuci chwilę ogół wrócić czas nauczyć pamięć wielki dom stoi ogniu długo stanie stanął słońcu wielki dom dawna grozi pożar pali x,lona_i_webber-nic_tu_po_nas,stanąć słońce wielki:a dom dom ponoć dawno jaśnieć:v1 płonąć płonąć często regularnie „ in tenebris łac „ ciemność średnik zwykle iskra jeden:a dom stawać:v2 ogień wraz:s wewnątrz:d tlen znacznie:d drożeć mieć zwyczaj stąd wiać pożar trudno pożar choć:c ślad par:s2 dom całkiem zarosnąć brak:v żar chętnie kiedy:c brak:s dobry:a perspektywa stawiać ogień obiekt energia mały:a utrata stopień poznikać krata okno działać balsam dom zmienić problem mieszkaniec stanąć słońce wielki:a dom dawny grozić pożar pali X rzecz pani Jacek:s2 chcieć stąd wiać chcieć trwać brak:v spójność ten stary:a bractwo mama ogień dać móc ognioodporność prawdziwy kazać patrzeć krzywo przyrodzony gen zapalczywość ogień pozostać ruszt łóżko rozgadany beztroski smutno mienić:v1 trud polemik trudno zmienić produktywny głód płomienić krótko trening trwać ustalić:v1 dom pożar raczy wypalić uciekać stąd struć rzucić chwila ogół wrócić:v1 czas:v nauczyć pamięć wielki:a dom stoa ogień długo stanąć stanąć słońce wielki:a dom dawny grozić pożar pali X
2998,2998,czas biegnie tempo szalone walczę wyrwać moment fakt kawałek chlasnę siadam ławce czytam prasę ej przykład traf trafił ledwo zacząłem drugi akapit dziewczę staje młode wiekiem okiem łypie gazetę pyta długich przemów wiedziałem koleżanki szła tędy chwilę temu mówię mały dysonans szła mówiła dziewczę przełamuje impas pyta szybko szła blondynka mówię przeleciała biegiem miała pióra kolor wiem akurat temat wiedzę wątłą blond blond blond blond blond rozstrzygnięcia nastąpią blond blond blond blond blond niestety rzeczy nieznane blond blond blond blond blond brak odpowiedzi konto blond blond blond blond blond innym razem łajbą płynę gazet tę książkę kolubrynę autor raczej nobla weźmie ostatecznie czyta nieźle literatura kontakt wodą trzech dziadków coraz głośniej spór wiodą jedną rzec razu ustalmy spór kurwa fundamentalny dziadek bije alarm czym płyniemy statek katamaran drugiego trzęsie takich ocen krzyczy barka trzeci pije kielich mówi prom tamci jebnęli łeb widzi aprobaty twarzach zwraca pyta uważam temat wiedzę wątłą prom prom prom prom prom rozstrzygnięcia nastąpią prom prom prom prom prom niestety rzeczy znane prom prom prom prom prom brak odpowiedzi konto prom prom prom prom prom większa klika ludzi nachodzą czytam szyją podwójnym ściegiem pytają sprawy wiem plener trawa beton sięgnę książkę mignę gazetą nieuchronnie chmara zrywa sunie ponagabywać zero luzu tekst lepiej napisany najebanych intruzów grafomaństwie choćby tycim podchodzą trzeźwi niedopici myślach łapie każdą istot kiedykolwiek weszła czytelnictwo biorę stawiam rząd pytam błąd chciałbym poczytać muszę mierzyć kontrą błąd błąd błąd błąd błąd rozstrzygnięcia nastąpią błąd błąd błąd błąd błąd niestety rzeczy znane błąd błąd błąd błąd błąd garść odpowiedzi konto błąd błąd błąd błąd błąd,lona_i_webber-blad,czas:v biec tempo szalony:a walczyć wyrwać moment fakt kawałek chlasnąć siadać ławka czytać prasa ej przykład traf:s trafić ledwo:d zacząć drugi:a akapit dziewczę staje młody:a wiek oko:s1 łypać gazeta pytać długi przemowa wiedzieć koleżanka iść tędy chwila ten mówić mały:a dysonans iść mówić dziewczę przełamywać impas pytać szybko iść blondynka mówić przelecieć bieg mieć pióro kolor wiedzieć akurat:d temat wiedza wątły blond:a blond:a blond:a blond:a blond:a rozstrzygnięcie nastąpić blond:a blond:a blond:a blond:a blond:a niestety rzecz nieznany blond:a blond:a blond:a blond:a blond:a brak:v odpowiedź konto blond:a blond:a blond:a blond:a blond:a inny:a razem łajba płynąć gazeta ten książka kolubryna autor raczy nobel:s1 wziąć ostatecznie czytać nieźle:d1 literatura kontakt woda trzy dziadkowie coraz głośnie spór wieść:v jeden:a rzec:v2 raz:s1 ustalić:v1 spór kurwa:s fundamentalny dziadek:s1 bić alarm czy:q płynąć statek katamaran drugi:a trząść taki:a ocena krzyczeć barka trzeci:a pić kielich:s1 mówić prom tamten jebnąć łeb:s1 widzieć aprobata twarz zwracać pytać uważać temat wiedza wątły prom prom prom prom prom rozstrzygnięcie nastąpić prom prom prom prom prom niestety rzecz znany:a prom prom prom prom prom brak:v odpowiedź konto prom prom prom prom prom wielki:a klikać człowiek nachodzić:v3 czytać szyja podwójny ścieg pytać sprawa wiedzieć plener trawa beton:s1 sięgnąć książka mignąć gazeta nieuchronnie chmara zrywać:v1 sunąć:v2 ponagabywać zero:s luz tekst dobrze napisać najebać intruz:s1 grafomaństwo choćby:q tyci podchodzić trzeźwy dopić myśl łapać każdy istota kiedykolwiek wejść czytelnictwo brać:v stawiać rząd:s1 pytać błąd chcieć poczytać:v1 musza mierzyć kontra:s błąd błąd błąd błąd błąd rozstrzygnięcie nastąpić błąd błąd błąd błąd błąd niestety rzecz znany:a błąd błąd błąd błąd błąd garść odpowiedź konto błąd błąd błąd błąd błąd
