,id,text,author_title,stemmed_text
3016,3016,maryla maryla kwita wie zasadzie resztę pyta maryla maryla kwita miłości niesyta szynszyle spowita widok gardło widok gardło panów chwyta maryla maryla kwita niejeden źle skończył satelita maryla maryla kwita linię mieć jadam dzień bobovita dżentelmenów świta widok staje wryta jam wśród łez łaszę wierny pies czyś forsą nosisz fez pince nez jutro sprawom kres kładąc powiem bodajś sczezł będziesz bzyczał giez nadawał sos kocham czarnych nut muzyce brzmią muzyce brzmią nieraz brała pokusa dłuższy mariaż dusz ciał cóż kochaś czuł bluesa bukowe ucho biedak miał sypnij złotem cierp płotem krzyknę wróć wprzódy bluesa musisz czuć maryla maryla kwita wierzę kiedyś przystanę wryta stanę maryla maryla kwita całą prawdę mych oczach wyczyta muzykę swoją muzykę swoją schwyta gęstą sieć marylą szynszyle spowitą zwykłą kobitą normalną kobitą połatam kurtkę tę wiatrem podszytą przepiorę skarpetki skoczę tytoń byle wpisał pięciolinię zmierzchu świtu nut czarnych nut,maryla_rodowicz-jestem_maryla,Maryla Maryla kwita wiedzieć zasada reszta pytać Maryla Maryla kwita miłość niesyty szynszyl spowić widok gardło widok gardło pan chwytać Maryla Maryla kwita niejeden:a źle skończyć satelita:s1 Maryla Maryla kwita linia mieć jadać dzień:s1 bobovita dżentelmen świtać widok staje wryć ja wśród łza łasza wierny:a pies:s1 czy:q forsa nosić fez pinka nez jutro:d sprawa kres kłaść powiedzieć bodajś sczeznąć być bzyczeć giez nadawać:v1 sos kochać czarny:a nut muzyka brzmieć:v1 muzyka brzmieć:v1 nieraz brać:v pokusa długi mariaż dusz ciało cóż kochaś czuć:v blues bukowy ucho:s1 biedak mieć sypnąć złoto:s cierpieć płot krzyknąć wrócić:v1 wprzódy blues musieć czuć:v Maryla Maryla kwita wierzyć kiedy:c przystanąć wryć stanąć Maryla Maryla kwita cały prawda:s mój:a oko:s2 wyczytać muzyka swój muzyka swój schwytać gęsty sieć Maryla szynszyl spowić zwykły:a1 kobita normalny:a kobita połatać kurtka ten wiatr podszyć przeprać skarpetka skoczyć tytoń byle:q wpisać pięciolinia zmierzch świt nut czarny:a nut
3017,3017,ludzie chcą żyć parami obyczaje dawne poszły het chłopcy chcą chłopcami lubią kokosanki ciepły pled dziewczyna pirat pełną parą ocean pruć hop chlup hoc hoc dajcie drugi głos drugi głos drugi głos chłopczyny każdej los drugi głos drugi głos dajcie zatem drugi głos dziewczyna pirat bystre oko podkuty but pęknięta lina nucisz nut miło liną smutno ciut dziewczyna pirat panamy wyspę kos hop chlup hoc hoc dajcie drugi głos drugi głos drugi głos chłopczyny każdej los drugi głos drugi głos dajcie zatem drugi głos płyń arko poczwarko motylkiem pstrym x drugi głos drugi głos chłopczyny każdej los drugi głos drugi głos dajcie zatem drugi głos,maryla_rodowicz-dziewczyna_pirat,lud:s1 chcieć życie para obyczaj dawny pójść het chłopiec chcieć chłopiec lubić kokosanka ciepły pled dziewczyna pirat:s1 pełny para ocean pruć hop:s chlup hoc hoc dać drugi:a głos drugi:a głos drugi:a głos chłopczyna każdy los drugi:a głos drugi:a głos dać zatem drugi:a głos dziewczyna pirat:s1 bystry oko:s1 podkuty but pęknąć lina nucić nut miło lina smutno ciut dziewczyna pirat:s1 panama wyspa kos hop:s chlup hoc hoc dać drugi:a głos drugi:a głos drugi:a głos chłopczyna każdy los drugi:a głos drugi:a głos dać zatem drugi:a głos płynąć arka poczwarka motylek pstry X drugi:a głos drugi:a głos chłopczyna każdy los drugi:a głos drugi:a głos dać zatem drugi:a głos
3018,3018,niemożliwym niebie niemożliwe anioły niemożliwym niebie niemożliwy dom wcale chodzić szkoły końca błazeńskim grom niemożliwym domu niemożliwe przedmioty niemożliwym domu niemożliwy stół południa tańce psoty całe niczego pół piosenka usłyszysz leokadią wiedz mogłaby frunąć niebie płynąć radio piosenka dźwięczy śmiech szloch dopadnie pile łebie pomyślisz cichutko oho niemożliwy ranek niemożliwe prezenty niemożliwy ranek śnieg pada kwiat zakopane zeszyt zaczęty niezapisany tylu x piosenka usłyszysz leokadią wiedz mogłaby frunąć niebie płynąć radio piosenka dźwięczy śmiech szloch dopadnie pile łebie pomyślisz cichutko oho,maryla_rodowicz-zaczety_zeszyt,niemożliwy:a1 niebo niemożliwy:a1 anioł niemożliwy:a1 niebo niemożliwy:a1 dom wcale chodzić szkoła koniec błazeński grom niemożliwy:a1 dom niemożliwy:a1 przedmiot niemożliwy:a1 dom niemożliwy:a1 stół południ tańce psota cały nic póła piosenka usłyszeć Leokadia:s2 wiedza móc frunąć:v1 niebo płynąć radio piosenka dźwięczeć śmiech:v szloch dopaść:v1 piła Łeba pomyślić cichutko oho niemożliwy:a1 ranek niemożliwy:a1 prezent niemożliwy:a1 ranek śnieg padać:v1 kwiat zakopać zeszyt zacząć niezapisany tyle:n1 X piosenka usłyszeć Leokadia:s2 wiedza móc frunąć:v1 niebo płynąć radio piosenka dźwięczeć śmiech:v szloch dopaść:v1 piła Łeba pomyślić cichutko oho
3019,3019,ślub wśród najwyższych sfer odlot mieć chciał sto prób odbyło miejsce znał miał gruchnąć marsz biskup stułę gładkie dłonie wziął pierwszych ław nagle wrzasnął rany boskie stop zrobił szum wiem tłum ryknął głos stało mamą mama zniknęła stąd krótką chwilę zmyła przeszukać kąt stało mamą musiał widzieć ślub wstrzymamy mamy goście dzieci zaczął ruch placu pełnym blaszanych szczęk wzdłuż naw rozległ telefonów komórkowych brzęk drzwi pchali czymś szybko chcieli zbiec wciąż rósł kościołem kurz mercem szybko śmigał merc chwilę fax poszło kraj jaj wśród kraks problem naj naj naj stało mamą mama oko metry wysoka uwielbia stek gulasz plecach tatuaż grozi wielka wsypa wyskakuje jeepa opis kończy list gończy,maryla_rodowicz-co_sie_stalo_z_mama,ślub wśród najwyższy sfera odlot mieć chcieć sto próba odbyć miejsce znać:v mieć gruchnąć marsz:s1 biskup stuła gładki dłoń wziąć pierwszy:a ława nagle wrzasnąć rany:a boski stop:s zrobić szum wiedzieć tłum ryknąć głos stać:v3 mama mama zniknąć stąd krótki chwila zmyć przeszukać kąt stać:v3 mama musieć widzieć ślub wstrzymać mama gościa dziecko zacząć ruch plac pełny blaszany szczęk wzdłuż:d nawa rozlec telefon komórkowy brzęk drzwi pchać co:s szybko chcieć zbiec wciąż rosnąć kościół kurz merc szybko śmigać merc chwila fax pójść kraj jaja wśród kraksa problem naja naja naja stać:v3 mama mama oko:s1 metr:s1 wysoki uwielbiać stek:s1 gulasz plecy tatuaż grozić wielki:a wsypa wyskakiwać jeep opis kończyć list gończy:a
3020,3020,zostanę królową zostanę królową choć miałabym przebić mur własną głową papier gwarancją mojej korony lulejko mym mężem trenujcie ukłony pas kłaniać schodzić drogi codziennie dawać obiad pierogi robić lubię robić każę krawcy szewcy kupcy piekarze reprezentować otwierać uświetniać zaszczycać przyjmować witać żegnać nagradzać karać zamian musicie starać królowej smucić uśmiechać stale urządzać bale festiwale bale festiwale bale festiwale bale festiwale wspaniale zostanę królową zostanę królową choć miałabym przebić mur własną głową papier gwarancją mojej korony lulejko mym mężem trenujcie ukłony pas kłaniać schodzić drogi codziennie dawać obiad pierogi robić lubię robić każę krawcy szewcy kupcy piekarze reprezentować otwierać uświetniać zaszczycać przyjmować witać żegnać nagradzać karać zamian musicie starać królowej smucić uśmiechać stale urządzać bale festiwale bale festiwale bale festiwale bale festiwale wspaniale,maryla_rodowicz-zostane_krolowa,zostać królowy zostać królowy choć:c mieć przebicie mur własny głowa papier gwarancja mój:a korona lulejko mój:a mąż:s trenować ukłony pas:s1 kłaniać:v1 schodzić:v2 drogi:a codziennie dawać obiad pierog robić lubić robić kazić krawiec szewc kupiec piekarz reprezentować otwierać uświetniać zaszczycać przyjmować witać żegnać:v1 nagradzać karać zamiana musieć starać królowy smucić uśmiechać stale urządzać bal:s1 festiwal bal:s1 festiwal bal:s1 festiwal bal:s1 festiwal wspaniale zostać królowy zostać królowy choć:c mieć przebicie mur własny głowa papier gwarancja mój:a korona lulejko mój:a mąż:s trenować ukłony pas:s1 kłaniać:v1 schodzić:v2 drogi:a codziennie dawać obiad pierog robić lubić robić kazić krawiec szewc kupiec piekarz reprezentować otwierać uświetniać zaszczycać przyjmować witać żegnać:v1 nagradzać karać zamiana musieć starać królowy smucić uśmiechać stale urządzać bal:s1 festiwal bal:s1 festiwal bal:s1 festiwal bal:s1 festiwal wspaniale
3021,3021,kolejną noc stary pies obroży pordzewiałych gwiazd łasi skamle rwie dopadnie pas wgryzie dziąsła drapać jęczeć kąsać choćby szarpała świtu wyrwie gardeł tamtych krzyków capstrzyku szaleńczo górę górę grzać zgarniać chwytać łapać brać zaraz amen klezmer grać kropelce maluchu sączyć życie chlać gwinta musimy przeżyć przetrzymać choćby perliło spod rzęs życia wyrwać soczysty krwisty kęs przysięgam miesiąc góra najdalej tuż świętach szlag wniebowzięta szaleńczo górę górę grzać zgarniać chwytać łapać brać zaraz amen klezmer grać kropelce maluchu sączyć życie chlać gwinta odpalimy ostro choćby pożreć miało choćby groziło stosem chłostą zagramy raz lodem parzących skroniach bólu szarpiąc każdą strunę zdążymy choćby biły gromy zaliczyć każdą chmurę szaleńczo górę górę grzać zgarniać chwytać łapać brać zaraz amen klezmer grać kropli maluchu sączyć chlać życie chlać choćby gwinta,maryla_rodowicz-vexel,kolejny noc stary:a pies:s1 obroża pordzewiały gwiazda łasy skamleć rwa dopaść:v1 pas:s1 wgryźć dziąsło drapać jęczeć kąsać choćby:q szarpać świt wyrwać gardło tamten krzyk capstrzyk szaleńczo góra góra grzać zgarniać chwytać łapać brać:s zaraz:d amen:s klezmer grać kropelka maluch:s1 sączyć życie chlać gwinta musieć przeżycie przetrzymać choćby:q perlić spod rzęsa życie wyrwać soczysty krwisty kęs przysięgać miesiąc góra daleko tuż:d święto:s szlag wniebowzięty szaleńczo góra góra grzać zgarniać chwytać łapać brać:s zaraz:d amen:s klezmer grać kropelka maluch:s1 sączyć życie chlać gwinta odpalić ostro choćby:q pożreć mieć choćby:q grozić stos chłosta zagrać raz:s1 lód:s1 parzyć:v1 skroń ból szarpać każdy struna zdążyć choćby:q bić gromy zaliczyć każdy chmura szaleńczo góra góra grzać zgarniać chwytać łapać brać:s zaraz:d amen:s klezmer grać kropla maluch:s1 sączyć chlać życie chlać choćby:q gwinta
3022,3022,małolatą jesteś tata dołuje powera odbiera zarodku sprawdza notes kieszenie kontroluje zgasić pali środku sobotę imprezę ostrzysz smak tata piwkiem leżąc mówi ech mała szalej masz wcześnie bale kluby przyjdzie czas baw zapałkami sparzy żar siedź chałupie wieczorami kusi bal ech mała szalej testem goni test życie mała mężatką jesteś dwadzieścia parę mąż pocztówki zbiera znaczki przyśni knajpa kabaret jakimś tangiem argentyńskim kolacji mały koniak kawą chcesz wyrwać vis vis mąż łamie stawach znad gazety powie ech mała szalej masz późno bale miał dał świat baw zapałkami sparzy żar siedź chałupie wieczorami kusi bal ech mała szalej sprzątaj gotuj pierz życie mała kąciku swoim siedzisz cichutku uśmieszek dobrotliwy masz twarzy sernikiem konfiturą robótką kompletnie marzy zapachnie różą nagle wyda bozia górze cicho szepnął ole ech mała poszalej masz zapal nalej dał świat baw wreszcie zapałkami sparzy żar siedź domu wieczorami kusi bal ech mała poszalej garściami bierz chcesz życie mała x,maryla_rodowicz-ech_mala,małolata być tata dołować powera odbierać zarodek sprawdzać notes kieszenia kontrolować zgasić pali środek sobota impreza ostrzyć smak tata piwko leżeć mówić echo mały:a szalej mieć wcześnie bal:s1 klub przyjść czas:v bawić zapałka sparzyć:v1 żar siedzieć chałupa wieczor kusy:a bal:s1 echo mały:a szalej test gonić test życie mały:a mężatka być dwadzieścia para mąż:s pocztówka zbierać znaczek przyśnić:v1 knajpa kabaret jakiś tango argentyński kolacja mały:a koniak kawa chcieć wyrwać vis vis mąż:s łamać stawa znad gazeta powiedzieć echo mały:a szalej mieć późno bal:s1 mieć dać świat bawić zapałka sparzyć:v1 żar siedzieć chałupa wieczor kusy:a bal:s1 echo mały:a szalej sprzątać gotować pierz życie mały:a kącik swój siedzieć cichutki uśmieszek dobrotliwy mieć twarz sernik konfitura robótka kompletnie marzyć zapachnieć róża nagle wydać bozia góra cicho szepnąć Ola echo mały:a poszaleć mieć zapalić nalać dać świat bawić wreszcie zapałka sparzyć:v1 żar siedzieć dom wieczor kusy:a bal:s1 echo mały:a poszaleć garść brać:v chcieć życie mały:a X
3023,3023,polska deszczowa czekam mieście ludzie mówili cudzie rzadko słońce chmury przedziera dbam siebie obiad chleb herbatą herbata chińska masło wyborowe okazji śmierć krawatom bujnie myślałam ostatnio świecie deszczu twoich udach miłości udałoby absolutnie noc deszczowa czekam mieście ludzie mówili cudzie żyć powietrza wiem kochany wiem okropne lato potrzebie wiem wiem poradzić bujnie myślałam ostatnio,maryla_rodowicz-absolutnie_nic,polski:a deszczowy czekać miesić lud:s1 mówić cud rzadko słońce chmura przedzierać dbać siebie obiad chleb herbata herbata chiński:a masło wyborowy okazja śmierć krawat bujnie myśleć ostatnio:d świat deszcz twój:a ud miłość udać absolutnie noc deszczowy czekać miesić lud:s1 mówić cud życie powietrze wiedzieć kochany:a wiedzieć okropny lato potrzeb wiedzieć wiedzieć poradzić bujnie myśleć ostatnio:d
3024,3024,płynął strumyk zielony las brzegu leżał stu kilowy głaz płynął strumyk minął czas stu kilowy głaz zaginął strumyk płynie płynął cicha woda brzegi rwie wiesz zdążysz zabezpieczyć zna nikt metody ustrzec cichej wody cicha woda brzegi rwie wie rację powiem przysłowie cicha woda brzegi rwie szła dziewczyna zielony las spojrzała raz popatrzyła minął czas widocznie uroda cicha woda cicha woda brzegi rwie wiesz zdążysz zabezpieczyć zna nikt metody ustrzec cichej wody cicha woda brzegi rwie wie rację powiem przysłowie cicha woda brzegi rwie płynie strumyk zielony las skończył kawalerski czas proszę żonka słyszy śpiewam najciszej cicha woda brzegi rwie wiesz zdążysz zabezpieczyć zna nikt metody ustrzec cichej wody cicha woda brzegi rwie wie rację powiem przysłowie cicha woda brzegi rwie,maryla_rodowicz-cicha_woda,płynąć strumyk zielony:a las brzeg leżeć sto kilowy głaz płynąć strumyk minąć czas:v sto kilowy głaz zaginąć strumyk płynąć płynąć cichy woda brzeg rwa wiedzieć zdążyć zabezpieczyć znać:v nikt metoda ustrzec cichy woda cichy woda brzeg rwa wiedzieć racja powiedzieć przysłowie cichy woda brzeg rwa iść dziewczyna zielony:a las spojrzeć raz:s1 popatrzyć minąć czas:v widocznie:d uroda cichy woda cichy woda brzeg rwa wiedzieć zdążyć zabezpieczyć znać:v nikt metoda ustrzec cichy woda cichy woda brzeg rwa wiedzieć racja powiedzieć przysłowie cichy woda brzeg rwa płynąć strumyk zielony:a las skończyć kawalerski czas:v prosić żonka słyszeć śpiewać cicho cichy woda brzeg rwa wiedzieć zdążyć zabezpieczyć znać:v nikt metoda ustrzec cichy woda cichy woda brzeg rwa wiedzieć racja powiedzieć przysłowie cichy woda brzeg rwa
3025,3025,mama forsie tatko bóg wie czarną różę gorsie wesoło bawię czarną różę gorsie wesoło bawię zostanę marynarzem odkryję nowy ląd miał moc silnych wrażeń pewność ano stąd mama forsie tatko bóg wie czarną różę gorsie czarne róże czarną różę gorsie czarne róże kiedyś grać cytrze cytrynówkę pić prawda oczywiście jakże śmiałabym kpić mama forsie tatko bóg wie czarną różę gorsie proszę państwa źle czarną różę gorsie proszę państwa źle zostanę wreszcie carem urządzę wszędzie raj świat zapieni szampanem najlepiej naj naj naj mama forsie tatko bóg wie czarną różę gorsie czarną różę itp czarną różę gorsie czarną różę itp,maryla_rodowicz-moja_mama_jest_przy_forsie,mama forsa tatko bóg wiedzieć czarny:a róża gors wesoło bawić czarny:a róża gors wesoło bawić zostać marynarz odkryć nowy:a ląd mieć moc:s silny wrażenie pewność ano stąd mama forsa tatko bóg wiedzieć czarny:a róża gors czarny:a róż czarny:a róża gors czarny:a róż kiedy:c grać cytra cytrynówka picie prawda:s oczywiście:d jakże śmiać kpić mama forsa tatko bóg wiedzieć czarny:a róża gors prosić państwo:s1 źle czarny:a róża gors prosić państwo:s1 źle zostać wreszcie car urządzić wszędzie raj świat zapienić szampan dobrze naja naja naja mama forsa tatko bóg wiedzieć czarny:a róża gors czarny:a róża itp czarny:a róża gors czarny:a róża itp
3026,3026,don t care who s bound glory just try live story like spend sunday mornings beach don t know where life is going don t care for such kind of knowing m doing all that can but everybody knows that m rich who said the time is money who cares it s fun it s funny have some time and money but ve got whole life plan who said the time is money peace it got money private time is money and then have fun until the end m not kind of girl that s easy it s so hard make me smile and tease me like it lot when something new knocks door don t know when train finds the station but know that m alwyas patient got reason hurry when everybody knows that m poor who said the time is money who cares it s fun it s funny have some time and money but ve got whole life plan who said the time is money peace it got money private time is money and then have fun until the end,maryla_rodowicz-time_is_money,don:b1 tona care WHO sekunda bound glory Just:s2 try live story like spend sunday mornings beach don:b1 tona know where life IS going don:b1 tona care for Such:s2 kind of knowing metr doing all that can but everybody knows that metr rich WHO said the time IS money WHO cares Ita sekunda fun Ita sekunda funny have some time Anda money but ve got whole life plan WHO said the time IS money peace Ita got money private time IS money Anda Then:s1 have fun until the end metr nota kind of girl that sekunda easy Ita sekunda Księga_Sofoniasza hard make mój:a smile Anda tease mój:a like Ita lot:s1 when something Newa knocks door don:b1 tona know when train finds the station but know that metr alwyas patient got reason hurry when everybody knows that metr Poor:s1 WHO said the time IS money WHO cares Ita sekunda fun Ita sekunda funny have some time Anda money but ve got whole life plan WHO said the time IS money peace Ita got money private time IS money Anda Then:s1 have fun until the end
3027,3027,chowasz maryla pewno ole ole prowadź muzyko ole ole razem bądź ole ole znikąd donikąd ole ole bądź bywa klęczek wstaje dzień zamiast słońca dziura niebie świat przykrywa wielki cień siebie głos maryla rozpylaj życie chwila marnuj maniu dni dręcz mania jesteś śpiewania wzbraniaj weź kupę maniu mija stres słyszę czadu maryla ważne słowa mija stres słyszę czadu maryla żyje gra wieczora trwa nieprzerwany cud szaleje dzwięków sfora fruną pszczoły nut dobra pora uszy spływa miód rana wieczora bywa,maryla_rodowicz-czadu_maryla,chować Maryla pewno:d Ola Ola prowadzić muzyka Ola Ola razem bądź:j Ola Ola znikąd donikąd Ola Ola bądź:j bywać klęczki wstawać dzień:s1 zamiast:j słońce dziura niebo świat przykrywa wielki:a cień siebie głos Maryla rozpylać życie chwila marnować Mania:s1 dzień:s1 dręczyć mania być śpiewać wzbraniać wziąć kupa Mania:s1 mijać stres słyszeć czad Maryla ważny słowo mijać stres słyszeć czad Maryla żyć gra wieczor trwać nieprzerwany cud szaleć dzwięków sfora frunąć:v1 pszczoła nut dobry:a pora:v ucho:s2 spływać:v2 miód rany:a wieczor bywać
3028,3028,autobusy zapłakane deszczem wożą ludzi siebie siebie błyszczącym mokrym asfalcie czarnym gwiaździstym niebie tygodnia leje mieście ścieka wilgoć sercu palcie autobusu spłakanego deszczem liczę gwiazdy mokrym asfalcie łezki łezka niebieska smutnym kolorze blue chłodny jedwab kolorze nieba zaśpiewam kolor blue autobusy zapłakane deszczem ogromne polarne foki przeszukują deszczu swe miejsce wydmuchując pary obłoki zmęczonych grzbietach dreszczem przelatują neonów błyski autobusy zapłakane deszczem sympatyczne pyski łezki łezka niebieska smutnym kolorze blue chłodny jedwab kolorze nieba zaśpiewam kolor blue x padać przestanie mieście swoim smutkiem pomieszczę autobusem zapłakanym deszczem pojadę pada wiecznie łezki łezka niebieska smutnym kolorze blue x,maryla_rodowicz-do_lezki_lezka,autobus zapłakany deszcz wozić człowiek siebie siebie błyszczący mokry asfalt:s1 czarny:a gwiaździsty niebo tydzień lać miesić ściekać wilgoć serce palić autobus spłakać deszcz liczyć gwiazda mokry asfalt:s1 łezka łezka niebieski smutny kolor blue chłodny jedwab kolor niebo zaśpiewać kolor blue autobus zapłakany deszcz ogromny polarny foki przeszukiwać deszcz swój miejsce wydmuchiwać par:s2 obłok zmęczony grzbiet dreszcz przelatować neon:s1 błysk autobus zapłakany deszcz sympatyczny pysk łezka łezka niebieski smutny kolor blue chłodny jedwab kolor niebo zaśpiewać kolor blue X padać:v1 przestać:v1 miesić swój smutek pomieścić autobus zapłakany deszcz pojechać padać:v1 wiecznie łezka łezka niebieski smutny kolor blue X
3029,3029,patrzę hen siebie tamte lata minęły myślę przegrałam diabli wzięli straciłam własnej woli przeciw wyliczę wyliczę powiem najbardziej żal kolorowych jarmarków blaszanych zegarków pierzastych kogucików baloników druciku motyli drewnianych koników bujanych cukrowej waty piernika chaty tyle spraw coraz bliżej jesień płowa przeszło żałować małym rzeczom zostajemy pamiętaniu wierni zamiast serca noszę chyba odpustowy piernik najbardziej żal kolorowych jarmarków blaszanych zegarków pierzastych kogucików baloników druciku motyli drewnianych koników bujanych cukrowej waty piernika chaty kolorowych jarmarków piernika chaty,maryla_rodowicz-kolorowe_jarmarki,patrzeć hen siebie tamten latać minąć myśleć przegrać diabli wziąć stracić własny woli przeciw wyliczyć wyliczyć powiedzieć bardzo żal:v kolorowy:a jarmark blaszany zegarek pierzasty kogucik balonik drucik motyli drewniany konik:s1 bujać cukrowy wat piernik:s1 chat tyli sprawa coraz blisko:d jesień płowy przeszło żałować mały:a rzecz zostawać pamiętać wierny:a zamiast:j serce nosza chybać odpustowy piernik:s1 bardzo żal:v kolorowy:a jarmark blaszany zegarek pierzasty kogucik balonik drucik motyli drewniany konik:s1 bujać cukrowy wat piernik:s1 chat kolorowy:a jarmark piernik:s1 chat
3030,3030,krucha miłość głupi żart zrobił los rozdzielił rzeką brzeg cytryny plaster martini choć dzień dzwoni listy pachną odległość kochać uczą odległość pragną sen odległość kochać uczą wypijmy kroplę łez dłoń dłoń oddychali myśleli światy odnalazły żyją szkłem los kilometry ściele rok spójrz szybko płynie czas odległość kochać uczą odległość pragną sen odległość kochać uczą wypijmy kroplę łez skrawki słów resztki serc rozbitkowie różnych wysp tylu tyle nieparzystych wie nikt odległość kochać uczą odległość pragną sen odległość kochać uczą wypijmy kroplę łez,maryla_rodowicz-na_odleglosc,kruchy miłość głupi:a żart zrobić los rozdzielić rzec:v1 brzeg cytryn plaster martini choć:c dzień:s1 dzwonić list pachnąć odległość kochać uczyć odległość pragnąć sen:s1 odległość kochać uczyć wypić kropla łza dłoń dłoń oddychać myśleć świat odnaleźć żyć szkło los kilometr słać:v2 rok:s1 spojrzeć szybko płynąć czas:v odległość kochać uczyć odległość pragnąć sen:s1 odległość kochać uczyć wypić kropla łza skrawek słowo resztka serce rozbitek różny wyspa tyle:n1 tyli nieparzysty wiedzieć nikt odległość kochać uczyć odległość pragnąć sen:s1 odległość kochać uczyć wypić kropla łza
3031,3031,gonią wilki owcami chłopaki babami dziewczyny zamęściem złodzieje szczęściem dobry bóg świat wystrugał drewieneczka najtwardszego udał udał pytajcie wiem gonią wilki owcami zrobił bóg ziemi grudę zimowe ptaki chude zrobił mrówki mrówczętami odrę nysę dopływami gonią wilki owcami dziewiątej godzinie siedzi bóg kominie patrzy wkoło myśli czego szczęście zrobię gonią wilki owcami zaczął bóg szczęście lepić lustereczka maluśkiego dostał sklepie wystarczy każdego gonią wilki owcami szczęście ukradnie świecie ładnie niaładnie spytaj lustereczka swego gonią wilki owcami chłopaki babami dziewczyny zamęściem złodzieje szczęściem gonią wilki owcami,maryla_rodowicz-gonia_wilki_za_owcami,goń wilki owca chłopak baba:s1 dziewczyna zamęście złodziej szczęście dobry:a bóg świat wystrugać drewieneczka twardy udać udać pytać wiedzieć goń wilki owca zrobić bóg ziemia gruda zimowy ptak chudy:a zrobić mrówki mrówczę odrzeć nysa dopływ goń wilki owca dziewiąty:a godzina siedzieć bóg komin patrzyć wkoło:d myślić czego szczęście zrobić goń wilki owca zacząć bóg szczęście lepić lustereczko maluśki dostać:v1 sklepać wystarczyć każdy goń wilki owca szczęście ukraść świat ładnie niaładnie spytać lustereczko swój goń wilki owca chłopak baba:s1 dziewczyna zamęście złodziej szczęście goń wilki owca
