,id,text,author_title,stemmed_text
3008,3008,mówisz zachwycony byłeś rzadko błądziłeś dawniej ostatni update żart ponury najgorszy model klasie trzyma trzy godziny non stop traci zasięg mówisz zmiany wielkie myślisz trochę pudełkiem narzędzia bierzesz dedykowane trafiasz target sytuacji jesteś mega fanem mówisz struła rozterka tatuaż wciąż wyraża stu procentach ramion plecy takiego zdania zlecić ciut zdrowiu podupadnie stanie naprzeciw mówisz rzuciłeś szlugi lepszy chuch masz parę stów miesiąc mniej gubisz ba chuj hajsem przejarany okres zdrowie ważne zdrowie ultraistotne przestać wyjechałeś wyszło pić trupa spoko imigranci – ohyda głośno mówią widać mówisz byłeś wierzą otworzył oczy serial zwłaszcza trzeci sezon widzisz ochłapem mamią ludność swoją łapę brudną słucham milczę przestępuję nogi nogę powiem powiem choćbyś zrobił przerwę jakąkolwiek odpowiedź powiem powiem wziąć chytrze podejść sensu powiem powiem chciałbyś wiedzieć rozumiem choćby połowie powiem powiem mógłbym wspomnieć wczoraj słońce świeciło nieprzytomnie mocno niepokoi księżyc blady patrzy wschód smutno zupełnie miało jutra jutro mógłbym dodać zamiast boga swoich dowieść dziecko pielęgnuje zresztą pełen obaw przeszłość dziecka radziecka przyszłość chwiejna mama anarchia papa stakan portwiejna mówię rzuciłem przekory wraz ostatnim szlugiem zgasł koloryt siedzę niepalarni ćwiczę pozę wzrokiem wodzę wychodzi wychodzę mówię chwilę zajmie ślęczę esemesem limeryk najmniej ba nikt podziękuje trudy walczę słownikiem chuju zamienia chudy trakty śledzę szukam druhów niedoli chorych brak uprzedzeń rzadko kogoś uda wyłowić wśród obcych łatwiej swoi zdrowi mówię rzeczowością wyrównują zagon ochoczo betonują powagą trzeźwym okiem mierzą prozą sypią szczęście sporo rośnie dziko słuchasz milczysz przestępujesz nogi nogę powiesz powiesz choćbym zrobił przerwę jakąkolwiek odpowiedź powiesz powiesz wziąć chytrze podejść sensu powiesz powiesz chciałbym wiedzieć rozumiesz choćby połowie powiesz powiesz,lona_i_webber-nie_pogadasz,mówić zachwycić być rzadko błądzić dawno ostatni:a update żart ponury zły:a model:s1 klasa trzymać trzy godzina nona stop:s tracić zasięg mówić zmiana wielki:a myślić trochę:d pudełko narzędzie brać:v dedykować trafiać target sytuacja być mega fan mówić struć rozterka tatuaż wciąż wyrażać sto procent ramię plecy taki:a zdanie zlecić ciut zdrowie podupaść stanąć naprzeciw:d mówić rzucić szlug dobry:a chuch mieć para stówa miesiąc mało:d gubić Księga_Barucha chuj:s1 hajs przejarany okres zdrowie ważny zdrowie ultraistotny przestać:v1 wyjechać wyjść picie trupa spoko:a imigrant – ohyda głośno mówić widać:v mówić być wierzyć otworzyć oczyć serial zwłaszcza trzeci:a sezon widzieć ochłap mamić ludność swój łapa brudny słuchać milczeć przestępować noga noga powiedzieć powiedzieć choćby:c zrobić przerwać jakikolwiek odpowiedź powiedzieć powiedzieć wziąć chytrze podejście sens powiedzieć powiedzieć chcieć wiedzieć rozumieć choćby:q połowa powiedzieć powiedzieć móc wspomnieć wczoraj:d słońce świecić nieprzytomnie:d1 mocno niepokoić księżyc blady patrzyć wschód smutno zupełnie mieć jutro:s jutro:d móc dodać zamiast:j bóg swój dowieść dziecko pielęgnować zresztą pełny obawa przeszłość dziecko radziecki przyszłość chwiejny mama anarchia papać stakan portwiejna mówić rzucić przekora:s1 wraz:s ostatni:a szlug zgasnąć koloryt siedzieć niepalarnia ćwiczyć poza:s wzrok wodza wychodzić:v2 wychodzić:v2 mówić chwila zająć ślęczeć esemes limeryk najmniej:n Księga_Barucha nikt podziękować trud walczyć słownik chuj:s1 zamieniać chudy:a trakt śledzić szukać druh niedola chory:a brak:v uprzedzenie rzadko kto udać wyłowić wśród obcy:a łatwie swój zdrowy mówić rzeczowość wyrównywać zagon ochoczo betonować powaga trzeźwy oko:s1 mierzyć proza sypać szczęście sporo:d rosnąć dziko słuchać milczeć przestępować noga noga powiedzieć powiedzieć choćby:c zrobić przerwać jakikolwiek odpowiedź powiedzieć powiedzieć wziąć chytrze podejście sens powiedzieć powiedzieć chcieć wiedzieć rozumieć choćby:q połowa powiedzieć powiedzieć
3009,3009,spytaj pensje powiemy chętnie trzech czterech trzystu wręcz fiskus tyle zabiera ledwo wystarcza wystrój wnętrz zapytaj kredyt mamy pasmo przeżyć wartkich zapytaj kosztuje śledzić rośnie siłę frank szwajcarski spytaj mieszka spytaj koszty ciepła oświetla okna słońce rano spytaj metraż spytaj pracę perspektywy dawa zapytaj czasu dostać awans spytaj ostatni melanż szerzej weekend relaks zwykle mocno pite spytaj muzykę zjawisk obcych zapytaj nowy trend chętnie powiemy znacznie nowszym spytaj znajomych zgubi tysiące czworo każde lubi wierz dowiedz napięciem cenie zapytaj niemal takim zastrzeżeniem pytaj pytaj idziemy pytaj pytaj idziemy pytaj pytaj idziemy pytaj pytaj idziemy pytaj przeszłość jakbyś wiedział pytaj przyszłość jutro czymś niknie dali pytaj świat ludzi sedno wiem deficyt pytaj bezpośrednio dotyczy pytaj miłość mamy przećwiczone pokolenie zgubiło melanżu razem telefonem pytaj pustkę pytaj strach ukryty widzisz pytań psychoanalityk pytaj słowa wiesz niedopatrzenie znamy wprawdzie cztery języki obraz ruch rytm brzmienie pytaj ciszę sprzyja cisza nijak niedługo pojmiesz natury lubimy drzeć ryja pytaj życie sens żadną dziedzin pytaj siedzi raczej pokolenie odpowiedzi zadawaj pytań problem czyha wie wzniecisz musisz zapytaj słychać aaa leci pytaj pytaj idziemy pytaj pytaj idziemy pytaj pytaj idziemy pytaj pytaj idziemy,lona_i_webber-nie_pytaj_nas,spytać pensja powiedzieć chętnie trzy cztery trzysta wręcz:d fiskus tyli zabierać ledwo:d wystarczać wystrój:s1 wnętrze zapytać kredyt mama pasmo przeżycie wartki zapytać kosztować:v1 śledzić rosnąć siła:s frank szwajcarski spytać mieszkać spytać koszt ciepły oświetlać okno słońce rano:d spytać metraż spytać praca perspektywa dawa zapytać czas:s dostać:v1 awans spytać ostatni:a melanż szeroko weekend relaks zwykle mocno pić spytać muzyka zjawisko obcy:a zapytać nowy:a trend chętnie powiedzieć znacznie:d nowy:a spytać znajomy:a zgubić tysiąc:s1 cztery każdy luby:a wierzyć dowiedzieć napięcie cena zapytać niemal taki:a zastrzeżenie pytać pytać iść pytać pytać iść pytać pytać iść pytać pytać iść pytać przeszłość jakby:c wiedzieć pytać przyszłość jutro:d co:s niknąć dać pytać świat człowiek sedno wiedzieć deficyt pytać bezpośrednio dotyczyć pytać miłość mama przećwiczyć pokolenie zgubić melanż razem telefon pytać pustka pytać strach:v ukryć widzieć pytanie psychoanalityk pytać słowo wiedzieć dopatrzeć znać:v wprawdzie cztery język obraz ruch rytm brzmienie pytać ciszyć sprzyjać cisza nijak niedługo pojąć natura lubić drzeć ryj pytać życie sens żaden dziedzina pytać siedzieć raczy pokolenie odpowiedź zadawać pytanie problem czyhać wiedzieć wzniecić musieć zapytać słychać:v aaa lecieć pytać pytać iść pytać pytać iść pytać pytać iść pytać pytać iść
3010,3010,x zwykły dzień jakich tysiąc chytry cel słysząc wyje budzik trochę świt ostudzić ogóle wyciąć uparty bydlak tygodniu chyba raz czwarty wygra trudem wstaję choć jutrzenki blask nieco wyblakł wychodzę domu spostrzec postęp ogólnonarodowym ruchu torów rozpęd biorą jebnąć piorun oślep codziennie włączam stoper czym liczę minut minie obcy spojrzy oczy przemknie choćby półgębkiem uśmiech wstępnie trzymał wygrał podstępnie wykrzywiony grymas czekam dzień uczyni poczuję łączy brnięcie przód jednej linii gest rzec pusty gest słuszny test pustych gestów możesz więź jakąś kreślić idę obcy wśród swoich tłum obcość prawdopodobnie genach szukam symboli chociażby pustych gestów x patrzę dawna pitbull wilczur diabła siebie wśród nieprzyjaznych tubylców prawda ogół suniemy tymi przecinają drogę tłumie domach swój staję obcy czym byle umie przekonać mówi możesz stawiać interes spokojnie milczy gardzi bezspornie patrzy deklaruje wojnę codziennie staram scalać skrzętnik całością wdzięk najlepszym razie patrzy obojętnie oczy ogół wilcze konflikt wisi powietrzu żyłce musimy gadać moglibyśmy sympatyczniej milczeć musimy oczekiwać cudu materii raczej bym entuzjazm studził musimy mówić dostrzec ludziach choćby odrobinę ludzi czekam bezwiednie znak chociaż nadzieja blednie stoper poprzedniej zwrotce odpaliłem ciągnie biegnie wyłączyć celu pustym wzrokiem brnie czas wystarczyłby odruch jakikolwiek ludzki odruch x,lona_i_webber-nie_ma_nas,X zwykły:a1 dzień:s1 jaki tysiąc:s1 chytry cel słyszeć wyjeść budzik trochę:d świt ostudzić ogół wyciąć uparty bydlak:s1 tydzień chybać raz:s1 czwarty:a wygrać trud wstawać choć:c jutrzenka blask nieco:d wyblaknąć wychodzić:v2 dom spostrzec postęp ogólnonarodowy ruch tor rozpęd brać:v jebnąć piorun oślep codziennie włączać stoper:s1 czy:q liczyć minuta minąć obcy:a spojrzeć oczyć przemknąć choćby:q półgębkiem uśmiech wstępnie trzymać wygrać podstępnie wykrzywić grymas czekać dzień:s1 uczynić poczuć łączyć brnąć przód jeden:a linia gest rzec:v2 pusty gest słuszny test pusty gest móc więź jakiś kreślić iść obcy:a wśród swój tłum obcość:s prawdopodobnie:d gen szukać symbol chociażby:q pusty gest X patrzeć dawny pitbull wilczur diabeł siebie wśród nieprzyjazny:a1 tubylec prawda:s ogół sunąć:v2 ten przecinać droga tłum dom swój staja obcy:a czy:q byle:q um przekonać mówić móc stawiać interes spokojnie milczeć gardzić bezspornie patrzyć deklarować wojna codziennie starać scalać skrzętnik całość wdzięk dobry:a raz:s1 patrzyć obojętnie oczyć ogół wilczy konflikt wisieć powietrze żyłka musieć gadać móc sympatycznie milczeć musieć oczekiwać cud materia raczy by:q entuzjazm studzić musieć mówić dostrzec człowiek choćby:q odrobina człowiek czekać bezwiednie znak chociaż:c nadzieja blednąć stoper:s1 poprzedni zwrotka odpalić ciągnąć:v1 biec wyłączyć cel pusty wzrok brnąć czas:v wystarczyć odruch jakikolwiek ludzki odruch X
3011,3011,łona przyjedź mamy realia średnio twarde mamy cel rzadziej target mamy mglisty widok floating garden mamy długie noce mamy stoczni kwestii ocen mamy skalę dziesięć stopni szkoda życia średnie zgrzeszę zamiast wyjaśnię poznaj fakty należy łatwych dokonań bywa choć dziesięć trochę hasło zobacz patrzę tył żalu przód obaw bit zresztą mniej mógł choć webber zrobił przymierzając dziesięć dni temu mów melanż przemawia mizerne straty rymek pamięta wrócił chaty r hejka koncert przemian jednej strony sens drugiej strony cień zrozumienia idzie planów rozkmin film tv czytał janusz szydłowski rękaw zimą masz letnie wąsko zakręt zetniesz zwalniając dziesięć setkę masz powody istotne walczyć choćby miejsce top parę spadków wzniesień pytasz myślisz sr odejmij jedenastu dodaj dziewięciu pięć pomnóż dwadzieścia podziel x rymek dziesięciu zaczynam odliczanie mandaryn niegdyś ciu kończę chciałbyś przegryźć tę materię zrozumieć istotę wszechrzeczy masz zbyt słabe baterie nadążyć weź przeczyść spirytusem laser tymczasem nagrywamy song brzydki twarz siostry basen system dziesiętny praktyce podobnie chcę wchodzę takty złe tkwię wysokości szyi dobry bóg ciągnie pióra diabeł giry rozterkę poturlać ciśnienie wgniata czoło jajko kolumba trudno ejkej ejema ekstrema nagle określeń sprawdź temat jakże radzić tyle rzeczy chce sr odejmij jedenastu dodaj dziewięciu pięć pomnóż dwadzieścia podziel x otrzymasz otrzymasz będziesz miał kochaj dbaj celebruj pamiętaj swoim pamiętaj urodzinach swojego,lona_i_webber-10,łono przyjechać mama realia średnio twardy mama cel rzadko target mama mglisty widok floating Gardna mama długi noc mama stocznia kwestia ocena mama skala dziesięć stopień szkoda:d życie średni zgrzeszyć zamiast:j wyjaśnić poznać fakt należeć:v2 łatwy dokonanie bywać choć:c dziesięć trochę:d hasło zobaczyć patrzeć tyć żal:s przód obawa bit zresztą mało:d móc choć:c webber zrobić przymierzać dziesięć dzień:s1 ten mowa melanż przemawiać mizerny strata Rymek:s1 pamiętać wrócić:v1 chat r hejka koncert przemiana jeden:a strona sens drugi:a strona cień zrozumienie id plan rozkmina film tv czytać Janusz:s2 szydłowski rękaw zima mieć letni wąsko zakręt ściąć zwalniać dziesięć setka mieć powód:s1 istotny walczyć choćby:q miejsce top para spadek wzniesienie pytać myślić sr odjąć jedenaście dodać dziewięć pięć pomnożyć:v1 dwadzieścia podzielić X Rymek:s1 dziesięć zaczynać odliczać mandaryn niegdyś ciu kończyć chcieć przegryźć ten materia zrozumieć istota wszechrzecz mieć zbyt:s słaby bateria nadążyć wziąć przeczyścić spirytus laser tymczasem:d nagrywać song brzydki twarz siostra basen system dziesiętny praktyka podobnie chcieć wchodzić takt zły:a tkwieć wysokość szyja dobry:a bóg ciągnąć:v1 pióro diabeł gira rozterka poturlać ciśnienie wgniatać czoło:s1 jajko Kolumb trudno ejkej ejema ekstrema nagle określenie sprawdzić temat jakże radzić tyli rzecz chcieć sr odjąć jedenaście dodać dziewięć pięć pomnożyć:v1 dwadzieścia podzielić X otrzymać otrzymać być mieć kochać dbać celebrować pamiętać swój pamiętać urodziny swój
3012,3012,byłoby błędem odnaleźć banger refren wokalem wydobędę sens nieco dalej póki bit wali bębnem mówiąc oględnie wcale niestety trafił pech dotąd wiem wygląda refren wada szat rozdzierać wypada wielką bramą huczy refren raczej łopot słaby abym bał nielicho zbladł jakieś bramy zaraz zrobi psychorap zresztą zastanawia brama akurat czemuż stronę odwrotną chodu rozwiązanie zrobić krok przodu wielką bramą lepiej znacznie choć wciąż wiem pięć zmieniam lokalizację oddali zacznie dziać choćby kęs draki ciągle wątpliwość sens cel ruchu naprzód bramie wplątałem jakąś opcję włamaniem żalem odkryję następnym miejscem bramie areszt ziomuś powiedz dzieje dalej czas stanął świetnie najważniejszej chwili koleżka odpłynął kompletnie przypadła rola marna palnie muszę dociekać miał myśli zgrozo przerósł filozof trzeciego numeru czas stanął faustem układ zaraz jakąś nową prawdę wysupła złudzenia kłamią otworzył oczy anioł mrożek cyrk banger wywrócić scenę skoro mogę dogadać własnym refrenem ej absurd spisek najpewniej bym tylu latach skończył komentując brednie powiedz resztkę sensu pogrzeb zostało,lona_i_webber-nie_zostalo_nic,być błąd odnaleźć banger refren wokal wydobyć sens nieco:d daleko póki bit wały:a bęben:s1 mówić oględnie wcale niestety trafić pech dotąd wiedzieć wyglądać:v1 refren wada szata rozdzierać wypadać:v1 wielki:a brama huczeć refren raczy łopot słaby aby:c bać nielicho zbladnąć jakiś bram zaraz:d zrobić psychorap:s1 zresztą zastanawiać brama akurat:d cóż strona odwrotny chód rozwiązanie zrobić krok przód wielki:a brama dobrze znacznie:d choć:c wciąż wiedzieć pięć zmieniać lokalizacja oddać zacząć dziać choćby:q kęs draka ciągle wątpliwość sens cel ruch naprzód bram wplątać jakiś opcja włamanie żal:s odkryć następny:a miejsce bram areszt ziomuś powiedzieć dziać daleko czas:v stanąć świetnie ważny chwila koleżka odpłynąć kompletnie przypadły rola marny palnąć musza dociekać mieć myślić zgroza przerosnąć:v1 filozof trzeci:a numer czas:v stanąć Faust:s2 układ zaraz:d jakiś nowy:a prawda:s wysupłać złudzenie kłamać otworzyć oczyć anioł Mrożek:s1 cyrk banger wywrócić scena skoro:d móc dogadać własny refren ej absurd spisek najpewniej by:q tyle:n1 lato skończyć komentować brednia powiedzieć resztka sens pogrzeb zostać
3013,3013,zwrotka dzwoni zamyka listę niebawem chce wyszło pyta sprawę mówię daty cisną dam radę ostatnio blisko walka niemały ubył pot kartka długopis gruby lot trudów splot spleść całość wleźć salon kolejne cześć udało piękny nierezlutat niepoczętych wersów niepodjętych współprac mea culpa wije kłamstwa niedobra nić zwrotki gruncie rzeczy mogła wielkiego wyczekujmy czynu pointy wersów podwójnych rymów niczego żadnego słowem nienapisana zwrotka rodzeństwo cholera refren zapowiada trochę przepraw nienapisanych zwrotek setka nienapisanych zwrotek tysiąc patrzy tą protest ciszą trochę cofa powrotem napiera nienapisanych zwrotek ocean nienapisanych zwrotek nieskończoność rośnie coraz głośniej wołam pomoc zwrotka niemały wyrzut sumienie rani ostatnia nieźle szła głowie dźwięczał wers wersami miałem kartki podźwięczał zamilkł policzyć trudno brak dobrej miary spora kolekcja spraw niepowstałych najładniej nienapisane pociech suszę przebijam szpilką wieszam gablocie mijam patrzę pokorą sporą ulgą sens wbrew pozorom ślicznotki kuszące zarysach straszliwie więdną napisać zamyśle zgrabna niekiedy dam nabrać napiszę pryska magia szkaradna nieprzejednanie zajadła nudna zarazem naprawdę nadmiar sprytne chcą podejść przebieram robię mogę wysyłam większość przymusowy postój ech mieć choćby paru naśladowców refren zapowiada trochę przepraw nienapisanych zwrotek setka nienapisanych zwrotek tysiąc patrzy tą protest ciszą trochę cofa powrotem napiera nienapisanych zwrotek ocean nienapisanych zwrotek nieskończoność rośnie coraz głośniej wołam pomoc,lona_i_webber-znowu_nic,zwrotka dzwonić zamykać lista niebawem chcieć wyjść pytać sprawa mówić data cisnąć:v1 dać rada ostatnio:d blisko:d walka niemały ubyć pot kartka długopis gruby:a lot:s1 trud splot spleść całość wleźć salon kolejny cześć:s udać piękny nierezlutat począć wers podjąć współpraca mea culpa wić:v kłamstwo niedobry nić zwrotka grunt rzecz móc wielki:a wyczekiwać:v1 czyn pointa wers podwójny rym:s nic żaden słowo napisać zwrotka rodzeństwo:s1 cholera:s refren zapowiadać trochę:d przeprawa napisać zwrotka setka napisać zwrotka tysiąc:s1 patrzyć ten protest ciszyć trochę:d cofać powrót napierać napisać zwrotka ocean napisać zwrotka nieskończoność rosnąć coraz głośnie wołać pomoc zwrotka niemały wyrzut sumienie rany:a ostatni:a nieźle:d1 iść głowa dźwięczeć wers wers mieć kartka podźwięczał zamilknąć policzyć trudno brak:v dobry:a miara spory kolekcja sprawa niepowstały ładnie napisać pociecha susza przebijać szpilka wieszać gablota mijać patrzeć pokora spory ulga sens wbrew:d pozora ślicznotka kuszący zarys straszliwie więdnąć napisać zamysł zgrabny niekiedy dać nabrać napisać pryskać magia szkaradny przejednać zajadły nudny zarazem naprawdę:i nadmiar sprytny chcieć podejście przebierać robić móc wysyłać większość przymusowy postój echo mieć choćby:q par:s2 naśladowca refren zapowiadać trochę:d przeprawa napisać zwrotka setka napisać zwrotka tysiąc:s1 patrzyć ten protest ciszyć trochę:d cofać powrót napierać napisać zwrotka ocean napisać zwrotka nieskończoność rosnąć coraz głośnie wołać pomoc
3014,3014,powiedz tryb wszedł bezsensowna gonitwa idiotyczny bieg łapiesz tyły siły dzień skończy miły bóg wiesz nieprędko głównie stąd wzrasta tempo maleje utrudnień front nikniesz chwili chwilę najmniejszych szans matni wyleźć ha zresztą kabaret parę opole sopot typ scenie peruce widownia ryczy pełnym płucem ryczysz myślisz którędy uciec stąd zrobić wyjazd rzeczywistość mocno sprzyja zbiec uchodzi czmychnąć tragedia uciec niehonorowo szansa chwil poświęcić byś parę mógł pora fśśt małe choć teoretyczną dajesz szansę pit stop czas fśśt stąd wyłącz jazgot idź parku zobacz gawron uwił gniazdo okropne ptaszysko różnica idź parku masz blisko pójdź trawę pośpiechu podeptać świat przetrwa patrz niebo uproszczeń zbyt łatwych ba trafisz intergalaktyzm zrzuć ciężar chwilę bani idź kina film byłeś weź telefon zadzwoń kogoś wyraźnego powodu obudź odpuść pracę weź psa spacer masz psa pożycz kogoś wiem schody istotnie strome niewiele ot małe fśśt moment chwil poświęcić byś parę mógł pora fśśt małe choć teoretyczną dajesz szansę pit stop czas fśśt stąd,lona_i_webber-fsst,powiedzieć tryb wejść bezsensowny gonitwa idiotyczny bieg łapać tyć siła:s dzień:s1 skończyć miły:a bóg wiedzieć nieprędko głównie:d stąd wzrastać tempo maleć utrudnienie front niknąć chwila chwila mały:a szansa matnia wyleźć ha:s zresztą kabaret para opole Sopot:s1 typ:s1 scena peruka widownia ryczeć pełny płuco ryczeć myślić którędy uciec stąd zrobić wyjazd rzeczywistość mocno sprzyjać zbiec uchodzić:v1 czmychnąć tragedia uciec niehonorowo szansa chwila poświęcić by:q para móc pora:v fśśt mały:a choć:c teoretyczny dawać szansa pita stop:s czas:v fśśt stąd wyłączyć jazgot iść park zobaczyć gawron uwić gniazdo okropny ptaszysko różnica iść park mieć blisko:d pójść trawa pośpiech podeptać świat przetrwać patrzeć niebo uproszczenie zbyt:s łatwy Księga_Barucha trafić intergalaktyzm zrzucić ciężar chwila bania iść kino film być wziąć telefon zadzwonić kto wyraźny powód:s1 obudzić odpuścić praca wziąć pies:s1 spacer mieć pies:s1 pożycz kto wiedzieć schody istotnie:d stromy niewiele:d ot mały:a fśśt moment chwila poświęcić by:q para móc pora:v fśśt mały:a choć:c teoretyczny dawać szansa pita stop:s czas:v fśśt stąd
3015,3015,wczoraj następstw szukało długo budzi jedenastej grubo niewiele zmienia pora raz setny samo wczoraj miał dzień najwcześniejszych godzin zmrok dni problem chodzi wzrok machnąłbym ręką wadę nieistotną zniósłbym astygmatyzm przeżyłbym krótkowzroczność łapią ostrość dal patrzą bogatą wiedzę kolorach bogatszą słabnie wzrok choć patrzą non stop dni widzą nieźle problem wąsko niewielka wada sprawia dni widzą patrzą akurat gryzą mały horyzont dobrą skalą szans objąć całość dnia dzień wzrok przywykł uczę dni zmiany perspektywy wciąż wąsko widzą tylu przynęt trudno zwiększyć horyzont choćby centymetr dnia dzień wzrok przywykł uczę dni zmiany perspektywy każdemu pilnie oka strzeże mówię patrz trochę szerzej patrz trochę szerzej wcześniej dni często gotowe biorę męską rozmowę mówię wiem masz wadę chuj wadą przestań wypatrywać jutra spójrz prawo spójrz lewo pójść bok puls wyczuć dotychczas pół zjawą e ej bądź chłopcem schowaj tę pogardę wiem kryjesz strach obce prosty chwyt próbuj dni uwikłanych codzienność tolerujesz brawo gardź tolerancją idź dalej znajdź ciekawość ciemnym wczoraj kac przypadł przestań wiedzieć zacznij pytać ambicji dostrzeżesz patrz trochę szerzej patrz trochę szerzej dnia dzień wzrok przywykł uczę dni zmiany perspektywy wciąż wąsko widzą tylu przynęt trudno zwiększyć horyzont choćby centymetr dnia dzień wzrok przywykł uczę dni zmiany perspektywy każdemu pilnie oka strzeże mówię patrz trochę szerzej patrz trochę szerzej,lona_i_webber-patrz_szerzej,wczoraj:d następstwo szukać długo budzić jedenasty:a grubo niewiele:d zmieniać pora:v raz:s1 setny sam:a wczoraj:d mieć dzień:s1 wczesny godzina zmrok dzień:s1 problem chodzić wzrok machnąć ręka wada nieistotny znieść astygmatyzm przeżyć krótkowzroczność łapać ostrość dal patrzeć bogaty:a wiedza kolor bogaty:a słabnąć wzrok choć:c patrzeć nona stop:s dzień:s1 widzieć nieźle:d1 problem wąsko niewielki wada sprawiać dzień:s1 widzieć patrzeć akurat:d gryźć mały:a horyzont dobry:a skalić szansa objąć całość dzień:s1 dzień:s1 wzrok przywyknąć uczyć dzień:s1 zmiana perspektywa wciąż wąsko widzieć tyle:n1 przynęta trudno zwiększyć horyzont choćby:q centymetr dzień:s1 dzień:s1 wzrok przywyknąć uczyć dzień:s1 zmiana perspektywa każdy pilnie oko:s1 strzec mówić patrzeć trochę:d szeroko patrzeć trochę:d szeroko wcześnie dzień:s1 często gotowy brać:v męski rozmowa mówić wiedzieć mieć wada chuj:s1 wada przestać:v1 wypatrywać jutro:s spojrzeć prawo:d1 spojrzeć lewo:d pójście bok puls wyczucie dotychczas póła zjawa e ej bądź:j chłopiec schować ten pogarda wiedzieć kryć strach:v obcy:a prosty:a chwyt próbować dzień:s1 uwikłać codzienność tolerować brawo:s gardzić tolerancja iść daleko znajść ciekawość ciemny wczoraj:d kac przypaść:v1 przestać:v1 wiedzieć zacząć pytać ambicja dostrzec patrzeć trochę:d szeroko patrzeć trochę:d szeroko dzień:s1 dzień:s1 wzrok przywyknąć uczyć dzień:s1 zmiana perspektywa wciąż wąsko widzieć tyle:n1 przynęta trudno zwiększyć horyzont choćby:q centymetr dzień:s1 dzień:s1 wzrok przywyknąć uczyć dzień:s1 zmiana perspektywa każdy pilnie oko:s1 strzec mówić patrzeć trochę:d szeroko patrzeć trochę:d szeroko
