,id,text,author_title,stemmed_text
3135,3135,tramwajowi ludzie zmęczeni ludzie liliowych lotnisk tramwajowi ludzie podobni cieni samotni końcowych przystankach kawa szary smak noce zimne łzy gorące noce zimne łzy gorące tramwajowi ludzie wytrwali klony stłoczeni wędrują nieba tramwajowi ludzie mężowie żony brak słońca chleba końcowych przystankach kawa szary smak noce zimne łzy gorące noce zimne łzy gorące pętle piękniejsze szumi daleka rzeka zajeżdża tramwaj nadziei niewinnych tramwaj czeka końcowych przystankach kawa szary smak noce zimne łzy gorące noce zimne łzy gorące,maryla_rodowicz-tramwajowi_ludzie,tramwajowy lud:s1 zmęczony lud:s1 liliowy:a1 lotnisko tramwajowy lud:s1 podobny cienić samotny końcowy przystanek kawa szary smak noc zimny łza gorący noc zimny łza gorący tramwajowy lud:s1 wytrwały klon:s1 stłoczyć wędrować niebo tramwajowy lud:s1 mąż:s żona brak:v słońce chleb końcowy przystanek kawa szary smak noc zimny łza gorący noc zimny łza gorący pętla piękny szumieć:v1 daleki rzeka zajeżdżać:v1 tramwaj nadzieja niewinny:a1 tramwaj czekać końcowy przystanek kawa szary smak noc zimny łza gorący noc zimny łza gorący
3136,3136,żal żal dziewczyną zieloną ukrainą żal żal serce płacze zobaczę hej hej hej sokoły omijajcie góry lasy doły dzwoń dzwoń dzwoń dzwoneczku stepowy skowroneczku hej hej hej sokoły omijajcie góry lasy doły dzwoń dzwoń dzwoń dzwoneczku stepowy dzwoń dzwoń dzwoń została jaskółeczka mała obcej stronie dniem nocą tęsknie hej hej hej sokoły wina wina wina wina dajcie umrę pochowajcie zielonej ukrainie kochanej dziewczynie hej hej hej sokoły,maryla_rodowicz-hej_sokoly,żal:v żal:v dziewczyna zielony:a ukraina żal:v żal:v serce płakać zobaczyć hej hej hej sokół:s1 omijać góry las doły dzwonić dzwonić dzwonić dzwoneczek stepowy skowroneczek hej hej hej sokół:s1 omijać góry las doły dzwonić dzwonić dzwonić dzwoneczek stepowy dzwonić dzwonić dzwonić zostać jaskółeczka mały:a obcy:a strona dzień:s1 noc tęsknie hej hej hej sokół:s1 wina wina wina wina dać umrzeć pochować zielony:a ukraina kochany:a dziewczyni hej hej hej sokół:s1
3137,3137,widziałam piękną twarz wymyśloną kochania twarz chmurą smutku ozdobioną szaro sza warto błyszczeć skoro sercu ciemno dnia gaśnie koral chorej szaro sza ledwie lampy cień sława zmienia zmienia kochanie sława ledwie lampy cień sława zmienia zmienia kochanie sława śniłam złoty tron potem cudnej szacie przybył król niepokój pokoje wpadł warto królem korona ciąży szczęścia brak czarnych strachów pełne sienie ledwie lampy cień sława zmienia zmienia kochanie sława sława ledwie lampy cień sława zmienia zmienia kochanie sława długi długi sen jawa zmienia zmienia kochanie jawa jawa długi długi sen jawa zmienia zmienia kochanie jawa jawa długi długi sen jawa zmienia zmienia kochanie jawa,maryla_rodowicz-gasnie_koral,widzieć piękny twarz wymyślić kochanie twarz chmura smutek ozdobić szaro sza warto błyszczeć skoro:d serce ciemno:d dzień:s1 gasnąć koral:s1 chory:a szaro sza ledwie:d lampa cień sława zmieniać zmieniać kochanie sława ledwie:d lampa cień sława zmieniać zmieniać kochanie sława śnić złoty:a tron potem cudny szata przybyć król:s1 niepokój pokój wpaść:v1 warto król:s1 korona ciąża szczęście brak:v czarny:a strach:s1 pełny sień ledwie:d lampa cień sława zmieniać zmieniać kochanie sława sława ledwie:d lampa cień sława zmieniać zmieniać kochanie sława długi długi sen:s1 jawa zmieniać zmieniać kochanie jawa jawa długi długi sen:s1 jawa zmieniać zmieniać kochanie jawa jawa długi długi sen:s1 jawa zmieniać zmieniać kochanie jawa
3138,3138,sen stąd zowąd otoczy pomiesza myśli zmyli czas chociażby komin chciałoby odlecieć stronę gwiazd ręką żurawi kaczek sznur nogi kuli ziemskiej brak rzęsach krople zgarnięte chmur ustach wiatru smak skaczmy więcz krawędzi dnia pofruwać startował lotniska swego snu czuł kuzynem gwiazd palonym wiatrem dłoń chciał lotu ptaka raz popatrzeć swój dom świat kręci kółko wielki bąk pół siebie ptaka pół serca ciężary troski rąk balast zrzucam dół patrzę rzeki plamy drzew ludzi jacy mali wodzą oczami lądem mew fruwać chcą skaczmy krawędzi dnia pofruwać któż startował czuł kuzynem gwiazd palonym wiatrem dłoń chciał lotu ptaka raz,maryla_rodowicz-z_lotu_ptaka,sen:s1 stąd zowąd otoczyć pomieszać myślić zmylić czas:v chociażby:q komin chcieć odlecieć strona gwiazda ręka żurawi kaczka sznur noga kuć ziemski brak:v rzęsa krople zgarnąć chmura usta wiatr smak skakać więcz krawędź dzień:s1 pofruwać startować lotnisko swój sen:s1 czuć:v kuzyn gwiazda palić wiatr dłoń chcieć lot:s1 ptak raz:s1 popatrzeć swój dom świat kręty kółko wielki:a bąk póła siebie ptak póła serce ciężar troska ręka balast zrzucać dół:s1 patrzeć rzeka plama drzewo człowiek jaki mały:a wodzić oko:s2 ląd mewa fruwać chcieć skakać krawędź dzień:s1 pofruwać któż startować czuć:v kuzyn gwiazda palić wiatr dłoń chcieć lot:s1 ptak raz:s1
3139,3139,siedzę mławie czarnej kawie bawię jakże siedzę łomży deszcz omżył smutku pogrążył wszakże dziura robi niebie łza wpada kawy zabierz zabierz siebie zabierz mławy sercu robi pusto deszcz uśpić zdążył zabierz zabierz jutro zabierz łomży siedzę ełku małym szkiełku niedużym piekiełku jakże siedzę grójcu wśród siedmiu zbójców mówię wójciu jakże dziura robi niebie dno widać mym szkiełku zabierz zabierz siebie zabierz ełku dziura robi niebie sennie wlecze czas weź weź siebie zabierz grójca siedzę pizie lekkiej bryzie sumienie gryzie jakże siedzę rio piją tańczą żyją wszakże dziura robi niebie żal duszy rozżalił weź weź siebie gorzkiej italii dziura robi niebie dzwony sercu mym biją weź weź siebie zabierz rio siedzę mławie czarnej kawie bawię jakże siedzę mławie czarnej kawie bawię jakże siedzę mławie czarnej kawie bawię jakże,maryla_rodowicz-mlawa,siedzieć Mława czarny:a kawa bawić jakże siedzieć Łomża:s1 deszcz omżył smutek pogrążyć wszakże:j dziura robić niebo łza wpadać kawa zabrać zabrać siebie zabrać Mława serce robić pusto deszcz uśpić zdążyć zabrać zabrać jutro:d zabrać Łomża:s1 siedzieć Ełk mały:a szkiełko nieduży piekiełko jakże siedzieć Grójec wśród siedem zbójca mówić wójciu jakże dziura robić niebo dno widać:v mój:a szkiełko zabrać zabrać siebie zabrać Ełk dziura robić niebo sennie wlec czas:v wziąć wziąć siebie zabrać Grójec siedzieć Piza lekki bryza sumienie gryźć jakże siedzieć Rio pić tańczyć żyć wszakże:j dziura robić niebo żal:v dusza rozżalić wziąć wziąć siebie gorzki Italia dziura robić niebo dzwony serce mój:a bić wziąć wziąć siebie zabrać Rio siedzieć Mława czarny:a kawa bawić jakże siedzieć Mława czarny:a kawa bawić jakże siedzieć Mława czarny:a kawa bawić jakże
3140,3140,lato jakieś szare słowikom brakło tchu smutnych wierszy parę napisał smutnych wierszy dosyć zranionych ciężko serc przespanych nocy trawi lęk refren kap kap płyną łzy łez kałużach wypłakane oczy przekwitłe bzy płacze deszcz fontanna szlocha trochę zadziwiona tyle łez dachami muza leci muza weny znak poeci miodu sercach brak muza sukienkę krótką muza skrzydła rąk ciągle smutno boli ząb refren kap kap płyną łzy łez kałużach wypłakane oczy przekwitłe bzy płacze deszcz fontanna szlocha trochę zadziwiona tyle łez,maryla_rodowicz-bardzo_smutna_piosenka,lato jakiś szary słowik braknąć dech smutny wiersz para napisać smutny wiersz dosyć:v zranić ciężko serce przespać noc trawić lęk refren kapa kapa płynąć łza łza kałuża wypłakać oczyć przekwitły bez:s płakać deszcz fontanna szlochać trochę:d zadziwić tyli łza dacha muza lecieć muza wena znak poeci miód serce brak:v muza sukienka krótki muza skrzydło ręka ciągle smutno boleć:v2 ząb refren kapa kapa płynąć łza łza kałuża wypłakać oczyć przekwitły bez:s płakać deszcz fontanna szlochać trochę:d zadziwić tyli łza
3141,3141,poczkaj mały poczkaj powiem twojej mamie sprawa mama spuści lanie boś fartuszek nowy podarł daj choć pranie daj poczkaj mały poczkaj powiem pójdę piekła nieba poczkaj mały poczkaj będziesz płakał gorzko daj kilo proszku daj hejże hej hejże hej daj nowy fartuszek dziewczynie swej będziesz drżał zemstą mą ha ha ha ha ha ha będziesz miał zapłatę swą skarżypyty ziemi yeah oj skarżypyty ziemi hey ey poczkaj mały poczkaj zaraz powiem bratu sprawa brat powie światu porozmawiam józkiem żeś podarł bluzkę daj cerowanie daj poczkaj mały poczkaj opowiem bratu odda katu odda katu poczkaj mały poczkaj porozsyłam wici daj choć nici daj hejże hej hejże hej daj nowy fartuszek dziewczynie swej będziesz drżał zemstą mą ha ha ha ha ha ha będziesz miał zapłatę swą skarżypyty ziemi yeah oj skarżypyty ziemi mhm mhm mhm yeah poczkaj mały poczkaj powiem piekarzowi sprawa powie sąsiadowi żeś fartuszek nowy podarł maryli kwili kraj poczkaj mały poczkaj fartuch nosił chleby grosik prosi poczkaj mały poczkaj daj bułki daj choć bułki daj hejże hej hejże hej daj nowy fartuszek dziewczynie swej będziesz drżał zemstą mą ha ha ha ha ha ha będziesz miał zapłatę swą skarżypyty ziemi oj skarżypyty ziemi hejże hej ha hejże hej,maryla_rodowicz-fartuszek,poczkaj mały:a poczkaj powiedzieć twój:a mama sprawa mama spuścić lanie bo:c fartuszek nowy:a podrzeć dać choć:c pranie dać poczkaj mały:a poczkaj powiedzieć pójść piec:v niebo poczkaj mały:a poczkaj być płakać gorzko dać kilo proszek:s1 dać hejże hej hejże hej dać nowy:a fartuszek dziewczyni swój być drżeć zemsta mój:a ha:s ha:s ha:s ha:s ha:s ha:s być mieć zapłata swój skarżypyta ziemia yeah oj skarżypyta ziemia hey ey poczkaj mały:a poczkaj zaraz:d powiedzieć brat sprawa brat powiedzieć świat porozmawiać Józek że:c podrzeć bluzka dać cerować dać poczkaj mały:a poczkaj opowiedzieć brat oddać kat oddać kat poczkaj mały:a poczkaj porozsyłać wici dać choć:c nić dać hejże hej hejże hej dać nowy:a fartuszek dziewczyni swój być drżeć zemsta mój:a ha:s ha:s ha:s ha:s ha:s ha:s być mieć zapłata swój skarżypyta ziemia yeah oj skarżypyta ziemia mhm mhm mhm yeah poczkaj mały:a poczkaj powiedzieć piekarzowy sprawa powiedzieć sąsiad że:c fartuszek nowy:a podrzeć Maryla kwilić kraj poczkaj mały:a poczkaj fartuch nosić chleb grosik prosić poczkaj mały:a poczkaj dać bułka dać choć:c bułka dać hejże hej hejże hej dać nowy:a fartuszek dziewczyni swój być drżeć zemsta mój:a ha:s ha:s ha:s ha:s ha:s ha:s być mieć zapłata swój skarżypyta ziemia oj skarżypyta ziemia hejże hej ha:s hejże hej
3142,3142,wyszedł strzał centymetr aut znaczy żeś marnie grał świsnął gros linii włos znaczy głos masz kląć swój los wygranych dotąd tyle rund olśnionych swoją słuszna grą przegranego pięknym stylu piosenkę dedykuję mą świat wie wielki pech oddalił medali trzech wciąż wiarę miej złej passy twej przyjdzie kres trwaj graj fair play przegrana wygrana zmieni przegrani wierzcie śpiewkę mą życie turniej pocieszenia nagrody niezłe atakuj sił wciąż przód tył spadłeś koń wysoki możesz dnia przegrywać twe przegrane nagroda twe przegrane nagroda,maryla_rodowicz-dla_przegranego_w_pieknym_stylu,wyjść strzał centymetr aut znaczyć że:c marnie grać świsnąć gros:s linia włos znaczyć głos mieć kląć swój los wygrany dotąd tyli runda olśnić swój słuszny gra przegrany:a piękny styl piosenka dedykować mój:a świat wiedzieć wielki:a pech oddalić medal trzy wciąż wiara mieć zły:a passa twój:a przyjść kres trwać grać fair:a play przegrany:a wygrany zmienić przegrany:a wierzyć śpiewka mój:a życie turniej pocieszenie nagroda niezły:a1 atakować siła:s wciąż przód tyć spaść:v1 koń:s wysoki móc dzień:s1 przegrywać twój:a przegrany:a nagroda twój:a przegrany:a nagroda
3143,3143,zapachniało lancôm em dior em wystawach zamorskie owoce europa wpadła wieczorem stolica przepięknie migoce ulicach wspaniali faceci garniturach czystego jedwabiu pytać leci najwyżej bawią miastem ciemno cicho pies boi boga sąsiad zza ściany pensję lichą wypił ledwo trzyma nogach miasto czasu czasu znajomi normalnie wpadają ploty ciepłą herbatę wlewam baku śpiewam najlepszy narkotyk zapachniało lancôm em dior em wystawach zamorskie owoce europa wpadła wieczorem stolica przepięknie migoce pomyślę raju ponoć łąki niebieskie czekają chyba raju miastem ciemno cicho pies boi boga sąsiad zza ściany pensję lichą wypił ledwo trzyma nogach miasto czasu czasu znajomi normalnie wpadają ploty ciepłą herbatę wlewam baku śpiewam najlepszy narkotyk ciepłą herbatę wlewam baku śpiewam najlepszy narkotyk,maryla_rodowicz-najlepszy_narkotyk,zapachnieć lancôm em Diora em wystawa zamorski owoc Europa wpadły wieczor stolica przepięknie migotać ulica wspaniały facet garnitur czysty jedwab pytać lecieć najwyżej bawić miasto:s ciemno:d cicho pies:s1 bać bóg sąsiad zza ściana pensja lichy wypić ledwo:d trzymać noga miasto:s czas:s czas:s znajomy:a normalnie wpadać plota ciepły herbata wlewać bak:s1 śpiewać dobry:a narkotyk zapachnieć lancôm em Diora em wystawa zamorski owoc Europa wpadły wieczor stolica przepięknie migotać pomyśleć raj ponoć łąka niebieski czekać chybać raj miasto:s ciemno:d cicho pies:s1 bać bóg sąsiad zza ściana pensja lichy wypić ledwo:d trzymać noga miasto:s czas:s czas:s znajomy:a normalnie wpadać plota ciepły herbata wlewać bak:s1 śpiewać dobry:a narkotyk ciepły herbata wlewać bak:s1 śpiewać dobry:a narkotyk
3144,3144,miejsce suficie widać rzeczy sedno wystarczy długo wpatrywać coraz mniej rozumiesz życiu zdarza dni noce czas wydziera kartki kalendarza tą nadzieją wciąż zimne ognie gaśnie smutno wokół choć spełniają baśnie tą nadzieją bóg coraz roztargniony pewnie głowie wysokościach zamęt spać spokojnie człowiek ciemno budzą demony bezczelnie włażą wszędzie mnożą umiaru ciemniej rozumem śpi potrzebny głupio wokół spełniają baśnie rozumem rozumem anioł stróż zdrzemnął przerwę pracy świtu przetrwać noc bezsenną czytam nieznośną lekkość bytu nade niebo wciąż gwiaździste mgła zwątpienia gapię sufit choć wiem najlepszy punkt widzenia tą nadzieją wciąż zimne ognie gaśnie głupio wokół choć spełniają baśnie tą nadzieją,maryla_rodowicz-z_sufitu,miejsce sufit widać:v rzecz sedno wystarczyć długo wpatrywać:v1 coraz mało:d rozumieć życie zdarzać:v1 dzień:s1 noc czas:v wydzierać kartka kalendarz ten nadziać wciąż zimny ogień gasnąć smutno wokół:d choć:c spełniać baśń ten nadziać bóg coraz roztargniony pewnie:d1 głowa wysokość zamęt spać spokojnie człowiek ciemno:d budzić demon bezczelnie włazić wszędzie mnożyć umiar ciemno:d rozum spać potrzebny:a głupio wokół:d spełniać baśń rozum rozum anioł stróż zdrzemnąć przerwać praca świt przetrwać noc bezsenny czytać nieznośny lekkość byt nad niebo wciąż gwiaździsty mgły zwątpienie gapić sufit choć:c wiedzieć dobry:a punkt widzenie ten nadziać wciąż zimny ogień gasnąć głupio wokół:d choć:c spełniać baśń ten nadziać
3145,3145,byłam zatrudniona wesołej pewnej rewii niestety niewypał aktorzy zawiedli mieli nadziei biznes uda biznes diabli wzięli nikt wierzył cuda mieć nadzieję biznes opłaci zysk firma straci podnieca nazywa kasa kasie forsa sukces pierwsza klasa podnieca seks seks plus pełna kasa sukces masz głowy brak talentu odpuść interesy rób zamętu pewne sztywne prawo jasne słońce robisz biznes zrób pieniądze mieć nadzieję,maryla_rodowicz-kasa_i_sex,być zatrudniony:a wesoły pewny:a1 rewia niestety niewypał aktor zawieść mieć nadzieja biznes udać biznes diabli wziąć nikt wierzyć cud mieć nadziać biznes opłacić zysk firma stracić podniecać nazywać kasać kasa forsa sukces pierwszy:a klasa podniecać seks seks plus:s pełny kasać sukces mieć głowa brak:v talent:s1 odpuścić interes robić zamęt pewny:a1 sztywny:a prawo:d1 jasny słońce robić biznes zrób pieniądz mieć nadziać
3146,3146,człowiek życia któremu wciąż pobudka gra człowiek wciąż poganiany wierzyć nudzi równy szyk alarmu hałas pieśni rytm rozkazy próżnych starych wyg wiersza czynią pusty bryk chcę ogromna los mała kos przeklinam wciąż kaprali głos chcę obłędem śnie okrętem mgle słyszeć pogania szeregu chcę chcę stać szeregu ziewać gnić spać tydzień baty głupio brać dostatecznie końcu zdać człowiek powie otworzą ostatnie drzwi wesoły szok każą równać krok chcę ogromna los znajomych ludzi raju tłum aniołów zwinnych brać zamiast tańczyć spijać rum szeregu muszą stać ziemię wracać rad nazbyt biedny świat szeregu biegniesz potem jazda boski sad chcę ogromna los,maryla_rodowicz-w_szeregu,człowiek życie który wciąż pobudka gra człowiek wciąż poganiać:v1 wierzyć nudzić równy szyk alarm hałas pieśń rytm rozkaz próżny stary:a wyga:s1 wiersza czynić pusty bryk:s chcieć ogromny los mały:a kos przeklinać wciąż kapral głos chcieć obłęd snąć okręt mgła słyszeć poganiać:v3 szereg:s chcieć chcieć stać:v szereg:s ziewać gnić spać tydzień baty głupio brać:s dostatecznie koniec zdać człowiek powiedzieć otworzyć ostatni:a drzwi wesoły szok kazić równać krok chcieć ogromny los znajomy:a człowiek raj tłum anioł zwinny brać:s zamiast:j tańczyć spijać rum:s szereg:s muszy stać:v ziemia wracać:v1 rad:a nazbyt biedny:a świat szereg:s biec potem jazda boski sad chcieć ogromny los
3147,3147,górze tyle gwiazd dole tyle miast gwiazdy miastom dają znać dzieci musza spać śpij kochanie gwiazdkę nieba chcesz dostaniesz czego pragniesz daj znać mogę dać chcesz spać śpij nocą gwiazdy niebie złocą dzieci złe pogrążone śnie aaa aaa kotki aaa aaa szarobure szarobure obydwa śpij księżyc ziewa chwilę zaśnie rano przyjdzie świt księżycowi wstyd zasnął śpij nocą gwiazdy niebie złocą dzieci złe pogrążone śnie,maryla_rodowicz-dlaczego_nie_chcesz_spac,góra tyli gwiazda dola tyli miasto:s gwiazda miasto:s dawać znać:v dziecko muszy spać spać kochanie gwiazdka niebo chcieć dostać:v1 czego pragnąć dać znać:v móc dać chcieć spać spać noc gwiazda niebo złocić dziecko zły:a pogrążyć snąć aaa aaa kotka aaa aaa szarobury szarobury obydwa spać księżyc ziewać chwila zasnąć rano:d przyjść świt księżycowy wstyd:v zasnąć spać noc gwiazda niebo złocić dziecko zły:a pogrążyć snąć
3148,3148,kiedyś razem obłoczku kudłatej pufie zaśpiewamy wykrzyczymy łupie póki pchać ziemski kramik dłoni wypadnie zielony kamyk pewno spóźnię zagapię gruszą wsiądę pociąg byle napędzany duszą ruszymy bal drugi nieziemski zanuci walca sto chórów anielskich ubawimy pachy choć łez spłynie odnajdą wciąż młodzi starzy przyjaciele kiedyś razem obłoczku kudłatej pufie damy naszym drogim smutkom serdecznie dupie póki wytrwać orce samych przesieje niebieski ojciec pewno spóźnię zagapię gruszą wsiądę pociąg byle napędzany duszą ruszymy bal drugi nieziemski zanuci walca sto chórów anielskich ubawimy pachy choć łez spłynie odnajdą wciąż młodzi starzy przyjaciele,maryla_rodowicz-na_kudlatej_pufie,kiedy:c razem obłoczek kudłaty puf:s zaśpiewać wykrzyczeć łup:s póki pchać ziemski kramik dłoń wypaść:v1 zielony:a kamyk pewno:d spóźnić zagapić grusza wsiąść pociąg byle:q napędzać dusić ruszyć bal:s1 drugi:a nieziemski zanucić walc sto chór anielski ubawić pach choć:c łza spłynąć odnaleźć wciąż młody:a stary:a przyjaciel kiedy:c razem obłoczek kudłaty puf:s dać nasz drogi:a smutki serdecznie dupa póki wytrwać orka sam:a przesiać niebieski ojciec pewno:d spóźnić zagapić grusza wsiąść pociąg byle:q napędzać dusić ruszyć bal:s1 drugi:a nieziemski zanucić walc sto chór anielski ubawić pach choć:c łza spłynąć odnaleźć wciąż młody:a stary:a przyjaciel
3149,3149,wracasz blady zarośnięty naprawdę rady kłamstwa wykręty piłeś kucharzy złotych gram byłeś konikach oko ograł byłeś powiedz – łatwo nadzieje niezmienne swe tulić nocą żebyś wrócił śniadaniu biedna kłopot sprawiasz czekam zamiast wódkę pić zamiast karty grać mógłbyś domem stać zamiast karty grać zamiast wódkę pić mógłbyś mówić ”pragnę być” zaczęła dobre trzecia zwrotka prząśniczka cichym głosem zażądałeś kołowrotka przędziesz przędzę pijesz mleko grzeczniejszy jesteś dzień równowaga zachowała przyrodzie muszę wódkę pić muszę karty grać mógłbyś oknem stać muszę karty grać muszę wódkę pić jednym dachem żyć,maryla_rodowicz-zamiast_wodke_pic,wracać:v1 blady zarośnięty naprawdę:i rad:s kłamstwo wykręt pić kucharzyć złoty:a grać być konik:s1 oko:s1 ograć być powiedzieć – łatwo nadziać niezmienny swój tulić noc żeby:c wrócić:v1 śniadanie biedny:a kłopot sprawiać czekać zamiast:j wódka picie zamiast:j karty grać móc dom stać:v zamiast:j karty grać zamiast:j wódka picie móc mówić ” bycie zacząć dobry:a trzeci:a zwrotka prząśniczka cichy głos zażądać kołowrotek prząść przędza pić mleko grzeczny być dzień:s1 równowaga zachować przyroda musza wódka picie musza karty grać móc okno stać:v musza karty grać musza wódka picie jeden:a dach życie
