,id,text,author_title,stemmed_text
745,745,year kysz biala mysz year kysz biala mysz year adrenalina year adrenalina year pieknie year pieknie year pieknie year pieknie year kolo wesolo year kolo wesolo year kolo wesolo year kolo wesolo year kolo wesolo year kolo wesolo year kolo wesolo year kolo wesolo year kolo wesolo year kolo wesolo year kolo wesolo year kolo wesolo year kolo wesolo year kolo wesolo year kolo wesolo year kolo wesolo year kolo wesolo year kolo wesolo year kolo wesolo year kolo wesolo year autobiografia year autobiografia year autobiografia year autobiografia year autobiografia year autobiografia year autobiografia year autobiografia year autobiografia year autobiografia year autobiografia year autobiografia year autobiografia year autobiografia year autobiografia year autobiografia year autobiografia year autobiografia year autobiografia year autobiografia year autobiografia year autobiografia year autobiografia minimax year bazancie zycie year bazancie zycie year bazancie zycie year bog narodzi year bog narodzi year bujanie oblokach year bujanie oblokach year bujanie oblokach year bujanie oblokach year bujanie oblokach year calkiem kraj year calkiem kraj year calkiem kraj year calkiem kraj year calkiem kraj year calkiem kraj year chce czegos smiac year chce czegos smiac year chce czegos smiac year chce czegos smiac year chce czegos smiac year chce czegos smiac year chcemy year chcemy year chcemy year chcemy year chcemy year chcemy year chcemy year chcemy year chcemy year chcemy year chcemy year chcemy year chcemy year chcemy year obchodzi year dzieje mej biednej glowie year dzieje mej biednej glowie year czytanka janka year czytanka janka year czytanka janka year czytanka janka year czytanka janka year czytanka janka year czytanka janka year czytanka janka year dar year derwisz bokser year kogo year kogo year zasady sprawy year zasady sprawy year dobre dni year droga lez year droga lez year druga czytanka janka year year year year year year em year em year express year mowie year geny year golly gee the ball is rolling year golly gee the ball is rolling year grawitowac year grawitowac year plyne prad year lubie historii year lubie historii year lubie historii year lubie historii year year year year jestes wirus year umarlem year umarlem year chcesz zaskoczyc year kainowe pokolenie year kartka pamietnika year kartka pamietnika year kartka pamietnika year oddech year oddech year oddech year oddech year oddech year year year year year kocham zyciu year kola year kolysanka year kolysanka year kolysanka year kolysanka year kolysanka year kolysanka nieznajomej year kolysanka nieznajomej year kolysanka nieznajomej year kolysanka nieznajomej year kolysanka nieznajomej year ksiezycowe dzieci year ksiezycowe dzieci year ksiezycowe dzieci year przygarnie year lokomotywa ogloszenia year lokomotywa ogloszenia year lokomotywa ogloszenia year lokomotywa ogloszenia year lokomotywa ogloszenia year lokomotywa ogloszenia year ludzie niepowszedni year ludzie niepowszedni year ludzie niepowszedni year ludzie niepowszedni year mietowy smak dobrych dni year milosc rosnie year milosc rosnie year milosc rosnie year magiczna rozdzka year morze obledu year musisz tanczyc year dzikiej lace year dzikiej lace year rozlanym mlekiem year najmniejszy oddzial swiata year najmniejszy oddzial swiata year najmniejszy oddzial swiata year najmniejszy oddzial swiata year najmniejszy oddzial swiata year muzyka wzbudza strach year muzyka wzbudza strach year daj zabic year fkoorwiay year fkoorwiay year kreci year mogily rock and rolla year mogily rock and rolla year mogily rock and rolla year darmo year placz ewka year placz ewka year placz ewka year placz ewka year placz ewka year placz ewka year placz ewka year pytaj year wolno year niepokonani year niepokonani year niepokonani year niepokonani year niepokonani year niepokonani year niepokonani year niewiele moge dac year niewiele moge dac year niewiele moge dac year niewiele moge dac year niewiele moge dac year niewiele moge dac year year year objazdowe nieme kino year objazdowe nieme kino year objazdowe nieme kino year objazdowe nieme kino year objazdowe nieme kino year objazdowe nieme kino year objazdowe nieme kino year objazdowe nieme kino year objazdowe nieme kino year objazdowe nieme kino year objazdowe nieme kino year objazdowe nieme kino year objazdowe nieme kino year objazdowe nieme kino year objazdowe nieme kino year objazdowe nieme kino year objazdowe nieme kino year objazdowe nieme kino year obled podmiejskiej dyskotece year obled podmiejskiej dyskotece year obled podmiejskiej dyskotece year obracam palcach zloty pieniadz year obracam palcach zloty pieniadz year obracam palcach zloty pieniadz year obracam palcach zloty pieniadz year obracam palcach zloty pieniadz year obracam palcach zloty pieniadz year oddech rosji year odnawiam dusze year odnawiam dusze year odnawiam dusze year odnawiam dusze year olowiana kula year opanuj year opanuj year opanuj year opanuj year opanuj year opanuj year opowiesc hermafrodyty year palac year pepe wroc year pepe wroc year pepe wroc year pepe wroc year pepe wroc year pepe wroc year year year polskie lato mp year polskie lato mp year poki sen year przebudzanka year przebudzanka year przezyjmy zime year przezyjmy zime year przezyjmy zime year raz raz year raz raz year raz raz year raz raz year raz raz year raz raz year raz raz year rzeczy zrobienia year schody year siodma czytanka janka year spac moge jesc year spoczac year spoczac year spoczac year spoczac year spoczac year spoczac year spoczac year strazak year strzelec wyborowy year smiglo year year przebudzenie year moment year moment year moment year moment year tokszol year zyc year zyc year zyc year zyc year zyc year wiesz wiem year wiesz wiem year wiesz wiem year kolysz year urodzilem pary year vampiria de luxe year wieczny dylemat year wieczny dylemat year wieczny dylemat year wieczny dylemat year wieczorny przeglad moich mysli year wieczorny przeglad moich mysli year wieczorny przeglad moich mysli year wieczorny przeglad moich mysli year wieczorny przeglad moich mysli year wladca danych year swoj czas year swoj czas year swoj czas year swoj czas year swoj czas year swoj czas year wyspa drzewo zamek year wyspa drzewo zamek year wyspa drzewo zamek year wyspa drzewo zamek year wyspa drzewo zamek year wyznanie lwa year wyznanie lwa year wyznanie lwa year wyznanie lwa year wyzej year zycia idola year zamieniam psa year zamieniam psa year zamieniam psa year zamieniam psa year znak year plaza year plaza year zyje chce year zywy stad wyjdzie nikt year zywy stad wyjdzie nikt year zywy stad wyjdzie nikt year zywy stad wyjdzie nikt year zywy stad wyjdzie nikt year zywy stad wyjdzie nikt year zywy stad wyjdzie nikt year zywy stad wyjdzie nikt year zywy stad wyjdzie nikt year zywy stad wyjdzie nikt year zywy stad wyjdzie nikt,perfect-metric,year kysz biala mysz year kysz biala mysz year adrenalina year adrenalina year pieknie year pieknie year pieknie year pieknie year kolo wesolo year kolo wesolo year kolo wesolo year kolo wesolo year kolo wesolo year kolo wesolo year kolo wesolo year kolo wesolo year kolo wesolo year kolo wesolo year kolo wesolo year kolo wesolo year kolo wesolo year kolo wesolo year kolo wesolo year kolo wesolo year kolo wesolo year kolo wesolo year kolo wesolo year kolo wesolo year autobiografia year autobiografia year autobiografia year autobiografia year autobiografia year autobiografia year autobiografia year autobiografia year autobiografia year autobiografia year autobiografia year autobiografia year autobiografia year autobiografia year autobiografia year autobiografia year autobiografia year autobiografia year autobiografia year autobiografia year autobiografia year autobiografia year autobiografia minimax year bazancie Zyta year bazancie Zyta year bazancie Zyta year bog narodzić year bog narodzić year bujać oblokach year bujać oblokach year bujać oblokach year bujać oblokach year bujać oblokach year calkiem kraj year calkiem kraj year calkiem kraj year calkiem kraj year calkiem kraj year calkiem kraj year chcieć czegos smiac year chcieć czegos smiac year chcieć czegos smiac year chcieć czegos smiac year chcieć czegos smiac year chcieć czegos smiac year chcieć year chcieć year chcieć year chcieć year chcieć year chcieć year chcieć year chcieć year chcieć year chcieć year chcieć year chcieć year chcieć year chcieć year obchodzić year dziać mój:a biedny:a Glów year dziać mój:a biedny:a Glów year czytanka Janka:s2 year czytanka Janka:s2 year czytanka Janka:s2 year czytanka Janka:s2 year czytanka Janka:s2 year czytanka Janka:s2 year czytanka Janka:s2 year czytanka Janka:s2 year dar year derwisz bokser:s1 year koga year koga year zasada sprawa year zasada sprawa year dobry:a dzień:s1 year drogi:a lez year drogi:a lez year drugi:a czytanka Janka:s2 year year year year year year em year em year Express year mowa year gen year Golly:s1 gee the Ball:s1 IS rolling year Golly:s1 gee the Ball:s1 IS rolling year grawitowac year grawitowac year plyne prad year Luba:s2 historia year Luba:s2 historia year Luba:s2 historia year Luba:s2 historia year year year year jestes wirus year umarlem year umarlem year chcieć zaskoczyc year kainowy pokolenie year kartka pamietnika year kartka pamietnika year kartka pamietnika year oddech year oddech year oddech year oddech year oddech year year year year year kochać zyciu year kola year kolysanka year kolysanka year kolysanka year kolysanka year kolysanka year kolysanka nieznajomy:a year kolysanka nieznajomy:a year kolysanka nieznajomy:a year kolysanka nieznajomy:a year kolysanka nieznajomy:a year ksiezycowe dziecko year ksiezycowe dziecko year ksiezycowe dziecko year przygarnąć year lokomotywa ogloszenia year lokomotywa ogloszenia year lokomotywa ogloszenia year lokomotywa ogloszenia year lokomotywa ogloszenia year lokomotywa ogloszenia year lud:s1 niepowszedni:a1 year lud:s1 niepowszedni:a1 year lud:s1 niepowszedni:a1 year lud:s1 niepowszedni:a1 year mietowy smak dobry:a dzień:s1 year milosc rosnie year milosc rosnie year milosc rosnie year magiczny rozdzka year morze obledu year musieć tanczyc year dziki:a laka year dziki:a laka year rozlany mleko year mały:a oddzial swiata year mały:a oddzial swiata year mały:a oddzial swiata year mały:a oddzial swiata year mały:a oddzial swiata year muzyka wzbudzać strach:v year muzyka wzbudzać strach:v year dać zabic year fkoorwiay year fkoorwiay year kreci year mogily rock:s1 Anda roll year mogily rock:s1 Anda roll year mogily rock:s1 Anda roll year darmo year placz Ewka year placz Ewka year placz Ewka year placz Ewka year placz Ewka year placz Ewka year placz Ewka year pytać year wolno:v year pokonać year pokonać year pokonać year pokonać year pokonać year pokonać year pokonać year niewiele:d moge Dac:s1 year niewiele:d moge Dac:s1 year niewiele:d moge Dac:s1 year niewiele:d moge Dac:s1 year niewiele:d moge Dac:s1 year niewiele:d moge Dac:s1 year year year objazdowy niemy:a kino year objazdowy niemy:a kino year objazdowy niemy:a kino year objazdowy niemy:a kino year objazdowy niemy:a kino year objazdowy niemy:a kino year objazdowy niemy:a kino year objazdowy niemy:a kino year objazdowy niemy:a kino year objazdowy niemy:a kino year objazdowy niemy:a kino year objazdowy niemy:a kino year objazdowy niemy:a kino year objazdowy niemy:a kino year objazdowy niemy:a kino year objazdowy niemy:a kino year objazdowy niemy:a kino year objazdowy niemy:a kino year obled podmiejski dyskoteka year obled podmiejski dyskoteka year obled podmiejski dyskoteka year obracać palec zlot pieniadz year obracać palec zlot pieniadz year obracać palec zlot pieniadz year obracać palec zlot pieniadz year obracać palec zlot pieniadz year obracać palec zlot pieniadz year oddech Rosja year odnawiać dusz year odnawiać dusz year odnawiać dusz year odnawiać dusz year olowiana kulać year opanować year opanować year opanować year opanować year opanować year opanować year opowiesc hermafrodyta:s1 year Palac:s1 year pepe wroc year pepe wroc year pepe wroc year pepe wroc year pepe wroc year pepe wroc year year year polski:a lato MP:s1 year polski:a lato MP:s1 year poki sen:s1 year przebudzanka year przebudzanka year przezyjmy zime year przezyjmy zime year przezyjmy zime year raz:s1 raz:s1 year raz:s1 raz:s1 year raz:s1 raz:s1 year raz:s1 raz:s1 year raz:s1 raz:s1 year raz:s1 raz:s1 year raz:s1 raz:s1 year rzecz zrobić year schody year siodma czytanka Janka:s2 year spac moge jesc year spoczac year spoczac year spoczac year spoczac year spoczac year spoczac year spoczac year strazak year strzelec wyborowy year smiglo year year przebudzenie year moment year moment year moment year moment year tokszol year zyc year zyc year zyc year zyc year zyc year wiedzieć wiedzieć year wiedzieć wiedzieć year wiedzieć wiedzieć year kolysz year urodzilem par:s2 year vampiria de:s luxe year wieczny dylemat year wieczny dylemat year wieczny dylemat year wieczny dylemat year wieczorny przeglad mój:a mysli year wieczorny przeglad mój:a mysli year wieczorny przeglad mój:a mysli year wieczorny przeglad mój:a mysli year wieczorny przeglad mój:a mysli year wladca dany year swoj czas:v year swoj czas:v year swoj czas:v year swoj czas:v year swoj czas:v year swoj czas:v year wyspa drzewo zamek:s1 year wyspa drzewo zamek:s1 year wyspa drzewo zamek:s1 year wyspa drzewo zamek:s1 year wyspa drzewo zamek:s1 year wyznanie lew:s2 year wyznanie lew:s2 year wyznanie lew:s2 year wyznanie lew:s2 year wyzej year zycia idol:s1 year zamieniać pies:s1 year zamieniać pies:s1 year zamieniać pies:s1 year zamieniać pies:s1 year znak year Plaza:s1 year Plaza:s1 year zyje chcieć year zywy stado wyjść nikt year zywy stado wyjść nikt year zywy stado wyjść nikt year zywy stado wyjść nikt year zywy stado wyjść nikt year zywy stado wyjść nikt year zywy stado wyjść nikt year zywy stado wyjść nikt year zywy stado wyjść nikt year zywy stado wyjść nikt year zywy stado wyjść nikt
746,746,kontroluje dźwięk śpiewam śmiałe wiersze steruje wolą mą laserową sondę binarny kod przekłada serca dreszcze spisuje myśli me pomyśleć zdążę dane zbiera okrągły rok kontroluje wypisuję czek adres podpis wiek kogo czyta skaner zakrada zapadam sen nową fazą r e m przeprogramować dane dane zbiera okrągły rok obserwuje ciała skleja seks pachwinę wsuwa mikroskopijny sensor mierzy długość fal filmuje gest kogo tajnych taśm wycina klatki cenzor dane zbiera okrągły rok przerwy zmienia genetyczny kod ktooooooooooooooooo,perfect-wladca_danych,kontrolować dźwięk śpiewać śmiały wiersz sterować woli mój:a laserowy sonda binarny kod przekładać serce dreszcz spisować myślić mój:a pomyśleć zdążyć dany zbierać okrągły rok:s1 kontrolować wypisywać czek adres podpis wiek koga czytać skaner zakradać zapadać sen:s1 nowy:a faza r e metr przeprogramować dany dany zbierać okrągły rok:s1 obserwować ciało sklejać seks pachwina wsuwa mikroskopijny sensor mierzyć długość fala filmować gest koga tajny taśma wycinać klatka cenzor dany zbierać okrągły rok:s1 przerwa zmieniać genetyczny kod ktooooooooooooooooo
747,747,sto gorących słów dworze mróz niewyspaną noc koc solo moich ust gitarowy blues dróg skrót parę stów mogę dać mogę dać niewiele mogę dać mogę dać przykro osiem znanych nut mccartneya but niezłych płyt kicz siedem chudych talię zgranych kart południowy głód kurz brud mogę dać mogę dać niewiele mogę dać mogę dać przykro mogę dać mogę dać niewiele mogę dać mogę dać przykro nadgryziony wdzięk pustej szklanki brzęk niespełniony sen itp podzielony świat myśli warte krat zaleczony lęk weź chcesz,perfect-niewiele_ci_moge_dac,sto gorący słowo dwór mróz niewyspany noc koc solo:a mój:a usta gitarowy blues droga skrót para stówa móc dać móc dać niewiele:d móc dać móc dać przykro osiem znany:a nut McCartney but niezły:a1 płyt kicz siedem chudy:a talia zgrany kart południowy głód kurz brud móc dać móc dać niewiele:d móc dać móc dać przykro móc dać móc dać niewiele:d móc dać móc dać przykro nadgryźć wdzięk pusty szklanka brzęk spełnić sen:s1 itp podzielić świat myślić wart:a krata zaleczyć lęk wziąć chcieć
748,748,otwieram oczy budzę zapach dnia dziwnie nęci pościeli zbieram resztki snu chcę wyrzucę śmieci żyletkę patrzy obca twarz noc zbyt długo trwała wampira uśmiech widzę kły czuję lew apetyt ciało twe moich żyłach kipi krew czuła bądź czuję lew pazury ostrzę puszę trotylu kilo chodź całość gorący piasek wabi pali wstyd głowie drzemie lwią miłość ofiaruję weź drobne rozmieniaj rozkoszą zalejemy świat spłynie świat lawina korzystaj szybko chwili póki chcę czuję lew apetyt ciało tw moich żyłach kipi krew czuła bądź czuję lew pazury ostrzę puszę trotylu kilo znak chodź czuję lew apetyt ciało twe moich żyłach kipi krew czuła bądź końca czuję lew pazury ostrzę puszę trotylu kilo szaleć chcę dzień chodź czuję lew,perfect-wyznanie_lwa,otwierać oczyć budzić zapach dzień:s1 dziwnie nęcić pościelić zbierać resztka sen:s1 chcieć wyrzucić śmiecić żyletka patrzyć obcy:a twarz noc zbyt:s długo trwały wampir:s1 uśmiech widzieć kieł czuć:v lew:s1 apetyt ciało twój:a mój:a żyła kipieć krew czuły bądź:j czuć:v lew:s1 pazur ostrzyć puszyć trotyl kilo chodzić całość gorący piasek wabić pali wstyd:v głowa drzemać lwi miłość ofiarować wziąć drobny rozmieniać rozkosz zalać świat spłynąć świat lawina korzystać szybko chwila póki chcieć czuć:v lew:s1 apetyt ciało TW mój:a żyła kipieć krew czuły bądź:j czuć:v lew:s1 pazur ostrzyć puszyć trotyl kilo znak chodzić czuć:v lew:s1 apetyt ciało twój:a mój:a żyła kipieć krew czuły bądź:j koniec czuć:v lew:s1 pazur ostrzyć puszyć trotyl kilo szaleć chcieć dzień:s1 chodzić czuć:v lew:s1
749,749,biały dzień podszedł gość szara twarz pospolita oczy zajrzał beznamiętnie rzekł dałbyś strasznie chce jeść toczy hiv jeść chce mogę przyzwyczaić obrazków kina znam głowie mogę przestawić całkiem kraj biały dzień słyszę kuli gwizd drugi strzał niebo leci krzyk chodnik barwi krew lecą tafle szkła śnie okna spada płaszcz wiem mogła mieć siedemnaście mogę przyzwyczaić obrazków kina znam głowie mogę przestawić całkiem kraj,perfect-calkiem_inny_kraj,biały:a dzień:s1 podejść gość szary twarz pospolity oczyć zajrzeć beznamiętnie rzec:v1 dać strasznie chcieć jeść toczyć HIV jeść chcieć móc przyzwyczaić obrazek kino znać:v głowa móc przestawić całkiem kraj biały:a dzień:s1 słyszeć kuć gwizd drugi:a strzał niebo lecieć krzyk chodnik barwić krew leca tafla szkła snąć okno spadać płaszcz wiedzieć móc mieć siedemnaście móc przyzwyczaić obrazek kino znać:v głowa móc przestawić całkiem kraj
750,750,masz tyle rzeczy zrobienia życiu swym odkładaj niczego potem docenci łysi myślenia wmówią obowiązek masz swą męskość cztery razy udowodnić dom zbudować drzewo posadzić syna zmajstrować wroga zabić tresują urodzenia abyś pękł szkoły poślą stracisz ochotę masz tyle długów spłacenia robotę łapiesz zostajesz karnym trybem maszynie kręgosłup masz przetrącony kaganiec mocno założony wiesz musisz dom zbudować drzewo posadzić syna zmajstrować wroga zabić,perfect-rzeczy_do_zrobienia,mieć tyli rzecz zrobić życie swój odkładać nic potem docent:s1 łysy:a myślenie wmówić obowiązek mieć swój męskość cztery raz:s1 udowodnić dom zbudować drzewo posadzić:v1 syn zmajstrować wrogi zabicie tresować urodzenie aby:c pęknąć szkoła posłać:v1 stracić ochota mieć tyli dług spłacić robota łapać zostawać karny:a tryb maszyna kręgosłup mieć przetrącić kaganiec mocno założyć wiedzieć musieć dom zbudować drzewo posadzić:v1 syn zmajstrować wrogi zabicie
751,751,oczach masz wciąż blask zniewala mogę dać miłość szans wokół materialny świat końcu zniszczy poddawaj kochanie poddawaj tyle czeka pięknych chwil dobrych życiu zdarzyć kochaj żyłach burzy krew kochaj oddam życie swe kochaj zaczynaj małej wojny małej wojny zaczynaj płynie krew oglądamy świat wiara gniew manipulować dam sercem patrz rozum miej razem szansa poddawaj poddawaj tyle czeka pięknych chwil dobrych życiu zdarzyć kochaj żyłach burzy krew kochaj oddam życie swe kochaj zaczynaj małej wojny małej wojny zaczynaj,perfect-ta_sama_krew,oko:s2 mieć wciąż blask zniewalać móc dać miłość szansa wokół:d materialny świat koniec zniszczyć poddawać kochanie poddawać tyli czekać piękny chwila dobry:a życie zdarzyć:v1 kochać żyła bury krew kochać oddać życie swój kochać zaczynać mały:a wojna mały:a wojna zaczynać płynąć krew oglądać świat wiara gniew manipulować dać serce patrzeć rozum mieć razem szansa poddawać poddawać tyli czekać piękny chwila dobry:a życie zdarzyć:v1 kochać żyła bury krew kochać oddać życie swój kochać zaczynać mały:a wojna mały:a wojna zaczynać
752,752,myślę stało bocian niósł pomyłkę wybrał dom stąd zrobił zrzut paszport bym kieszeni miał prace chyba inną inną nocy poduszce spał miał pogodne sny czując jutro świat pokocha nieba sypnie grosz bujał obłokach całkiem wolny trosk marzyć umknął cel szanse nieskończenie wielkie przyszłość wieczną niewiadomą znokautować los mocno wierzyć jutro świat pokocha nieba sypnie grosz pobujamy obłokach tacy wolni trosk,perfect-bujanie_w_oblokach,myśleć stać:v3 bocian nieść pomyłka wybrać dom stąd zrobić zrzut paszport by:q kieszenia mieć prace chybać inny:a inny:a noc poduszka spać mieć pogodny sen:s1 czuć:v jutro:d świat pokochać niebo sypnąć grosz bujać obłok całkiem wolny:a1 troska marzyć umknąć cel szansa skończyć wielki:a przyszłość wieczny niewiadomy:a znokautować los mocno wierzyć jutro:d świat pokochać niebo sypnąć grosz pobujać obłok taki:a wolny:a1 troska
753,753,niebo niełaskawe zachlapana zima śni chcę śnić udam kimam dalej poprzewracam pościeli oby smętny dzień stawał niedzielą przebudzenie obraz znaczenia całe wieki schowam wygrana lubię chwalić zapalę rano palę wcale dalej drzemiesz widać snu wiesz koszuli mojej białej przebudzenie obraz znaczenia całe wieki schowam powieką przebudzenie obraz znaczenia całe wieki schowam przebudzenie obraz znaczenia całe wieki schowam powieką,perfect-takie_to_przebudzenie,niebo niełaskawy zachlapać zimać śnić chcieć śnicie udać kimać daleko poprzewracać pościelić oby smętny dzień:s1 stawać:v2 niedziela przebudzenie obraz znaczenie cały wiek schować wygrany lubić chwalić zapalić rano:d pala wcale daleko drzemać widać:v sen:s1 wiedzieć koszula mój:a biały:a przebudzenie obraz znaczenie cały wiek schować powieka przebudzenie obraz znaczenie cały wiek schować przebudzenie obraz znaczenie cały wiek schować powieka
754,754,kręci gówniana polityka kręci moich rękach krew interes wojna trwa wkładam stopy drzwi kręci fałszywa statystyka kręci dziecięcych oczach strach wynalazki śledzą non stop wiedzą zatriumfuje zło chcę ksenofobią żyć chcę prawdę poznać ahana hahahana kręci przewrotna retoryka kręci zawistnych starców klan cuchnąca żółć truje jadem mózg młodym dają ręce broń wiarę ślą front chcę ksenofobią żyć chcę prawdę poznać nadal naszym świecie wiesz śmiało całkiem śmiało lęku świat ramiona weź kręci gówniana polityka kręci moich rękach krew chcę ksenofobią żyć chcę prawdę poznać nadal innym świecie wiesz śmiało całkiem śmiało lęku świat ramiona weź ahana hahahana ahana hahahana,perfect-nie_kreci_mnie,kręty gówniany polityka kręty mój:a ręka krew interes wojna trwać wkładać stop:s drzwi kręty fałszywy statystyka kręty dziecięcy oko:s2 strach:v wynalazek śledzić nona stop:s wiedza zatriumfować zło chcieć ksenofobia życie chcieć prawda:s poznać ahana hahahana kręty przewrotny retoryka kręty zawistny:a starzec:s1 klan cuchnący żółć truć jad mózg młody:a dawać ręka broń wiara słać:v1 front chcieć ksenofobia życie chcieć prawda:s poznać nadal nasz świat wiedzieć śmiało całkiem śmiało lęk świat ramię wziąć kręty gówniany polityka kręty mój:a ręka krew chcieć ksenofobia życie chcieć prawda:s poznać nadal inny:a świat wiedzieć śmiało całkiem śmiało lęk świat ramię wziąć ahana hahahana ahana hahahana
