,id,text,author_title,stemmed_text
728,728,pytaj wiem przyjdzie życie iść podzielę dopóki iskrzyć pragnienia starość zetrze pył podzielę wieje wiatr dni smak słonej krwi dzień dobry zły zostanie serca dnie pytaj wieczność wiem żył podzielę dopóki iskrzyć marzenia starość zetrze pył podzielę wieje wiatr dni smak słonej krwi dzień dobry zły zostanie serca dnie,wilki-wszystko_to_co_mam,pytać wiedzieć przyjść życie iścić podzielić dopóki iskrzyć:v1 pragnienie starość zetrzeć pył podzielić wiać wiatr dzień:s1 smak słony krew dzień:s1 dobry:a zły:a zostać serce dna pytać wieczność wiedzieć żyć podzielić dopóki iskrzyć:v1 marzenia starość zetrzeć pył podzielić wiać wiatr dzień:s1 smak słony krew dzień:s1 dobry:a zły:a zostać serce dna
729,729,wracałem drodze padł samochód księżyc miał pełną twarz wokół las sto obcych głosów włosy łapał strach zanim wyszła złość limuzyny długi nos zatrzymał uchylając czarne drzwi powiedziała słowa trzy chcesz wejdź wiem potem nagły zmorzył sen powtarzał głos masz ochotę ograniczeń bierz słońca promień nagle wpadł kogut zapiał prysnął czar kamień obróciła przysięgam wierzcie świeży napis chcesz wejdź uratowało bóg jedyny wie szyi zębów ślad wracam późno limuzynie widzę otwartych siedzi drzwiach lekceważ rady mej nagim ostrzem baw księżycową jasną noc odjąć rozum głos chcesz wejdź chodź choooodż,perfect-vampiria_de_luxe,wracać:v1 droga paść:v1 samochód księżyc mieć pełny twarz wokół:d las sto obcy:a głos włos łapać strach:v zanim wyjść złość limuzyna długi nos zatrzymać uchylać czarny:a drzwi powiedzieć słowo trzy chcieć wejść wiedzieć potem nagły zmorzyć sen:s1 powtarzać głos mieć ochota ograniczenie:s brać:v słońce promień nagle wpaść:v1 kogut:s1 zapiać prysnąć czar kamień obrócić przysięgać wierzyć świeży napis chcieć wejść uratować bóg jedyny:a wiedzieć szyja ząb ślad wracać:v1 późno limuzyna widzieć otwarty siedzieć drzwi lekceważyć rad:s mój:a nagi:a ostrze bawić księżycowy jasny noc odjąć rozum głos chcieć wejść chodzić choooodż
730,730,chciałbym mieć frajerski czek hotelu mieszkać szwed kredyt masz jesteś gość śniadanie łóżku dadzą nos palcem raz zastukaj stół pikolak piwem leci zgięty pół chciałbym umieć żyć noc inną małolatą dyskotece pić chciałbym mieć naftowy szyb żyć arab polsce robić służewiec raz tip top przegra forsę potem spać późno wstać trzeciej zmianie whisky siebie lać mogę mieć koszule nowe zamiast stare prać chciałbym mieć frajerski czek hotelu mieszkać szwed kredyt masz jesteś gość śniadanie łóżku dadzą nos palcem raz zastukaj stół pikolak piwem leci zgięty pół chciałbym umieć żyć noc inną małolatą dyskotece pić,perfect-bazancie_zycie,chcieć mieć frajerski czek hotel mieszkać szwed kredyt mieć być gość śniadanie łóżko dać nos palec raz:s1 zastukać stół pikolak piwo lecieć zgiąć póła chcieć umieść życie noc inny:a małolata dyskoteka picie chcieć mieć naftowy szyb życie arab Polska:s1 robić Służewiec raz:s1 tip top przegrać forsa potem spać późno wstać trzeci:a zmiana whisky siebie lać móc mieć koszula nowy:a zamiast:j stary:a prać chcieć mieć frajerski czek hotel mieszkać szwed kredyt mieć być gość śniadanie łóżko dać nos palec raz:s1 zastukać stół pikolak piwo lecieć zgiąć póła chcieć umieść życie noc inny:a małolata dyskoteka picie
731,731,potem dane śnisz koszmar koszmar snu równać życiem zamkniesz oczy zniknie świat chcesz udowodnić odchodząc stąd zysku strat póki zrób zapalmy posłuchaj los chyba daje znak póki spójrz dachu dół tę drogę strasznie czas wydłuża skręcisz choćbyś chciał miałem dachu zerwać ptak miałeś stać widok lustro pękło pół ujrzałem siebie znak póki zrób zapalmy posłuchaj los chyba daje znak czekaj stój spójrz dachu dół drogi da zawrócić skręcisz choćbyś chciał,perfect-znak_dla_ciebie,potem dany śnić koszmar koszmar sen:s1 równać życie zamknąć oczyć zniknąć świat chcieć udowodnić odchodzić stąd zysk strata póki zrób zapalić posłuchać los chybać dawać znak póki spojrzeć dach dół:s1 ten droga strasznie czas:v wydłużać skręcić choćby:c chcieć mieć dach zerwać ptak mieć stać:v widok lustro pęknąć póła ujrzeć siebie znak póki zrób zapalić posłuchać los chybać dawać znak czekać stać:v3 spojrzeć dach dół:s1 drogi:a dać zawrócić skręcić choćby:c chcieć
732,732,pragnienie doi masz zaspokoić prosta filozofia żyjesz raz gotowiznę lewą skręć małolatą szybki seks gruchę domu wal całych dniach mózg dopomina śpi adrenalina dopalacz sięgaj klucz drzwi zasadę taką anioł stróż dostarcza aureoli złoty pył fajne zakazane filmy kręcą podpuścić życie ludzkiej kupie wolności test masz chęć wolno wolno wolno wolno wolno kula łeb tępieje ostrze łapię czyjeś porsche kawałek prostej lecę gumy grzać tłumika ryk policyjne zwabi psy migiem nogę dać fajne zakazane filmy kręcą podpuścić życie ludzkiej kupie wolności test masz chęć wolno wolno wolno wolno wolno dupie siedź,perfect-nie_wolno,pragnienie doić mieć zaspokoić prosty:a filozofia żyć raz:s1 gotowizna lewy:a skręcić małolata szybki seks grucha dom wal:s1 cały dzień:s1 mózg dopominać spać adrenalina dopalacz:s1 sięgać klucz drzwi zasada taki:a anioł stróż dostarczać aureola złoty:a pył fajny zakazany film kręcić podpuścić życie ludzki kupia wolność test mieć chęć wolno:v wolno:v wolno:v wolno:v wolno:v kulać łeb:s1 tępieć ostrze łapię czyjś porsche kawałek prosty:a lecieć guma grzać tłumik:s1 ryk policyjny zwabić pies:s1 mig:s1 noga dać fajny zakazany film kręcić podpuścić życie ludzki kupia wolność test mieć chęć wolno:v wolno:v wolno:v wolno:v wolno:v dupa siedzieć
733,733,płomień sercu nosisz niebiezpieczny wstrętne rzeczy robisz dymu spala oczach drga błękitnawym swiatłem widzę twardy grunt nogami tracę czuję niemy tłum odzyskuje mowę ludzie krzyczą widzą zagubioną drogę którą chcieli biec jesteś wirus zabójcza pleśń wpływu mieście mieć siedem barw spina włosy triumfalny łuk głowę rozsadzi pewnej nocy miewam snów jesteś wirus zabójcza pleśń wpływu mieście mieć jesteś wirus chcesz żywcem zjeść muszę moich myśli wygnać psa deszcz wygnać psa deszcz,perfect-jestes_jak_wirus,płomień serce nosić niebiezpieczny wstrętny rzecz robić dym spalać oko:s2 drgać błękitnawy swiatłem widzieć twardy grunt noga tracić czuć:v niemy:a tłum odzyskiwać mowa lud:s1 krzyczeć widzieć zagubiony droga który chcieć biec być wirus zabójczy pleśń wpływ miesić mieć siedem barwa spina włos triumfalny łuk głowa rozsadzić pewny:a1 noc miewać sen:s1 być wirus zabójczy pleśń wpływ miesić mieć być wirus chcieć żywiec:s1 zjeść musza mój:a myślić wygnać pies:s1 deszcz wygnać pies:s1 deszcz
734,734,oszukuj dłużej najlepiej wiesz wymyślasz kart jakieś miejsce porę rok naiwny bajki świat chcesz spotkać spróbuj choć pomysleć raz istnieje słuchaj wreszcie mówię możesz topić wosk zgadywać twarz omdlenia rąk zamąci wzrok wiesz urodził ooooo dłużej żyć razy mogę przegrywać wiec słuchaj póki czas pora kończyć tę grę obydwu masz jutro spróbuj choć pomyśleć raz wiesz urodził spróbuj choć pomysleć raz wiesz ooooo urodził,perfect-jego_nie_ma,oszukiwać długo dobrze wiedzieć wymyślać kart jakiś miejsce pora:s rok:s1 naiwny bajka świat chcieć spotkać spróbować choć:c pomysleć raz:s1 istnieć słuchać wreszcie mówić móc topić wosk zgadywać:v1 twarz omdlenie ręka zamącić wzrok wiedzieć urodzić ooooo długo życie raz:s1 móc przegrywać wiec słuchać póki czas:v pora:v kończyć ten gra obydwa mieć jutro:d spróbować choć:c pomyśleć raz:s1 wiedzieć urodzić spróbować choć:c pomysleć raz:s1 wiedzieć ooooo urodzić
735,735,zagubiony pies traci trop ciągle miejscu kręcę kolejny rok napędu chyba zero kasy pewien radę dam niewidzialnej rysy bieg dzieli pół czuję skórze mej dwóch raz marzeń tratwę zbić zaufać kołysaniu fal robić ni morze czyha wina obłęd trucizna rozmów białego dnia serdecznie dymie fajek morzu kaw myśli niski lot chemia kolorowych szkłach tępi zmysł zapasach nagich ciał niagara śni wielką ochotę zerwać wiedzą morze obłęd genach śpi lepiej morze wielki błękit silnej ręki morze morze obłęd obłęd,perfect-morze_obledu,zagubiony pies:s1 tracić trop ciągle miejsce kręcić kolejny rok:s1 napęd chybać zero:s kasa pewien rada dać niewidzialny rys bieg dzielić póła czuć:v skóra mój:a dwa raz:s1 marzenia tratwa zbić zaufać kołysanie fala robić ni:s morze czyhać wina obłęd trucizna rozmowa biały:a dzień:s1 serdecznie dym fajka morze kawa myślić niski lot:s1 chemia kolorowy:a szkła tępy zmysł zapas nagi:a ciało Niagara śnić wielki:a ochota zerwać wiedza morze obłęd gen spać dobrze morze wielki:a błękit silny ręka morze morze obłęd obłęd
736,736,fioletowo słoną rzeką rozpinam purpurowy most powietrze eksploduje tęczą dźwięczą ostrza srebrnych kos ciemności dzieci biegną wabi gitar słodki dźwięk obracam palcach złoty pieniądz pokazuję czołgom cel wchodzę bezbronnie rozebrany klatki tygrys śpi ścianach jarzą ekrany widzę czym bestia śni krzyk strach śmiercią przecina błysk tygrysich kłów obracam palcach złoty pieniądz kopniakiem budząc snu wiążę jedwabne sznurowadła diamentowy wkładam frak krwią znaczone prześcieradła waszej hańby wieszam znak niechże szybko wiosny lecą prześliczna bando hien obracam palcach złoty pieniądz przeraźliwie nudzę,perfect-obracam_w_palcach_zloty_pieniadz,fioletowo słony rzec:v1 rozpinać purpurowy most powietrze eksplodować tęczyć dźwięczeć ostrz srebrny kos ciemność dziecko biec wabić gitara słodki dźwięk obracać palec złoty:a pieniądz pokazować czołg cel wchodzić bezbronnie rozebrać klatka tygrys spać ściana jarzyć:v1 ekran widzieć czy:q bestia śnić krzyk strach:v śmierć przecinać błysk tygrysi kieł obracać palec złoty:a pieniądz kopniak budzić sen:s1 wiązać jedwabny sznurowadło diamentowy wkładać frak krew znaczyć prześcieradło wasz hańba wieszać znak niechże szybko wiosna leca prześliczny bando hiena obracać palec złoty:a pieniądz przeraźliwie nudzić
737,737,pierwsza noc domem pierwszy pierwszy raz rano stary gadał czas trzasnął drzwiami potem rok koniec nagle pękło dno potem sto kilku – chcę znać – wciąż daje spać – stara sprawa – dobrych zabawa – powiedziało – znało wrócił wysłany tygodniem list śladów świadczą chciał czytać ludzi ulicach krok świąt mówią warto żyć prąd kilku – chcę znać – wciaż daje spać – stara sprawa – dobrych zabawa – udawało łzy – podkradało sny – miało dorówna pierwsza noc domem pierwszy pierwszy raz rano stary gadał czas trzasnał drzwiami potem rok koniec nagle pękło dno potem sto,perfect-kilka_z_nich,pierwszy:a noc dom pierwszy:a pierwszy:a raz:s1 rano:d stary:a gadać czas:v trzasnąć drzwi potem rok:s1 koniec nagle pęknąć dno potem sto kilka:n – chcieć znać:v – wciąż dawać spać – stary:a sprawa – dobry:a zabawa – powiedzieć – znać:v wrócić:v1 wysłać:v1 tydzień list ślad świadczyć chcieć czytać człowiek ulica krok święto:s mówić warto życie prąd kilka:n – chcieć znać:v – wciaż dawać spać – stary:a sprawa – dobry:a zabawa – udawać łza – podkradać sen:s1 – mieć dorównać pierwszy:a noc dom pierwszy:a pierwszy:a raz:s1 rano:d stary:a gadać czas:v trzasnał drzwi potem rok:s1 koniec nagle pęknąć dno potem sto
738,738,przybywa boje spojrzeć wstecz obudzi najgłośniejszy gitar dźwięk spocząć odjeść cień pobudować dom dzieci mieć spocząć odejść cień inni zapaść wielki sen świat dał wykrzyczeć poszedł chciał następcy stoją bram gitary siłę dział spocząć odejść cień pobudować dom dzieci mieć spocząć odejść cień inni zapaść wielki sen taśmy zmienią proch zanim plastik rozsypie pył odtworzyć głos głos heroldów niespokojnych dni czas spocząć odejść cień pobudować dom dzieci mieć czas spocząć odjeść cień inni zapaść wielki sen,perfect-spoczac,przybywać boj spojrzeć wstecz obudzić głośny gitara dźwięk spocząć odjeść cień pobudować dom dziecko mieć spocząć odejście cień inny:a zapaść:s wielki:a sen:s1 świat dać wykrzyczeć pójść chcieć następca stać:v3 bram gitara siła:s dziać spocząć odejście cień pobudować dom dziecko mieć spocząć odejście cień inny:a zapaść:s wielki:a sen:s1 taśma zmienić proch zanim plastik rozsypać pył odtworzyć głos głos herold niespokojny:a1 dzień:s1 czas:v spocząć odejście cień pobudować dom dziecko mieć czas:v spocząć odjeść cień inny:a zapaść:s wielki:a sen:s1
739,739,żyć cicho mnich wytyczoną drogą iść ślepym głuchym pień spotykać dzień żyć ostrza błysk opętańcze pędząc dni dom stu miastach mieć zaznać czeka liczy bicia serca zraniona pójdzie ramiona me kryje zagra tańczyć postaram żyć chytrze lis podkradane szczęście pić carem armie mieć zdobyć skarby mórz muzykę chin piramidy słońca świt oddam sekundzie zechce czeka liczy bicia serca czeka wiem zraniona pójdzie ramiona me kryję zagra tańczyć postaram zamknięte dawno uchyli drzwi kryję zatańczyć pięknie postaram,perfect-em,życie cicho mnich:s1 wytyczyć drogi:a iścić ślepy:a głuchy pień spotykać dzień:s1 życie ostrz błysk opętańczy pędzić dzień:s1 dom sto miasto:s mieć zaznać czekać liczyć bicie serce zranić pójść ramię mój:a kryć zagrać tańczyć postarać życie chytrze lis:s1 podkradać szczęście picie car armia mieć zdobycie skarb morze muzyka china piramida słońce świt oddać sekunda zechcieć czekać liczyć bicie serce czekać wiedzieć zranić pójść ramię mój:a kryć zagrać tańczyć postarać zamknięty dawno uchylić drzwi kryć zatańczyć pięknie postarać
740,740,lubie historii nienawidzę złych pluskw znoszę świstów kul mogę znieść wojennych historii amazonek złych bóstw krzyżaków mgle whooo aja whooo aja whooo aja whooo aja kradnie pocałunki zmienia serce szary lód małą wojnę wysłać chciał wielkim kaligulą straszy noc whooo aja whooo aja whooo aja whooo ajaj wykładów lekcji dwój berlina padł kolana mogę noc kochać pić bawić maskaradzie mogę żyć chodzcie dzielni żołnierze wielcy rycerze wielcy fałszerze bedę kochał czas historia oceni oceni whooo aja whooo aja,perfect-jak_ja_nie_lubie_historii,Luba:s2 historia nienawidzieć zły:a Pluskwa:s2 znosić:v1 świst kul móc znieść wojenny historia amazonka zły:a bóstwo krzyżak:s1 mgła whooo aja whooo aja whooo aja whooo aja kraść pocałunek zmieniać serce szary lód:s1 mały:a wojna wysłać:v1 chcieć wielki:a Kaligula straszyć noc whooo aja whooo aja whooo aja whooo ajaj wykład lekcja dwója berlina paść:v1 kolano móc noc kochać picie bawić maskarada móc życie chodzcie dzielny:a1 żołnierz wielki:a rycerz wielki:a fałszerz Beda:s2 kochać czas:v historia ocenić ocenić whooo aja whooo aja
741,741,siedzieliśmy winie długo kolacji ksieżyc pełny chciało spać potem kochaliśmy włączonej telewizji starsznie żarłocznie kończył czas pierwszy pocisk niby szerszeń zrobił ścianie mały otwór drugi bezbłędnie przeszył skroń działo filmie oczy miała wciąż otwarte widziała niewidzialny super kamery ekran hełmie procesor stopie wszyty stałe zadania zna błyskawica słoneczny dzień uderza znienacka wybrany cel jutro potem potem potem jutro potem potem potem atakuje komputer pokazuje broni skuteczniejszy byłby cios szkolny autobus zbliżeniu koziołkuje kontroluje most komentuje uśmiecha strzelecem wyborowym zabijać gotowy kamerą kocha śmierć jutro potem potem potem jutro potem potem potem wojna żywo rozrywka mas realny atak agonia strach wielki gwiazdor miliardy wart medium wyczuwa czego chce świat reklamach pojawi strzelcem wyborowym zabijać gotowy kamerą kocha śmierć jutro potem potem potem jutro potem potem potem,perfect-strzelec_wyborowy,siedzieć winąć długo kolacja ksieżyc pełny chcieć spać potem kochać włączyć telewizja starsznie żarłocznie kończyć czas:v pierwszy:a pocisk niby:j szerszeń zrobić ściana mały:a otwór drugi:a bezbłędnie przeszyć skroń dziać film oczyć mieć wciąż otwarty widzieć niewidzialny super:a kamera ekran hełm procesor stop:s wszyć stały zadanie znać:v błyskawica słoneczny dzień:s1 uderzać znienacka wybrany:a cel jutro:d potem potem potem jutro:d potem potem potem atakować komputer pokazować bronić skuteczny być cios szkolny autobus zbliżenie koziołkować kontrolować most komentować uśmiechać strzelecem wyborowy zabijać gotowy kamera kochać śmierć jutro:d potem potem potem jutro:d potem potem potem wojna żywo rozrywka masa realny atak agonia strach:v wielki:a gwiazdor miliard:s wart:a medium wyczuwać czego chcieć świat reklama pojawić strzelec wyborowy zabijać gotowy kamera kochać śmierć jutro:d potem potem potem jutro:d potem potem potem
742,742,boją muzyki słów boją nocy spać boją zobaczą dwóch boją siebie boją stu padną nóg mówią masz pną szczyt potem spadają dół nieustannie boją pędzą tchu choć przeraża rytm boją miejscu stać powiedz stoisz drżysz boją,perfect-duzo_nas,bać muzyka słowo bać noc spać bać zobaczyć dwa bać siebie bać sto paść:v1 noga mówić mieć piąć szczyt potem spadać dół:s1 nieustannie bać pędzić dech choć:c przerażać rytm bać miejsce stać:v powiedzieć stać:v3 drżeć bać
743,743,noc młoda spać domu dywanie neon prosto twarz dręczy pytanie czym zabić czas czym zabi czas choć staram widzę głowy ostudzę różne rzeczy kręcą oka zmruże paszczę smoka wejść paszczę smoka wejść czuję pogania puls lecę góry dół muza wzieła krople sen przygarnie choc stołem kopie los łatwo poddam ciało dobre ręce oddam chcę chcę dzsiaj miasto niespokojne śpi cyklon mial przejść wszędzie przepraszajaą brak miejsc przytuli paparappapapararam miasto niespokojne śpi cyklon mial przejść wszędzie przepraszajaą brak miejsc przygarnie przygarnie przygarnie przygarnie przygarnie przygarnie ktooo,perfect-kto_dzis_przygarnie_mnie,noc młody:a spać dom dywan neon:s1 prosto twarz dręczyć pytanie czy:q zabicie czas:v czy:q zabi czas:v choć:c starać widzieć głowa ostudzić różny rzecz kręcić oko:s1 zmruże paszcza smokać wejście paszcza smokać wejście czuć:v poganiać:v3 puls lecieć góry dół:s1 muza wzieła krople sen:s1 przygarnąć choc stół kopać:v1 los łatwo poddać ciało dobry:a ręka oddać chcieć chcieć dzsiaj miasto:s niespokojny:a1 spać cyklon mialić przejście wszędzie przepraszajaą brak:v miejsce przytulić paparappapapararam miasto:s niespokojny:a1 spać cyklon mialić przejście wszędzie przepraszajaą brak:v miejsce przygarnąć przygarnąć przygarnąć przygarnąć przygarnąć przygarnąć ktooo
744,744,miałem radio pioneer świat czarno biały strasznie mijał dzień dniem czas guma ciągnął nudów chciało wyć marcową noc usłyszałem radio głos opowiadał stąd myśli ludziach poznam głos tłumaczył żyć stan poczuć król musisz znać słowa klucze minimax kosmos dźwięków tyle zim wędrowałem głosem pojąłem prosty fakt kim chciałem sprawił głos piotra k,perfect-autobiografia_minimax,mieć radio Pioneer świat czarno biały:a strasznie mijać dzień:s1 dzień:s1 czas:v guma ciągnąć:v1 nuda:s1 chcieć wycie marcowy noc usłyszeć radio głos opowiadać stąd myślić człowiek poznać głos tłumaczyć życie stan poczucie król:s1 musieć znać:v słowo klucz minimax kosmos dźwięk tyli zima wędrować głos pojąć prosty:a fakt ki chcieć sprawić głos Piotr:s2 kompania
