,id,text,author_title,stemmed_text
700,700,every time of midnight every time muddle again hold lovely memories every sound you bring out every time suffer again holding lovely memories every stand of way every town muddle again call hold your memory every game of sense every shame offer in game hold lovely memory son of the blue sky x every time of midnight every time muddle again call and hold flash memory every time of midnight every time of midnight call and hold flash memory d rather say feeding some birds lost in cage kicking s heels having way strolling musicians up the way pulling s leg having way feeding some birds lost in cage there being so free finding the way be wondering how smart it happens be happens be son of the blue sky x,wilki-son_of_the_blue_sky,every time of midnight every time muddle again hold lovely memories every sound you bring out every time suffer again holding lovely memories every stand of way every town muddle again call hold your memory every game of sense every shame offer in game hold lovely memory son of the blue sky X every time of midnight every time muddle again call Anda hold flash memory every time of midnight every time of midnight call Anda hold flash memory D rather say feeding some birds lost in cage kicking sekunda heels having way strolling musicians up the way pulling sekunda lega having way feeding some birds lost in cage there being Księga_Sofoniasza free finding the way be:a wondering how smart Ita happens be:a happens be:a son of the blue sky X
701,701,samo miasto najpiękniejszy świat najpiękniejsze dni zostawiłem kolorowe sny kiedyś zatrzymam czas skrzydłach ptak leciał sił sny warszawskie kolorowe dni samo x,wilki-sen_o_warszawie,sam:a miasto:s piękny świat piękny dzień:s1 zostawić kolorowy:a sen:s1 kiedy:c zatrzymać czas:v skrzydło ptak lecieć siła:s sen:s1 warszawski kolorowy:a dzień:s1 sam:a X
702,702,nosił czarną koszulę miał oczy pełne łez imię beniamin takich miejsc chciał płakał deszczem nocą szukał swoich gwiazd pytał wciąż samo skończy droga dom dom dom lato wybuchło miłością biegli odtąd białe szalone konie siły coraz mniej mieli drodze mgle potem poszli razem szukać nowych gwiazd pytali samo skończy droga dom dom dom,wilki-beniamin,nosić czarny:a koszula mieć oczyć pełny łza imię beniamin taki:a miejsce chcieć płakać deszcz noc szukać swój gwiazda pytać wciąż sam:a skończyć drogi:a dom dom dom lato wybuchnąć miłość biegły:a odtąd biały:a szalony:a koń:s siła:s coraz mało:d mieć droga mgła potem pójść razem szukać nowy:a gwiazda pytać sam:a skończyć drogi:a dom dom dom
703,703,dziewczyna gitarą morze molo tle wiem jutro wiem patrzy samo chyba wie byle zepsuć jutro liczy kinie polećmy gwiazd dole wyścig szczurów trwa niewinność ranem otuliła wiem jutro wiem znasz miejsce zapytała byś chciał zobaczyć swój ostatni dzień kinie polećmy gwiazd dole wyścig szczurów trwa znikła codzienność myśli wiem zdarzyć wiem kinie polećmy gwiazd dole wyścig szczurów trwa,wilki-dziewczyna_z_gitara,dziewczyna gitara morze molo tło wiedzieć jutro:d wiedzieć patrzyć sam:a chybać wiedzieć byle:q zepsucie jutro:d liczyć kinąć polecieć gwiazda dola wyścig szczur trwać niewinność rano:s otulić wiedzieć jutro:d wiedzieć znać:v miejsce zapytać by:q chcieć zobaczyć swój ostatni:a dzień:s1 kinąć polecieć gwiazda dola wyścig szczur trwać znikły:a1 codzienność myślić wiedzieć zdarzyć:v1 wiedzieć kinąć polecieć gwiazda dola wyścig szczur trwać
704,704,przychodzi głowy samotny człowiek środku dnia zupełnie ulicy gwar zgubione szczęście wraca choćbyś chciał tyle życiu zmienia zaufaj przeznaczeniu pijemy lepszy czas dzień życiu trwa każde wspomnienie żyje żyje chwilę przychodzi głowy poprawisz choćbyś chciał czekaj wiatr zjawi wykorzystaj tę chwilę spotkać środku dnia trać wiary marzenia tyle stracenia pijemy lepszy czas dzień życiu trwa każde wspomnienie żyje żyje chwilę,wilki-urke,przychodzić głowa samotny człowiek środek dzień:s1 zupełnie ulica gwar zgubić szczęście wracać:v1 choćby:c chcieć tyli życie zmieniać zaufać przeznaczenie pić dobry:a czas:v dzień:s1 życie trwać każdy wspomnienie żyć żyć chwila przychodzić głowa poprawić choćby:c chcieć czekać wiatr zjawić:v1 wykorzystać ten chwila spotkać środek dzień:s1 tracić wiara marzenia tyli stracenie pić dobry:a czas:v dzień:s1 życie trwać każdy wspomnienie żyć żyć chwila
705,705,święty naród pójdzie spać płonie brudna krew ostatni serca zew świętym mieście szaniec krzyży rządzi ślepy król korona ciąży biały bóg najmniejszy śmierci wróg wszędzie widzę dotykam stóp świętym mieście szaniec krzyży rządzi ślepy król korona ciąży mamy chwilę mamy chwilę zanim minie czas zanim skończy świat zanim wino przestanie grzać święty naród pójdzie spać płonie brudna krew ostatni serca zew świętym mieście szaniec krzyży rządzi ślepy król korona ciąży mamy chwilę mamy chwilę zanim minie czas zanim skończy świat zanim wino przestanie grzać,wilki-mamy_tylko_chwile,święty:a naród pójść spać płonąć brudny krew ostatni:a serce zew święty:a miesić szaniec krzyż rządzić ślepy:a król:s1 korona ciąża biały:a bóg mały:a śmierć wróg wszędzie widzieć dotykać:v1 stopa święty:a miesić szaniec krzyż rządzić ślepy:a król:s1 korona ciąża mama chwila mama chwila zanim minąć czas:v zanim skończyć świat zanim wino przestać:v1 grzać święty:a naród pójść spać płonąć brudny krew ostatni:a serce zew święty:a miesić szaniec krzyż rządzić ślepy:a król:s1 korona ciąża mama chwila mama chwila zanim minąć czas:v zanim skończyć świat zanim wino przestać:v1 grzać
706,706,chyba maj park grochowie słoneczny dzień zobaczyłem tańczyłaś boso byłaś natchniona chwili zaczął padać deszcz wiedziałem dzieje znikło byłaś stałaś tęczy zaczarowana świeciło słonce nieba padał deszcz tyle samotnych dróg musiałem przejść tyle samotnych dróg musiałem przejść móc odnaleźć padał deszcz oczy wreszcie spotkały odbicia zagubionych gwiazd byłaś blisko zrozumiałem odejdzie wieczność uczyńmy życia święto będąc chwilę zapamiętać droga skończy odejdzie tyle samotnych dróg musiałem przejść tyle samotnych dróg musiałem przejść móc odnaleźć padał deszcz x tyle samotnych dróg musiałem przejść tyle samotnych dróg musiałem przejść móc odnaleźć,wilki-na_zawsze_i_na_wiecznosc,chybać maj park Grochowo słoneczny dzień:s1 zobaczyć tańczyć boso być natchniony chwila zacząć padać:v1 deszcz wiedzieć dziać zniknąć być stać:v3 tęczyć zaczarowany świecić słonka niebo padać:v1 deszcz tyli samotny droga musieć przejście tyli samotny droga musieć przejście móc odnaleźć padać:v1 deszcz oczyć wreszcie spotkać odbicie zagubiony gwiazda być blisko:d zrozumieć odejść wieczność uczynić życie święto:s być chwila zapamiętać drogi:a skończyć odejść tyli samotny droga musieć przejście tyli samotny droga musieć przejście móc odnaleźć padać:v1 deszcz X tyli samotny droga musieć przejście tyli samotny droga musieć przejście móc odnaleźć
707,707,tonie miasto śnie ciągle zasnę przyjdziesz choć barze wiem rzadko zjawiasz ludzie pustych szklankach dnie przeglądają takim barze przysięgałaś zostawisz głowa wspomnień głowa wspomnień warszawa bawi źle ciągle mijają zwykłe dni miewam sny lepiej myślałem zamykałaś drzwi pusto tonie miasto śnie ciągle zasnę głowa wspomnień głowa wspomnień,wilki-miasto_we_snie,tonąć miasto:s snąć ciągle zasnąć przyjść choć:c bar:s1 wiedzieć rzadko zjawiać:v1 lud:s1 pusty szklanka dna przeglądać taki:a bar:s1 przysięgać zostawić głowa wspomnienie głowa wspomnienie warszawa bawić źle ciągle mijać zwykły:a1 dzień:s1 miewać sen:s1 dobrze myśleć zamykać drzwi pusto tonąć miasto:s snąć ciągle zasnąć głowa wspomnienie głowa wspomnienie
708,708,oknem wiatr wkrada cicho zabija leżysz herbata wystygła wzięłaś wspaniały tren jasną twarz chociaż noc chce ubrać swój czarny płaszcz muzyka gra gorący deszcz spada moją twarz nienawidzę łez nienawidzę łez końca wiatr skrada puka okna słów powiemy siebie światło pali wszędzie siła budzi życia jedyna jedyna ból łzy ból łzy przychodzi jesień zaczyna usypiać wieje wiatr czuć zimę przychodzi noc zabiera światło dnia słów powiemy siebie światło pali wszędzie siła budzi życia jedyna jedyna ból łzy ból łzy,wilki-kiedy_nie_ma_juz_nic,okno wiatr wkradać cicho zabijać leżeć herbata wystygły wziąć wspaniały tren jasny twarz chociaż:c noc chcieć ubrać swój czarny:a płaszcz muzyka gra gorący deszcz spadać mój:a twarz nienawidzieć łza nienawidzieć łza koniec wiatr skradać:v1 pukać okno słowo powiedzieć siebie światło:d pali wszędzie siła:d budzić życie jedyny:a jedyny:a ból łza ból łza przychodzić jesień zaczynać usypiać wiać wiatr czuć:v zima przychodzić noc zabierać światło:d dzień:s1 słowo powiedzieć siebie światło:d pali wszędzie siła:d budzić życie jedyny:a jedyny:a ból łza ból łza
709,709,świat fajne miejsce warto chronić świat fajne miejsce warto chronić świat fajne miejsce warto chronić warto walczyć x szybciej coraz szybciej coraz chcemy coraz jemy coraz końcu pękniemy ziemia pęknie świat fajne miejsce warto chronić świat fajne miejsce warto chronić świat fajne miejsce warto chronić warto walczyć,wilki-swiat_to_fajne_miejsce,świat fajny miejsce warto chronić świat fajny miejsce warto chronić świat fajny miejsce warto chronić warto walczyć X szybko coraz szybko coraz chcieć coraz jeść coraz koniec pęknąć ziemia pęknąć świat fajny miejsce warto chronić świat fajny miejsce warto chronić świat fajny miejsce warto chronić warto walczyć
710,710,zacząć rzecz lecę zgubiłem niewiele pamiętam far fara raj czuję chuć wiatr bawimy myślom końca śnieg zawierucha lecę chcę lecę życie złe pieniądze lecę wolność zew lecę wciąż kocham kocham bohema ostro bawi płyną noce przemijają dnie niewiele pamiętam upadam byle boisz słabe życie słaba śmierć twoich rękach obudź lecę chcę lecę życie złe pieniądze lecę wolność zew lecę wciąż kocham kocham,wilki-bohema,zacząć rzecz lecieć zgubić niewiele:d pamiętać far fara raj czuć:v chuć wiatr bawić myśl koniec śnieg zawierucha lecieć chcieć lecieć życie zły:a pieniądz lecieć wolność zew lecieć wciąż kochać kochać bohema ostro bawić płynąć noc przemijać dna niewiele:d pamiętać upadać:v2 byle:q bać słaby życie słaby śmierć twój:a ręka obudzić lecieć chcieć lecieć życie zły:a pieniądz lecieć wolność zew lecieć wciąż kochać kochać
711,711,słowa pięści zamienią szum wody przyjdą noce szalonej miłości wzięte zostanie oddane zostanie pokochane miłość płonie świetlistej koronie aborygen aborygen tańczy niebie aborygen aborygen wolny ptak aborygen aborygen tańczy niebie tańczy niebie miejsca nieznane chwile żyje wzięte zostanie oddane zostanie zrozumiane miłość płonie świetlistej koronie aborygen aborygen tańczy niebie aborygen aborygen wolny ptak aborygen aborygen tańczy niebie tańczy niebie blady uśmiech dnia zabierze oczom blask zanim zmieni zanim rozdzieli pozwól wierzyć pozostanie zanim rozpuści świat zanim minie czas aborygen aborygen tańczy niebie aborygen aborygen wolny ptak aborygen aborygen tańczy niebie tańczy niebie aborygen,wilki-aborygen,słowo pięść zamienić szum woda przyjść noc szalony:a miłość wzięty zostać oddany zostać pokochać miłość płonąć świetlisty korona aborygen aborygen tańczyć niebo aborygen aborygen wolny:a1 ptak aborygen aborygen tańczyć niebo tańczyć niebo miejsce nieznany chwila żyć wzięty zostać oddany zostać zrozumieć miłość płonąć świetlisty korona aborygen aborygen tańczyć niebo aborygen aborygen wolny:a1 ptak aborygen aborygen tańczyć niebo tańczyć niebo blady uśmiech dzień:s1 zabrać oko:s2 blask zanim zmienić zanim rozdziele pozwolić wierzyć pozostać zanim rozpuścić świat zanim minąć czas:v aborygen aborygen tańczyć niebo aborygen aborygen wolny:a1 ptak aborygen aborygen tańczyć niebo tańczyć niebo aborygen
712,712,zakrętem lód ciemność chłód daj serce rozpuśćmy zimę daj ciało chłód szybko minie zakrętem lampki serduszkach przestają żyć daj serce rozpuśćmy zimę daj ciało chłód szybko minie,wilki-nasze_przedmiescia,zakręt lód:s1 ciemność chłód dać serce rozpuścić zima dać ciało chłód szybko minąć zakręt lampka serduszko przestawać życie dać serce rozpuścić zima dać ciało chłód szybko minąć
713,713,spotkamy idąc dróg płonie ogień białej skale choć jedni proszą inni bród ból radość wyśpiewajmy miłość łzy wyśpiewajmy wolność wiatr wolność wiatr światło dnia samo choć kwiaty zimy ukryciu trwają wśród dróg śniegiem zasypane uayo,wilki-uayo,spotkać iść droga płonąć ogień biały:a skala choć:c jeden:a prosić inny:a bród ból radość wyśpiewać miłość łza wyśpiewać wolność wiatr wolność wiatr światło:d dzień:s1 sam:a choć:c kwiat zima ukrycie trwać wśród droga śnieg zasypany uayo
714,714,zostaje parę miejsc zdjęć wiara ciszę kłamie nikt zabiję nocy białe ptaki obsiadły kruche żagle kryształowe złote statki pełne złotych mew zabiję nocy chyba padał deszcz aniołowie śmiali wyfroterowany hol jadę nicość,wilki-nie_zabije_nocy,zostawać para miejsce zdjęcia wiara ciszyć kłamać nikt zabić noc biały:a ptak obsiadły kruchy żagle kryształowy złoty:a statki pełny złoty:a mewa zabić noc chybać padać:v1 deszcz anioł śmiały wyfroterować hol jechać nicość
715,715,płoną sztandary zmienia świat biały wróg czarny brat postęp podstępna gra odpowiedź zna wiatr rozwieje pył istnień ślad potrafił żyć życie umiał brać doszliśmy zbawiając świat tysiące miłość koniunkcja gwiazd odpowiedź zna wiatr rozwieje pył istnień ślad potrafił żyć życie umiał brać x,wilki-srebrny_pyl,płony sztandar zmieniać świat biały:a wróg czarny:a brat postęp podstępny gra odpowiedź znać:v wiatr rozwiać pył istnienie ślad potrafić:v1 życie życie umieć brać:s dojść zbawiać świat tysiąc:s1 miłość koniunkcja gwiazda odpowiedź znać:v wiatr rozwiać pył istnienie ślad potrafić:v1 życie życie umieć brać:s X
716,716,przepraszam słowa złe miłość strach zgubiony oczu twych blask przepraszam życie potrafię zmienić siebie przepraszam życie nauczę oddychać przejść prób razy upaść wstać próżny trud umiesz kochać przepraszam życie potrafię zmienić siebie przepraszam życie nauczę oddychać przepraszam przepraszam zmienię przepraszam przepraszam zmienię uuu haa hej przepraszam przepraszam zmienię uhu haa hej zmienię przepraszam przepraszam zmienię,wilki-przepraszam_cie,przepraszać słowo zły:a miłość strach:v zgubić oko:s2 twój:a blask przepraszać życie potrafić:v1 zmienić siebie przepraszać życie nauczyć oddychać przejście próba raz:s1 upaść:v1 wstać próżny trud umieć kochać przepraszać życie potrafić:v1 zmienić siebie przepraszać życie nauczyć oddychać przepraszać przepraszać zmienić przepraszać przepraszać zmienić uuu haa hej przepraszać przepraszać zmienić uhu haa hej zmienić przepraszać przepraszać zmienić
717,717,pogasły światła zamknęli niebo pewien zwyczajny dzień odeszłaś stąd trzy noce płakałem deszczem bojąc malując piersiach krzyż swoja krwią swoją krwią swoją krwią trzy noce płonęły niebo ziemia snach wciąż biegniemy łące znając imienia malując piersiach krzyż swoją krwią swoją krwią biegłaś ulicą padał deszcz pijany opowiedzieć życiu biegłaś ulicą x,wilki-trzy_noce_z_deszczem,pogasły światły zamknąć niebo pewien zwyczajny dzień:s1 odejść stąd trzy noc płakać deszcz bać malować pierś krzyż swój krew swój krew swój krew trzy noc płonąć niebo ziemia sen:s1 wciąż biec łąka znać:v imienie malować pierś krzyż swój krew swój krew biec ulica padać:v1 deszcz pijany:a opowiedzieć życie biec ulica X
718,718,ziemia niebo słońce niebie chodź bądź bój zabiją póki zabiją chodź bądź bój zabiją ziemi póki zabiją nieba słońca niebie kwiaty niebo gwiazdy niebie chodź bądź bój zabiją póki zabiją chodź bądź bój zabiją ziemi póki zabiją nieba słońca niebie żyjemy obcym miejscu żyjąc marzeniami jesteśmy czekamy rzeką rozpala ogień rozpalmy ogień kochanie dzień dzień wstaje aniele,wilki-letnia_piosenka_dla_ciebie,ziemia niebo słońce niebo chodzić bądź:j bój zabić póki zabić chodzić bądź:j bój zabić ziemia póki zabić niebo słońce niebo kwiat niebo gwiazda niebo chodzić bądź:j bój zabić póki zabić chodzić bądź:j bój zabić ziemia póki zabić niebo słońce niebo żyć obcy:a miejsce żyć marzenia być czekać rzec:v1 rozpalać ogień rozpalić ogień kochanie dzień:s1 dzień:s1 wstawać anieli
719,719,robisz fajną rzecz piszesz zdarzyło gość mówi otwierasz piszesz wiersz każdym wierszu wilki sex nikt lubi takich wierszy równanie dna równanie dołu zdarzy wielkiego nikomu równanie dna równanie dołu zdarzy pięknego nikomu masz fajny dom fajną brykę rodziną czujesz niebie sąsiad punktu nienawidzi zazdrości ciężko pracujesz starasz robisz najlepiej umiesz nikt lubi takich ludzi równanie dna równanie dołu zdarzy wielkiego nikomu równanie dna równanie dołu zdarzy pięknego nikomu dżuma – mentalna komuna,wilki-rownanie_do_dolu,robić fajny rzecz pisać zdarzyć:v1 gość mówić otwierać pisać wiersz każdy wiersz wilki sex nikt luby:a taki:a wiersz równanie dna równanie dół:s1 zdarzyć:v1 wielki:a nikt równanie dna równanie dół:s1 zdarzyć:v1 piękny nikt mieć fajny dom fajny bryka rodzina czuć:v niebo sąsiad punkt nienawidzieć zazdrościć ciężko pracować starać robić dobrze umieć nikt luby:a taki:a człowiek równanie dna równanie dół:s1 zdarzyć:v1 wielki:a nikt równanie dna równanie dół:s1 zdarzyć:v1 piękny nikt dżuma – mentalny komuna
720,720,wiszę krzyżu czuły umarłe drzewo klejnoty ziemi złota blask nade niebo wiszę krzyżu czas meteoryty fruną gwiazd życie wiatr gna świat wiszę krzyżu samotnie umieramy wygasa płomień każdym płomień wciąż znamy wiszę krzyżu czas meteoryty fruną gwiazd życie wiatr gna świat zmierzamy,wilki-dokad_zmierzamy,wisieć krzyż czuły umarły:a drzewo klejnoty ziemia złoty:a blask nad niebo wisieć krzyż czas:v meteoryt frunąć:v1 gwiazda życie wiatr gnać świat wisieć krzyż samotnie umierać wygasać płomień każdy płomień wciąż znać:v wisieć krzyż czas:v meteoryt frunąć:v1 gwiazda życie wiatr gnać świat zmierzać
721,721,dzikiej ziemi snów kamieni oczekiwaniu wiatr miasta końca słońca uciekanie swój świat ptak wędrowny ptak nieba szkliste rozpoznanie nieba końca wpłynę czas umieranie kochanie uciekanie swój świat ptak wędrowny ptak dzikiej ziemi snów kamieni oczekiwaniu wiatr miasta końca słońca uciekanie swój świat ptak wędrowny ptak,wilki-z_dzikiej_ziemi,dziki:a ziemia sen:s1 kamień oczekiwanie:s wiatr miasto:s koniec słońce uciekać swój świat ptak wędrowny ptak niebo szklisty rozpoznanie niebo koniec wpłynąć czas:v umierać kochanie uciekać swój świat ptak wędrowny ptak dziki:a ziemia sen:s1 kamień oczekiwanie:s wiatr miasto:s koniec słońce uciekać swój świat ptak wędrowny ptak
722,722,myślisz mówisz wiem czego chcesz mała rzecz wielki płacz milion pytań dnia krótka smycz głowy ból chcę patrzeć pustym łóżku świt będziesz liczyć swe łzy szalonym locie gwiazd próbujesz zatrzymać czas żyj chwilą licz szczęście krótko trwa ciche dni dzikości serca brak halo wenus mars mars popatrz oczy chwile świat chcesz trzepocie skrzydeł pyle miłość nadać życiu sens widzę myślę seks mówię cześć myślę seks cieszę chcesz trawie biec grzeszny wiesz zbędnych gestów słów halo wenus mars wołam popatrz oczy chwile świat chcesz trzepocie skrzydeł pyle prawdziwa miłość nadać życiu sens popatrz oczy chwile świat chcesz trzepocie skrzydeł pyle prawdziwa miłość nadać życiu sens popatrz oczy chwile świat chcesz trzepocie skrzydeł pyle prawdziwa miłość nadać życiu sens,wilki-wenus_tu_mars,myślić mówić wiedzieć czego chcieć mały:a rzecz wielki:a płacz milion:s pytanie dzień:s1 krótki smycz głowa ból chcieć patrzeć pusty łóżko świt być liczyć swój łza szalony:a lot:s1 gwiazda próbować zatrzymać czas:v żyć chwila liczyć szczęście krótko trwać cichy dzień:s1 dzikość serce brak:v halo:s wenus mars:s1 mars:s1 popatrzeć oczyć chwila świat chcieć trzepot skrzydło pył miłość nadać życie sens widzieć myśleć seks mówić cześć:s myśleć seks cieszyć chcieć trawa biec grzeszny wiedzieć zbędny gest słowo halo:s wenus mars:s1 wołać popatrzeć oczyć chwila świat chcieć trzepot skrzydło pył prawdziwy miłość nadać życie sens popatrzeć oczyć chwila świat chcieć trzepot skrzydło pył prawdziwy miłość nadać życie sens popatrzeć oczyć chwila świat chcieć trzepot skrzydło pył prawdziwy miłość nadać życie sens
723,723,kiedyś mówiłeś życie najtrudniejsza gra wierzyłem dobro czuję złość twych mądrych rad zły zostaję niebo niebo powiedz ojcze zmienił świat chciałem mieć niematerialne chciałem móc żyć życie zaparło dech niebo niebo powiedz ojcze zmienił świat czuję złość twych mądrych rad zły zostaję kiedyś mówiłeś życie najtrudniejsza gra wierzyłem dobro,wilki-najtrudniejsza_gra,kiedy:c mówić życie trudny gra wierzyć dobro czuć:v złość twój:a mądry rad:a zły:a zostawać niebo niebo powiedzieć ojciec zmienić świat chcieć mieć niematerialny chcieć móc życie życie zaprzeć:v1 dech niebo niebo powiedzieć ojciec zmienić świat czuć:v złość twój:a mądry rad:a zły:a zostawać kiedy:c mówić życie trudny gra wierzyć dobro
724,724,tacy błądzi pośród zjaw szarych obłokach dnia butów szli wsłuchani mowę traw ludzie dziwili mówili żyć często zastawał świecach świt tacy tacy znali czasu zapomnieli łzach tacy tacy znali czasu zapomnieli łzach śmiali ogarniał strach mieli złota fruwali swoich snach chcieli czym żyje świat odeszli trzymając ręce wśród gwiazd tacy tacy znali czasu zapomnieli łzach tacy tacy znali czasu zapomnieli łzach,wilki-tacy_jak_ja,taki:a błądzić pośród:d zjaw szary obłok dzień:s1 but iść wsłuchać mowa trawa lud:s1 dziwić mówić życie często zastawać świeca świt taki:a taki:a znal czas:s zapomnieć łza taki:a taki:a znal czas:s zapomnieć łza śmiały ogarniać strach:v mieć złoty:a fruwać swój sen:s1 chcieć czy:q żyć świat odeszły trzymać ręka wśród gwiazda taki:a taki:a znal czas:s zapomnieć łza taki:a taki:a znal czas:s zapomnieć łza
725,725,słowa odeszły obrazy myśli niewerbalne postać zjaw znikły lęki słychać dźwięki komety morzu gwiazd złotych schodach kończy czas wielkiej górze czekają demony miłość kres idę dalej widzę dalej czuję dłoni twoją dłoń pora wracać choć pewno kiedyś chciałbym złotych schodach kończy czas wielkiej górze czekają demony miłość kres,wilki-ona_tam_jest,słowo odeszły obraz myślić niewerbalny postać:s zjaw znikły:a1 lęk słychać:v dźwięk kometa morze gwiazda złoty:a schody kończyć czas:v wielki:a góra czekać demon miłość kres iść daleko widzieć daleko czuć:v dłoń twój:a dłoń pora:v wracać:v1 choć:c pewno:d kiedy:c chcieć złoty:a schody kończyć czas:v wielki:a góra czekać demon miłość kres
726,726,mary twist powiedz przyjacielu grasz widzisz celu taką karmę masz zostaw możesz żyć czekam lubię miło widzieć spotkać spojrzeć oczy zamienić parę słów miło widzieć spotkać spojrzeć oczy zamienić parę słów powiedz powiedz raz zranione zwierze miejscu ciągle gnasz zostaw możesz żyć czekam lubię pić miło widzieć spotkać spojrzeć oczy zamienić parę słów miło widzieć spotkać spojrzeć oczy zamienić parę słów,wilki-mary_twist,mary:s1 twist:s1 powiedzieć przyjaciel grać widzieć cel taki:a karma mieć zostawić móc życie czekać lubić miło widzieć spotkać spojrzeć oczyć zamienić para słowo miło widzieć spotkać spojrzeć oczyć zamienić para słowo powiedzieć powiedzieć raz:s1 zranić zwierzy miejsce ciągle gnać zostawić móc życie czekać lubić picie miło widzieć spotkać spojrzeć oczyć zamienić para słowo miło widzieć spotkać spojrzeć oczyć zamienić para słowo
727,727,płonie wielki ogień wielki wyzwolony mówisz ludzie chcą słuchać widzisz dzieci tańczą śniegowy taniec krzyczysz słyszą tańcem opętane płoną martwe wieki dzień narodzin miał bogiem krzyża uciekł światła rażących lamp domy okien rozpalił ogień zgasło życie czas czas,wilki-pastylki,płonąć wielki:a ogień wielki:a wyzwolony mówić lud:s1 chcieć słuchać widzieć dziecko tańczyć śniegowy taniec krzyczeć słyszeć taniec opętany:a płony martwy:a wiek dzień:s1 narodziny mieć bóg krzyż uciec światły rażący lampa dom okno rozpalić ogień zgasnąć życie czas:v czas:v
